"Text","Language","Source","Date"
"Wrong answer, 'NA' ended because Christopher Hitchens died and the IRAQ war backfired . 'NA ' as a political movement was a bad idea. That was the whole point of ' separation of church and state'. Atheistic anti-theism and secularism are related but they are not the same thing . The biggest problem with new atheist youtube rant s are the lack of respectful moderators to help the speakers resolve their issues off camera. Too much improv and not enough collaborative scripts. I do not approve of your orientation's lifestyle decisions ; but I am not going to push for laws against your kind. Businesses offering employment are discriminatory against the underprivileged by default and so it was a matter of time before the undereducated rose up and blamed it on privileged college graduates who should have known better .","en","relativeinsight","2019-08-01T00:00:00"
"Used to be part of the atheist community. Still an atheist, but I realized it was time to leave.","en","relativeinsight","2019-08-01T00:00:00"
"Having been around at the time, two observations on the 'golden age' of internet atheism:  1) At no point were The Amazing Atheist or Thunderfoot ever worth following - the former is an unfunny wannabe comedian with a  'schtick', while the latter, despite his academic credentials, has only ever produced videos of snarky nitpicking lacking the educational quality of his more talented peers, and revelled in his regular intellectual 'defeat' of a poorly educated child, only to have his ass handed to him at the first time of asking, by the flimsiest of libertarians.  2) The 'new atheist' community was never as intellectually rigorous and rational as it liked to pretend to be, even at the start.  Around ten years ago, I (having a postgraduate education in Classics) served for a while as the 'resident historian' for an online atheist group debating creationists. After about six months, several members of the group contracted belief in the 'Jesus Myth Hypothesis' (a conspiracy theory based on an idea disregarded by actual historians decades ago, as it was incompatible with our improved understanding of ancient myth), and I buggered off once I go sick of hearing how the opinions of peer-reviewed scholars were unimportant, my field of academia was 'invariably skewed to a pro-christian worldview', and that making gish gallops and ignoring complex rebuttals is perfectly fine when you're the one that's doing it, and it's in support of an idea confirms something that you already believe.  Numerous internet atheists endorse the Jesus Myth Hypothesis.","en","relativeinsight","2019-08-01T00:00:00"
"I also am a feminist who is not a fan of Anita Sarkeesian. I find her videos to be mediocre, lacking in poignant points or originality, boring, and lacking any sense of their audience.   Her videos are too boring and pseudo-academic to appeal to a general audience and too basic to be appealing to anyone else.","en","relativeinsight","2019-08-01T00:00:00"
"/u/Aalewis destroyed atheism","en","relativeinsight","2019-08-01T00:00:00"
"1:36 what's that video? I mean, research commands me to ask.","en","relativeinsight","2019-08-01T00:00:00"
"5:25 _but not all anger is righteous;    ......and some feelings are best kept to yourself._ I'm going home.  You've just won the internet!","en","relativeinsight","2019-08-01T00:00:00"
"New Atheism died with Christopher Hitchens.","en","relativeinsight","2019-08-01T00:00:00"
"Jesus christ. Red Label? Get the fuck off the internet.","en","relativeinsight","2019-08-01T00:00:00"
"Many good points... but lumping Shoe in with Milo seems uninformed. I think you might have reconsidered of late?","en","relativeinsight","2019-08-01T00:00:00"
"RE: Thunderfoot and LadyButts  I think you have mischaracterized Anita's position, and thus caricatured TFoot's disagreement.  The series is called 'Tropes vs Women in Video games' and it aims to point out 'harmful stereotypes' and other such things. Sarkeesian is not simply observing a pattern, she is an advocate. Her claim, both explicit and implicit, is that Butt Sway is inaccurate, a stereotype added in to titillate the 'Presumed straight male audience'. TFoot's response is that women DO have exaggerated hip sway compared to men, because of a different bone structure, and while the character may be attractive, that walk is reasonably natural.   You essentially took the position that TFoot was saying that men do not in fact like looking at butts, whereas he was responding to the claims of Sarkeesian that the butt motion in question was somehow unrealistic or inaccurate, and also that it was harmful to have that claimed inaccuracy.","en","relativeinsight","2019-08-01T00:00:00"
"well one side came to the argument saying 'You are either a feminist or a sexist' and require that you label yourself as a feminist before they will even consider what you are saying..","en","relativeinsight","2019-08-01T00:00:00"
"2:37 Thank you","en","relativeinsight","2019-08-01T00:00:00"
"So glad I found your channel!","en","relativeinsight","2019-08-01T00:00:00"
"Just wanted to point out I've seen female atheists but they were blasted online and made their videos private because of the nasty harassment.  Jaclyn Glenn gets a lot of crap from both sides,  These guys who claim to be rational put feminists 'women' down... you don't even have to proclaim yourself a feminist.  A woman speaks up about religion or any topic especially in regards to women and they scream FEMINIST like it's a bad thing.  I used to try and be against feminist but men don't want to include women in their intellectual discussions let alone let them have a platform without commenting about their body parts.  It's taken some time but I've decided that I must be a feminist if treating women like human equals is frowned upon by the majority of men that are supposedly 'rational'.","en","relativeinsight","2019-08-01T00:00:00"
"both atheism and feminism are ideologies willing to submit to islam.","en","relativeinsight","2019-08-01T00:00:00"
"It's creepy how obsessed all these youtubers are with Anita Sarkesian.","en","relativeinsight","2019-08-01T00:00:00"
"this is powerful <3","en","relativeinsight","2019-08-01T00:00:00"
"I love your videos but the only thing is that I can't differentiate sarcasm from seriousness. I mean, you really dislike Anita and this other feminist girl?","en","relativeinsight","2019-08-01T00:00:00"
"idk, I agree somewhat with Anita on the stuff she says about video games, but some video games are praising the beauty of femininity, not everyone has to be masculine to be empowering. but, the blatant objectification is far more common. I mean, a good example of badass femininity would be The Boss from Snake Eater. a not so good example would be Quiet from The Phantom Pain. She literally does not speak and her icon in the game is her boobs. And the half-assed explanation on why she 'just has to be naked' is...well, half-assed!","en","relativeinsight","2019-08-01T00:00:00"
"Feminism and atheism have nothing to do with one another.","en","relativeinsight","2019-08-01T00:00:00"
"Soooo... Muuuuuch.... MILK! Bahaha!","en","relativeinsight","2019-08-01T00:00:00"
"did the fat guy in the sunglasses ever find jesus?","en","relativeinsight","2019-08-01T00:00:00"
"The atheist movement ended because we won, right?  Religion no longer has any social power in America, and the highest political offices are held by atheists","en","relativeinsight","2019-08-01T00:00:00"
"Who is the guy to the right of lauren southern above the antelope","en","relativeinsight","2019-08-01T00:00:00"
"Wait so is Thunderfoot wrong about Anita or not?","en","relativeinsight","2019-08-01T00:00:00"
"Let's see what you got, Contra. I haven't seen anything other than your talk with Theryn & a small segment of your debate with Blaire.","en","relativeinsight","2019-08-01T00:00:00"
"Sarkeesian of Anita is a fucking grifter milking the feminist tit. Thunderf00t got pissed drunk and octopussy at an atheist conference and the 'rapist' fallout soured him.","en","relativeinsight","2019-08-01T00:00:00"
"I agree with a lot of your points, here are some that i don't.  The data actually proves that the wage gap is non-existent, and that there is not systemic sexism in hiring.  Does that mean neither of those things happen?  Of course they do, but it is not systemic.  Second, I think that them bashing extreme feminism is just as important as you bashing them for their reaction.  Both are over the top, however, extreme feminism is the one getting all the air time, and the one that is making policies, and that is bad, very bad.  All extremism ever does, is divide and then conquer and you can already see it happening.  Men cannot talk about men's issues without feminist protesting, calling them all sexist and rapist and rape apologist, it is insane.  I dated a feminist, she literally believed that all men were rapist, but that most men barely control it.  It got to the point that I never would instigate any kind of touching or sex because when men do it, per her, it is misogynist and patriarchy.  No, extremism needs to be called out over and over and over to the point of boredom to tears because these are the voices that are being heard and making policy.","en","relativeinsight","2019-08-01T00:00:00"
"I know more women who hate feminism than I know women who identify as feminists. The strongest women I know are anti-feminism.","en","relativeinsight","2019-08-01T00:00:00"
"I don't like Rebecca Watson very much, but I was a regular SGU listener from '08 and I want to make it clear that I didn't like her very much well before hashtag elevatorgate and for entirely different reasons (I found her too obnoxious)","en","relativeinsight","2019-08-01T00:00:00"
"New Atheists discredited themselves by their self righteous arrogant attitude toward religion. Then came the Intersectional feminists, with their own brand of fanaticism. blaming men because there weren't enough women interested in going to the conferences. It's pretty much all bat shit crazy from many different angles.","en","relativeinsight","2019-08-01T00:00:00"
"I'm getting into the habit of figuring out who a person is before commenting on their views, and Thunderfoot is no exception. Way to waste your platform! He moved from videos about science back in 2007, to making 74 videos (and counting!) about how he hates feminism, SJW's, and Anita Sarkeesian! I was looking at his old vids from 9 years ago, and when I see what he creates now in 2017, I just feel sad.","en","relativeinsight","2019-08-01T00:00:00"
"damn so i guess shit isnt just black and white! what a concept!","en","relativeinsight","2019-08-01T00:00:00"
"*On the revocation of white privilege in North Korea* Holy shit that guy was literally a student who was abused by a dictatorship. What kind of sociopaths are these people!","en","relativeinsight","2019-08-01T00:00:00"
"How has Feminism destroyed everything? Because there is more then one type of feminism, some of them are diametrically opposed to each other. Just like classical liberalism, and maybe even neo-liberalism, it's eating itself up and giving fuel to schmucks like Milo.","en","relativeinsight","2019-08-01T00:00:00"
"Wow someone on the Internet managed to post reasoned criticism of both anti-feminists and feminists?! Is this real life?!  Thank you Contra! We need more attempts at objectivity in the world, and it is possible to say that reactionaries are making bad arguments but also maybe Anita might get pedantic and sex-negative about a lot of things.","en","relativeinsight","2019-08-01T00:00:00"
"'and christian mingle'","en","relativeinsight","2019-08-01T00:00:00"
"What's that end song pls.","en","relativeinsight","2019-08-01T00:00:00"
"You're a funny fucker contra ","en","relativeinsight","2019-08-01T00:00:00"
"I honestly don't know where the dislikes came from on this one...the right or the left. probably both","en","relativeinsight","2019-08-01T00:00:00"
"I want to like this video, you do seem pretty reasonable and able to present yourself, you seem abel to make videos interesting, which is good, I think that gives it a better ability to reach across the isle, which is something desperately needed. But I'm ticked off by what I perceive as misrepresentations. None of which I'm particularly outraged over, but I'm a miserable keyboard warrior with nothing better to do with my life than to write long comments on the internet hoping that someone will care, so here goes.  I get that your opening montage of youtube atheists being jackasses is supposed to be exaggerating, but why call Thunderf00t the 'self-appointed leader and champion of the atheist community'? What's that even based on? I've alway seen him as slightly apart from the rest of the community. I get that he kind of a douchebag, but I can't remember ever getting a sense that he thinks he leads anyone. Why do you associate other anti-SJWs/anti-feminists/social right people/whatever you wanna call them with him?  I'd say that I agree with Thunderf00t the bit you played of him responding to Rebecca Watson. As a person who's often in the middle of this social divide, shit like that is a fucking massive turnoff. It's immature, toxic, counterproductive and not funny, and she apparently felt it was worth uploading. How is Thunder thinking that that's stupid jackass behaviour supposed to make him look bad?  I get that calling the Drunken Peasants Podcast a 'conference call to critique Rebecca Watson' is exaggeration, but still it ticks me off. I will however agree, that whilst I like DP, I think it ought to stay away from anything that has any chance of being productive, because it's a format that seems set up to fuck with any chance to have good relations with the people you interact with. It's a format that promotes instant responses, constant interruption, kneejerk-reactionary side-choosing, group-repetition and embellishment, etc, etc, everything is a circus, no one reflects on anything, and often just create toxicity. That being said,I think it's worth granting them some leniency, it's a stupid, laid-back podcast, I think that what they said about Rebecca was bad, but too harmless to be worth anything in a video like this. Of course they lingered on it for a long time, that's because it's more about them hanging out, bullshitting and going on tangents than it is about the things they watch.  Still, I look forward to checking out more of your videos.","en","relativeinsight","2019-08-01T00:00:00"
"So you're complaining about people complaining too much.","en","relativeinsight","2019-08-01T00:00:00"
"...and Christian Mingle. lol","en","relativeinsight","2019-08-01T00:00:00"
"'He doesn't respond to or even seem to be aware of the body of scientific evidence that misogyny is real, that workplace discrimination hurts women...'  I don't mean to be one of 'those' guys, but what are you talking about? Will you please cite the sources? I consider myself a Marxist feminist, which means I desire the evidence that supports my views, but I don't ignore problems with that evidence not being forthcoming. I know it's a shot in the dark since your channel is increasing in popularity, but please respond. thanks.","en","relativeinsight","2019-08-01T00:00:00"
"Amazing bullshit interpretations of almost everything. Pour some of that Clorox into my eyes and ears.","en","relativeinsight","2019-08-01T00:00:00"
"What the fuck exactly do feelings have to do with atheism? The Atheism+ CULT split online atheism communities by demanding things unrelated to atheism be focused on.","en","relativeinsight","2019-08-01T00:00:00"
"your conclusions are completely shit.","en","relativeinsight","2019-08-01T00:00:00"
"I really enjoy watching feminists engage in serious debate. You usually end up learning a lot. Hell, even non-feminists debating feminists is entertaining and, in my opinion, educational. Unfortunately, YT 'anti-feminism' (even calling it that is a stretch because it implies they actually use real arguments to oppose feminism) doesn't engage in actual debate. They pick the lowest hanging fruit and punch it for 20 minutes straight, declare victory and reap the patreon moneys.","en","relativeinsight","2019-08-01T00:00:00"
"THANK YOU! THANK YOU! THANK YOU! THANK YOU! THANK YOU! THANK YOU!  For this video! Finally some sense. We were so busy defending Anita Sarkeesian for saying whatever she feels the need to say without these reactionary bullies trying to mock and intimidate her into silence, that we never get around to tell her that some of the things she says is actually over-the-top, trite bullshit.","en","relativeinsight","2019-08-01T00:00:00"
"Does... Thunderfoot not know that people have different looking butts? Has he looked at a sizable enough sample of butts to determine video game butts are an objective rendering of butts? Come on, man, you're a scientist, you should know about sample sizes!   Butts.","en","relativeinsight","2019-08-01T00:00:00"
"Feminism is a tribalist special interest group for women. These groups have managed to achieve a definition of sexism in academia that literally excludes men from being the victims of gender based discrimination. They continue to promote female gender specific hiring lists, career events and lobbying positions. This does not mean no sexism against women exists, it means feminism is a terrible vehicle for solving it because whatever argument it trudges into it brings its hypocritical baggage with it.","en","relativeinsight","2019-08-01T00:00:00"
"A gay nazi who fucks black men.....right....you bullshitter contrapoints","en","relativeinsight","2019-08-01T00:00:00"
"Fuckin woke i guess.","en","relativeinsight","2019-08-01T00:00:00"
"Why am I finding this just now? That was AMAZING! When you said 'there is a surge in right-wing presentations on the internet', I completely agree and noticed this too! While I generally agree with many of their points, a lot of times they take very lazy, border-line intellectually dishonest views of their opposition.","en","relativeinsight","2019-08-01T00:00:00"
">Feminism didn't not destroy atheism, it just faded away  Wrong. Feminism drove a wedge between the atheist community. Every hear of Atheism+? That was one of the catalysts that sparked a massive division in the movement. I specifically remember people being segmented because of that, especially here on Youtube. Funny how you leave that out.","en","relativeinsight","2019-08-01T00:00:00"
"you got my sub","en","relativeinsight","2019-08-01T00:00:00"
"THANK YOU FOR EXISTING","en","relativeinsight","2019-08-01T00:00:00"
"subbed because 'Thunderfeet'","en","relativeinsight","2019-08-01T00:00:00"
"You're logical, witty, funny, and your comment section is not a valid reason to commit suicide? Subbed!","en","relativeinsight","2019-08-01T00:00:00"
"Very minor detail but I kinda get stuck on this a lot, wonder if some atheists could elaborate.  How is it not a belief system?  Its definition is to not believe in gods - it is a thing defined by a limitation to what your beliefs can be.  Like all the religions are.  It's clearly not a religion since it doesn't have like, membership rituals and holy places and whatnot - all stuff that contributes to the vague meaning of what is a religion.  But a belief system isn't that, it's far more basic and straightforward - a category of your beliefs.  They can be no beliefs, and it's still a category of what your beliefs are (besides which this definition of atheism doesn't necessarily mean 'no beliefs' so long as they aren't god-based ones).  Being as atheism is based entirely upon this categorization of someone's beliefs (for them not to be god-based), what's wrong with calling it a belief system?  What's even the jump to defend against that?  I don't get it.  People seem to react to it like it's some kind of insult or accusation.  This just puzzles me.  It's surely only meant to be a useful way of meaning a rough sum of one's beliefs?  Is there some kind of history here that I'm unaware of, like someone stumbling across a hate word they don't know is a hate word?  Like, how unnecessarily difficult would it make maths if we insisted that nobody could call zero a number?  It may have an essentially different quality to other numbers, but it's still useful to call it the thing that those other numbers are, for like... doing maths.  In the same way, with a thing that doesn't necessarily even mean 'no beliefs' (but could and often does), why not call that a 'number' like the other 'numbers'?  Just because it's (probably) a zero?  This may have been an incredibly clumsy metaphor (kinda typical of me) but I'm just trying to illustrate the point here, get at why it's useful to have a term for these categories.  Alternatively perhaps, what else do you want people to call it?  There wants to be a way to say this, so what way would be appropriate?  I've heard it suggested I use 'worldview' but that term's too umbrella (aside from being a bit flowery and pretentious-sounding) - it covers politics and other such stuff like that.  You could use 'worldview' to describe how one atheist is against a particular economic principle that another atheist is campaigning for, so no it's not useful in the same way.  You might as well use the word 'mindset' if you're gonna go that wide.  No; I would want a term to mean (and only mean) the same thing that 'belief system' means for all the other sets of things that people believe in (if it really, really does have to be a different term in the first place which again, I don't understand the aversion).  And then I'll use that term for everything, not just atheism, and drop 'belief system' entirely.  Heck, I don't care what words it's called!  Just want for there to be a term in the first place, that's all.  Or is there something I'm not seeing here that makes having such a term problematic at the core?  If so I'd definitely like to understand that.  Still really curious what the pricklyness around the term is about to begin with.  That'd probably shed a lot of light on this thing that's just... been picking at my brain for ages now.","en","relativeinsight","2019-08-01T00:00:00"
"I think your video's fatal flaw is that you use the example of Thunderfoot reacting negatively to a joke and say it's evidence that the 'entire skeptic community' is quick to take offense.  And then there's the textbook Kreepi Kristi Winters argument, 'MUH ROBUST FEMINIST ARGUMENT.' No, the one here who's cherry-picking and over-simplifying political movements is you. Our problems with feminism go far beyond 'WELL WE DONT LIKE WOMEN.' I mean, have you ever taken a bit to actually watch one of TL;DR or Sargon's videos? Have you actually listened to Milo speak? He's not a nazi, he isn't even a member of the fucking alt-right- those guys hate him because he's a gay jew anyways.","en","relativeinsight","2019-08-01T00:00:00"
"I know I have some privilege as a Danish person but all of the 'horsemen' was and are ass","en","relativeinsight","2019-08-01T00:00:00"
"REEEEEEEEEEEEEEEEEEEEEEEEEEEEEEEEE","en","relativeinsight","2019-08-01T00:00:00"
"I like Thunderf00t's scientific approach to responding to SJW beliefs. Sexual dimorphism is a concept of biology which he introduced me to, and which is very intriguing. Though, I will grant you that he focuses on the easiest elements of his opposition to criticize, and makes sweeping generalizations therefrom. That's a perfectly fair criticism. He should be willing to make concessions wherever warranted, but he seems to ignore areas that don't perfectly fit his ideology. To be clear, I'm not opposed to his ideology, but he should be willing to present the case and points which support the other side, if only to help us understand their reasoning.","en","relativeinsight","2019-08-01T00:00:00"
"Holy shit, an actual, intellectual objection to Anita Sarkeesian? *inset 'what year is it?' meme here*","en","relativeinsight","2019-08-01T00:00:00"
"is dat da cowboy bebebop in el back","en","relativeinsight","2019-08-01T00:00:00"
"1. Don't get drunk 2. Don't grope women 3. Debate over 4. Orgy  I think I got lost somewhere","en","relativeinsight","2019-08-01T00:00:00"
"mansplain is not just a weird language alienating jargin. It's REAL.","en","relativeinsight","2019-08-01T00:00:00"
"......I cant tell if i love your videos cause youre smart as hell or cute as fuck, tbh","en","relativeinsight","2019-08-01T00:00:00"
"I think you are a little hard on Anita. I thought she made a not band entry point (well for me anyhow) into feminist thinking. Maybe it is a little 101 but that is where some people need to start.","en","relativeinsight","2019-08-01T00:00:00"
"*thunderfeet*","en","relativeinsight","2019-08-01T00:00:00"
"As yet, I think, unsurpassed. Interesting.","en","relativeinsight","2019-08-01T00:00:00"
"Finally I found someone who has the same thoughts as I do on this topic. Subscribed. ","en","relativeinsight","2019-08-01T00:00:00"
"I think your far nicer to the atheist community than they deserve. They're an extremely toxic, sexist & racist community of angry white boys/men who hate everyone but themselves. And just like you said, to some of us, Anita might be saying the obvious but as exemplified by these amazing specimens it doesn't seem to be so obvious to everyone so maybe there is a point to repeatedly stating the obvious.","en","relativeinsight","2019-08-01T00:00:00"
"Rebecca Watson vlogs more about science than Thunderfoot does.","en","relativeinsight","2019-08-01T00:00:00"
