"Text","Language","Source","Date"
"I miss scuffed contrapoints.","en","relativeinsight","2019-08-01T00:00:00"
"'And christian mingle' Im fuckin dead lol","en","relativeinsight","2019-08-01T00:00:00"
"My wife likes to look at women's butts. Almost everyone likes looking at butts. Butts are great","en","relativeinsight","2019-08-01T00:00:00"
"You know, it's like when Trump first got elected, and was just talking about a Muslim band, and people come out, in every state, in fucking droves, to protest. But later on, once the Muslim ban actually passed, people were like 'yawn. The last season of Game Of Thrones is about to start. Ain't nobody got time to protest'. Oh, and people were super concerned about 'kids in cages' for all of four minutes.( But at least now the Democrats are doing something about that.)   What I'm trying to say is: considering lawmakers continue to strip away reproductive and LGBT rights in the name of their iron-age myths. People need to get unbored with atheist activism real fucking quick.   This is why we continue to, and will always continue to, lose elections. No matter how 'woke' we like to think we are. There's nothing that screams privilege more then the option to be apathetic and not stand up. Anyone out there think the Civil Rights Movement was an optional, trending, passing fad? I don't think so. What does it take to keep people interested in the good fight?","en","relativeinsight","2019-08-01T00:00:00"
"8:11 had me rolling.  'Tedious Antelope, Slenderman, The Dragonborn, A Gay Nazi, The Tin Man, A Stilted Vampire, A Sumerian Monarch, A Fake University, and The Queen of the Internet.'","en","relativeinsight","2019-08-01T00:00:00"
"I've done it! Seen every single one of Natalie's Youtube vids","en","relativeinsight","2019-08-01T00:00:00"
"You were really handsome and boyish as a boy,  u should have stayed as a man.","en","relativeinsight","2019-08-01T00:00:00"
"So weird watching Contra's old videos. She really did change.","en","relativeinsight","2019-08-01T00:00:00"
"...i thought her joke was kinda funny lol","en","relativeinsight","2019-08-01T00:00:00"
"Oh my god, Natalie! Its been so long since I've watched this and it feels like a god damn other world.","en","relativeinsight","2019-08-01T00:00:00"
"I stopped watching the drunken peasants because they just kept shitting on feminism and women","en","relativeinsight","2019-08-01T00:00:00"
"Now you have taken U turn on Anita don't you!","en","relativeinsight","2019-08-01T00:00:00"
"Oh god, that ending. Natalie, you are perfect and beautiful, just as you said :3","en","relativeinsight","2019-08-01T00:00:00"
"The reason new atheism died out is because one of it's icons, Christopher Hitchens died.  If you think papers that come out of gender studies are 'scientific evidence' then you're just flat out delusional.  If you think feminist 'facts' are true then you haven't looked into the topics yourself.","en","relativeinsight","2019-08-01T00:00:00"
"i really needed to hear her speak","en","relativeinsight","2019-08-01T00:00:00"
"I like lady butts too!","en","relativeinsight","2019-08-01T00:00:00"
"Richard Dawkins said he was a feminist.","en","relativeinsight","2019-08-01T00:00:00"
"I feel like these men feel like they have rights or something to touch women's boobs whenever they feel like it","en","relativeinsight","2019-08-01T00:00:00"
"Seeing more of what TJ has been up to in recent years makes think about that time when I was 18 and he sent me a very banana gate-esque video and the untapped revenue stream it could have provided me, had I not deleted it.","en","relativeinsight","2019-08-01T00:00:00"
"also was this her first vid or were there priorm","en","relativeinsight","2019-08-01T00:00:00"
"I don't know know if it's sorta offensive, but I find both her older and newer voice very interesting in their own ways","en","relativeinsight","2019-08-01T00:00:00"
"As an atheist, I fucking hate every atheist community I've seen","en","relativeinsight","2019-08-01T00:00:00"
"I disagree, though. For most of the video games Anita Sarkeesian reviews you really don't have to 'nitpick' to see the open misogyny.","en","relativeinsight","2019-08-01T00:00:00"
"Kind of ironic to call feminists 'triggered' and whiny, while making about hundred videos about Anita Sarkeesian. But of course people like Sargon of Akkad 'don't care'.","en","relativeinsight","2019-08-01T00:00:00"
"Just the other day I was thinking about how radical atheists seemed to totally disappear from the cultural debate a few years ago. But I can honestly say I haven't even thought about Thunderfoot for more than half a decade. And I used to watch his stuff all the time back in the day before he started randomly attacking other science educators and generally acting like an entitled douche. I didn't even know he'd gone so totally off the deep end at feminism in his twilight years.","en","relativeinsight","2019-08-01T00:00:00"
"I'm a very masculine heterosexual man and I love Rebecca Watson's videos. Jus' sayin'...","en","relativeinsight","2019-08-01T00:00:00"
"Those ancient clips of Contrapoints, when mentioning her involvement in the early YouTube Atheists was that on a different channel?","en","relativeinsight","2019-08-01T00:00:00"
"just substitute the word females for the word 'feminists' and you'll get to the real crux of what these people are on about.","en","relativeinsight","2019-08-01T00:00:00"
"I think thunderfoot's neck gets thicker every time he records a video","en","relativeinsight","2019-08-01T00:00:00"
"'I'm not finding Jesus anywhere'","en","relativeinsight","2019-08-01T00:00:00"
"Christopher Hitchens always said that 'Neo-Atheism' was nonsense and didn't agree with the label.","en","relativeinsight","2019-08-01T00:00:00"
"most of these people are also people from the skeptic community if you wanna find the real athiest community search creators like jacklyn glenn cult of dusty telltale and cosmic skeptic there is also hilth but he talks mostly about flat earthers","en","relativeinsight","2019-08-01T00:00:00"
"Laci has moved on so much that she's now 'took the red pill'...","en","relativeinsight","2019-08-01T00:00:00"
"What's questionable about Anita's crowdfunding practices?","en","relativeinsight","2019-08-01T00:00:00"
"I like to look at woman's butts lol","en","relativeinsight","2019-08-01T00:00:00"
"8:52 'When did we all agree to just write off people, who are like, 'You broke that bitch's tit when you were drunk.''  Wait.... Who did what? That's an oddly specific example there. Did this actually happen or was this supposed to be a 'joke'? But does that even matter? Either way, NO! I agree to write that guy off. I write him right off! How does anybody consider this idiot an 'intellectual'?","en","relativeinsight","2019-08-01T00:00:00"
"Epic foreshadowing in the end.","en","relativeinsight","2019-08-01T00:00:00"
"Those catholics have some mommy issues with the Virgin Mary and all. It's just mysogynist! Atheists are like 'hold my beer'.","en","relativeinsight","2019-08-01T00:00:00"
"I never thought Anita sarkeesian was a real feminist. I always thought she was a radical misandrist sexism baiter, who used her talking points to make an income. And Thunderf00t should not have fallen into the trap of conflating feminism with misandry.","en","relativeinsight","2019-08-01T00:00:00"
"of all the atheists that i was following and adored from the height of that movement before it just totally collapsed because they couldn't grasp that maybe being sexist and racist was completely turning people off from atheism, it seems like bobby henderson is the only one that made it out okay? his spaghetti monster blog is rarely updated anymore and most of the posts seen immediately are all posts calling out trump and all around being a good person still or just silly posts with people with colanders on their heads because fuck it - its the flying spaghetti monster, certainly aint gonna go much deeper than that. i dont really know what bobby is up to more than that, but he seems to be the only prominent male atheist from that era that hasn't become a major douchehole.","en","relativeinsight","2019-08-01T00:00:00"
"3:00 blue is the conservative colour in the uk and i was just looking at that for a solid minute trying to figure it out","en","relativeinsight","2019-08-01T00:00:00"
"I'm surprised Contra hasn't put a comment here or in the annotations to correct her misconceptions about Anita Sarkeesian - because I think that's a pretty important point... she is like one of the least objectionable people in existence, and these losers are losing their minds over her. I think that's an important point to emphasize.","en","relativeinsight","2019-08-01T00:00:00"
"I need to find the original video where that guy is looking for Jesus in the weeds","en","relativeinsight","2019-08-01T00:00:00"
"Not all atheist YouTubers are antifemmenist. Watch Mr. Atheist, he's a pansexual atheist who's incredibly feminist, pro-lgbt, and overall a sweetheart. He focuses his content around pointing out dangerous indoctrination in religion, which leads him to mostly talk about women and lgbt folk. It's quite refreshing to see.","en","relativeinsight","2019-08-01T00:00:00"
"I have to disagree.  Yes it is true atheism had become stale and stagnant, but it still had a sense of community.  Feminism destroyed that sense of community.  Many things could have killed the atheist movement, but it was feminism that actual shoved the knife in and twisted it.","en","relativeinsight","2019-08-01T00:00:00"
"Inside all us, is a better thesaurus. If you're not looking, you'd better be making great conversation, or have a loving well of silence where understanding and comprehension are kind of repeating orgasm, offering deserved self-praise for the sentences you've written, the sentences you've spoken, and, perhaps, a certain appreciation of the term 'jigglerum', which is derived from the Latin 'semen', or the salt on a baby's life-egg.   See also: ladies do produce a type of jigglerum.   Please, ignore: any Black Tom Cassidy's who insist jigglerum is slang for Kool-Aid drank from the anus; it is not.","en","relativeinsight","2019-08-01T00:00:00"
"Hey, can someone explain me how did her voice changed so much? Is there a surgery that changes your voice?","en","relativeinsight","2019-08-01T00:00:00"
"If social justice warriors were like contrapoints, all these guys wouldnt have a job and i would have gotten something done the past 3 years.","en","relativeinsight","2019-08-01T00:00:00"
"I wouldnt say it died out. Lot of guys still cover it","en","relativeinsight","2019-08-01T00:00:00"
"She's changed so much what","en","relativeinsight","2019-08-01T00:00:00"
"Since when did Elliot Rodger belong to any particular movement? More mental illness than ideology. It isn't unreasonable to assume that he would have become violent without the influence of PUA forums. He could have as easily been radicalized elsewhere.  Even the PUA 'pimps' themselves are self-aware enough to realize that they will more often fail at what they do than they will be successful, which is a distinct difference in the level of narcissism that Elliot Rodger's had (which was weird, because it was mental illness).  So Elliot Rodgers was someone unrelated to both sides of the ideological dispute, sort of like a bomb going off outside the discussion booth. That somehow got adopted and used as a means to blame another side within the ideological bubbles.","en","relativeinsight","2019-08-01T00:00:00"
"Rebecca Watson => Epic trolling right there Poor little Tfoot didn't have a clue. Oblivious, he proceeded to take the bait and instantly swallowed the hook.","en","relativeinsight","2019-08-01T00:00:00"
"I hate being homosexual , because people think I'm left when I not I don't care modern politics","en","relativeinsight","2019-08-01T00:00:00"
"Throwback, whoa...","en","relativeinsight","2019-08-01T00:00:00"
"I know you don't like to go back and watch your old videos but I just wanted to let you know that this was the first video I ever saw on your channel and it came up in my timeline. Thank you so much for this and it's amazing to see you the woman you are now!","en","relativeinsight","2019-08-01T00:00:00"
"How did I not see this earlier?? THANK GOD someone made a video around that topic. That cult-like obsession with feminism annoyed the shit out of me (a strong believer in the atheist movement to this day), it totally destroyed the atheist's self-proclaimed picture of people who wanted to improve the world through humanism. Turned out most of them were one-dimensional misagonysts trying to make money with irrelevant talking points..","en","relativeinsight","2019-08-01T00:00:00"
"Be my Edward Paul","en","relativeinsight","2019-08-01T00:00:00"
"Oh my God the ending is so perfect it's insane","en","relativeinsight","2019-08-01T00:00:00"
"You've come a long way Nat. Keep it up.","en","relativeinsight","2019-08-01T00:00:00"
"If you want to talk with me, go ahead my dear. I do with you.","en","relativeinsight","2019-08-01T00:00:00"
"The YouTube atheist community makes me, an atheist myself, cringe so hard. I wish these people weren't what people think of when they think 'atheist'.","en","relativeinsight","2019-08-01T00:00:00"
"I discovered Contrapoints a bit ago, and it's a shame how badly you are misrepresenting TJ here.  They are not critiquing Rebecca Watson's views on anything other than claims of blackmail and burying research 'that could save lives' at this point, and they are laughing at these claims. TJ is making a parody of her rabble rousing. At this point it has already been established this groping didn't even happen. It actually has nothing to do with feminism, or Rebecca being 'a women they don't agree with.' Tj doesn't even bring up her gender.  If you didn't cut the clip mid-sentence, you'd understand it was a parody:  'And I mean like when did we all agree to just write off people who were like 'you  fuckin groped that bitch's tit when you were drunk- therefore you have no worth as a human being now. You are cast out into the wastelands to die the death you deserve.'  Right. That's not saying groping is okay. He's saying that the accusation, even if true, doesn't warrant her response.  The only thing kinda funny about all this is that Rebecca accuses a guy of being a sociopath, and Tj says even if he argues it, he's still stuck defending himself about not being a sociopath. You're pretty much doing the same thing here, and now I'm defending TJ for not supporting molestation. It's just kinda shitty when anyone misframes a clip.","en","relativeinsight","2019-08-01T00:00:00"
"I'm not gonna lie pre transition contra and post transition are both hot","en","relativeinsight","2019-08-01T00:00:00"
"When you made this video thunderf00t was for sure being a turd and a half  More recently he has, thankfully,  changed his direction  His channel is now enjoyable again","en","relativeinsight","2019-08-01T00:00:00"
"I don't know how you feel about this three years later, but my take on Anita was that her painfully obvious points are still not painfully obvious to some people, which is why she needed to make those videos.","en","relativeinsight","2019-08-01T00:00:00"
"I honest to god have no idea what to say except that guy escaped from a high security psychiatric asylum.","en","relativeinsight","2019-08-01T00:00:00"
"It's really weird to watch a critique of Godnita in 2019, since we're preaching to her for last 2 years. I mean, how dare you critize the goddess?","en","relativeinsight","2019-08-01T00:00:00"
"I strongly disagree with the amount of criticism you constantly level against Anita. You at one point say that not all criticism needs to be verbalized, but you never hold back against her. It's in every video.","en","relativeinsight","2019-08-01T00:00:00"
"what happened in 08/09/2014?","en","relativeinsight","2019-08-01T00:00:00"
"gotta love when criticism from two different angles either cancels out the criticism or points at a more nuanced criticism needed. Most retorts follow 'the way you view the situation is wrong, but the situation happened' or 'the situation didn't happen, so your view doesn't work here'.","en","relativeinsight","2019-08-01T00:00:00"
"Huh...I remember AronRa and Edward Current now that I think about it; the fact I haven't heard anything about them lately like I have with Thunderf00t, Sargon, and the Amazing Atheist PROBABLY means they didn't go from 'I'm a rational thinker' to someone Richard Spencer thinks is a great introduction to the alt-right and/or the anti-SJW camp.","en","relativeinsight","2019-08-01T00:00:00"
"Feminism destroyed the west, forget about atheism.","en","relativeinsight","2019-08-01T00:00:00"
"Wolfkin?  Forbidden Lands reference?!   yeah. that's my take away here.  also, ladybutts.","en","relativeinsight","2019-08-01T00:00:00"
"You are smarter than Thunderf00t.","en","relativeinsight","2019-08-01T00:00:00"
"In 300 years, some people will spend their whole lives debunking the existence of a real Harry Potter.  It will be a sad job that no one wants to do because debunking absurdities is hard work that never ends in the short term.  Plus it's an absurd necessity.  Atheists lose their zeal because they want a more meaningful occupation before they die.","en","relativeinsight","2019-08-01T00:00:00"
"I remember I got into Thunderf00t when I first discovered Atheism, and was really into Science. I used to watch his videos religiously. Ironic I know. I quickly got pulled out of the hat and  shoved myself down the rabbit hole, again ironic since his profile picture was a rabbit! I soon found myself neck deep in Thunderf00t, Amazing Atheist, Sargon, Tl;dr, Milo, Lauren Southern, the works, and of course Blair White was my Trans icon as the cherry on top.   There was a certain point, not sure when, I just realized how crazy shit was getting, and that I had to get out. It's weird that years later after escaping the rabbit hole I find myself reflecting on it mid 2019.","en","relativeinsight","2019-08-01T00:00:00"
"5:56 'I'm not a fan of Anita Sarkeesian myself' ??????","en","relativeinsight","2019-08-01T00:00:00"
"2:30 'I am not a social justice warrior.' 2019: Eh, I don't know about that. Sounds debatable.","en","relativeinsight","2019-08-01T00:00:00"
"Ummmm, well feminism does come across as a hate cult or a religion. The church of feminism is alive and well. Not surprising atheism is fighting this infection from taking over.","en","relativeinsight","2019-08-01T00:00:00"
"They dont like feminists because they defend Islam.","en","relativeinsight","2019-08-01T00:00:00"
"'Not all anger is righteous and some feeling you should keep to yourself.' Rules to live by honestly and more people should say it.","en","relativeinsight","2019-08-01T00:00:00"
"This old ContraPoints video is the most obviously inspired by Plinkett Red Letter Media style of analysis that I have seen so far. Being a Plinkett Reviews fan, I am tickled that Natalie took this up. I started with the Incels video and have been working my way backwards. I am deeply admiring. You are my people.","en","relativeinsight","2019-08-01T00:00:00"
"I know it's not really the place but can someone tl:dr me in topic of what is Laci Green doing right now?","en","relativeinsight","2019-08-01T00:00:00"
"Holy fuck I am not the only person that knows what inmedham is and what a raging nihilist he is?  He scares the shit out of me.","en","relativeinsight","2019-08-01T00:00:00"
"Have you seen the 2019 Atheist State of the Union? It's on Holy Koolaid's channel. I know this video is old, but Atheism isn't dead on YouTube. Far from it;-)","en","relativeinsight","2019-08-01T00:00:00"
"Having been berated by feminists for not being an atheist...I can confirm. I didn't even know people were saying that. It makes no goddam sense.  However, I have long noticed that atheists are no more reasonable than anyone else. Just like vegans are not necessarily nicer than anyone else. As a famous gaming youtuber once said 'MMORPGs have proved, it doesn't matter the race, gender, nationality or creed: there's assholes everywhere'.","en","relativeinsight","2019-08-01T00:00:00"
"A couple of things;  1. Atheism movements aren't a fad, it's a response to religious people pushing their beliefs onto others.   2. Atheism isn't the belief that a God doesn't exist, but a lack of belief in a God. And the discussion  goes according to what arguments God believers present.   3. I get there are lots of edgy atheist on YouTube but as of late we've had a rise in numerous channels championing rationality and skepticism such as: rationality rules, genetically modified skeptic, godless cranium, and others. While still have old time favorites that have kept the motto of championing science like plotholer54.  I'm sorry, I usually agree with your videos, but your representation on the atheist community on YouTube is wrong as well.","en","relativeinsight","2019-08-01T00:00:00"
"Natural sciences vs. Humanities, the next big discussion. I studied Physics and, those smug asses of professors used every opportunity not only to shun feminists, but women in general, like, how dare she have maternity leave, it's two years of paying, boo hoo..  and not only that, but that rant that natural sciences are far superior to humanities. What does superiority even mean? Anyways, you must have noticed that smugness when it comes to humanities, with those atheists 'only HARD EVIDENCE', 'STATISTICS IS KING' kind of rant. Between ranting about religion, comparing feminists to ISIS or Natsees, the bottom line is 'look at how my field of research is better than YOURS, YOU SNOWFLAKE!' and that's really frustrating.","en","relativeinsight","2019-08-01T00:00:00"
"I think I'm no longer going to squabble with electronic phantoms.","en","relativeinsight","2019-08-01T00:00:00"
"Never thought I'd feel so happy about coming late to the Atheist party. o_o; Way prefer Theramintrees, Anthony Magnabosco, Mandisa Thomas, AronRa, and Godless Bitches to these disreputable chest thumpers.","en","relativeinsight","2019-08-01T00:00:00"
"The most frustrating thing about this video is that you wasted good whiskey","en","relativeinsight","2019-08-01T00:00:00"
"At the end of the day they were bullies who picked easy targets, and while they were deserving targets at first like evangelicals who had actual power in the US, they extended to every emerging cultural change, valid or not, while it was still on the periphery.","en","relativeinsight","2019-08-01T00:00:00"
"you're like the werner herzog of the late millenial internet","en","relativeinsight","2019-08-01T00:00:00"
"ur not on christian mingle i looked you up there and you lied to me!!!!","en","relativeinsight","2019-08-01T00:00:00"
"Anita poisoned everything XD","en","relativeinsight","2019-08-01T00:00:00"
"My only problem with this video so far, is that tj, thunderfoort,inmendam, Brett keane, are all different people. That's why the atheist community shouldn't be one. You can't lump all these people together. Tj is all for the empowerment of women, I don't know where you're getting that he's not?    I don't watch them anymore bc they tend to be more wrong than right, on account of pure laziness but that doesn't mean you should portray then all as one.","en","relativeinsight","2019-08-01T00:00:00"
"People that criticise feminism most of the time dont learn feminism","en","relativeinsight","2019-08-01T00:00:00"
"All those youtube atheists act exactly the same way with anyone they encounter.  There is definitely no change when it's a woman.","en","relativeinsight","2019-08-01T00:00:00"
"'There is only one cure for world poverty that has ever been found, and it's quite simple, It's called the empowerment of women.' -Christopher Hitchens  Internet athiests take so many leaves out of his book, why not that one as well?","en","relativeinsight","2019-08-01T00:00:00"
"I meet all the best tops on Christian mingle","en","relativeinsight","2019-08-01T00:00:00"
"This may be a weird statement, but I watched this video after watching some of your more recent pieces, and you just seem so much happier now. :)","en","relativeinsight","2019-08-01T00:00:00"
"My favorite part was the Desertphile cameo.","en","relativeinsight","2019-08-01T00:00:00"
"I'm more interested in Misotheism.","en","relativeinsight","2019-08-01T00:00:00"
"When I first saw this video I couldn't watch it. I still harbored a lot of trust in that community and part of me still believed what they were saying about feminism. In the months, now years following trump's election they've completely and utterly disenfranchised me. They began making friends with literal fascists and even affecting some of their rhetoric to appeal to their now decidedly rightward leaning fanbase. What I believe happened was that the right saw how effective that movement was at gaining the support of young white men and essentially stole it away from the actual rational people leading it in an Internet coup. For years they couldn't get 'sjw'out of their mouths and demonized anyone who identified as a feminist, which eventually became anyone who identifies with the left at all. These fucking shitheads are absolutely toxic to every community they attach themselves to. Atheism, gaming, hell even Rick and Morty wasn't spared. Yet they have the audacity to call US toxic? Fuck them and the horse they road in on.","en","relativeinsight","2019-08-01T00:00:00"
"5:59 Agree.","en","relativeinsight","2019-08-01T00:00:00"
