"Text","Language","Source","Date"
"so glad you're back man. fuck all the idiots below me and their pro-sargon pro-DP bs.","en","relativeinsight","2019-08-01T00:00:00"
"who was the sumarian monarch?","en","relativeinsight","2019-08-01T00:00:00"
"Welcome back to youtube... but oh man..  you're sure are following a very very naive approach towards internet-feminism.   and that with the 'scientific evidence'.... erm.... nope! The overwhelming majority of feminist literature (and none of the studies you 'cited') hold up to scientific standards.   And one more thing... what is it with this guilt-by-association thing you're promoting? thunderf00t is finding himself with the wrong crowd of 'right wingers'? First, guilt-by-association is not a good argument, you should know, as a skeptic I mean. Second, just because they are 'right wing' (some of the guys you cited are not, by the way) does not mean they are wrong - which creates an even less smart image of your guilt-by-association.  There are dozens of other points in your video that are just... disingenuous, I'd say.","en","relativeinsight","2019-08-01T00:00:00"
"Feminism almost made me kill myself (combined with a variety of factors I admit). A gay guy from a country you'll likely never visit, what has feminism done? Got the vote by fucking over black people. Talked about rape, by fucking over sex workers, invented the political lesbian, which was the death of queer culture. I've discussed feminism too many times, but if by now you don't see the inherent hatred that comes with the movement, you won't see it, the racism, the misandry, the narcissism, the homophobia...(faggot, internalized homophobia, gay men are even worst), I'd advise to be isolated if you choose that, cause they will hurt you eventually, not because your're a man but because you're (I assume) well intentioned...","en","relativeinsight","2019-08-01T00:00:00"
"Those poor wymenz... =,[ Those poor black peepoh... =,[ Those poor queeeeeeerz... =,[  FUCK WHITE PEOPLE 2016","en","relativeinsight","2019-08-01T00:00:00"
"Seriously though... 'white men'....   wow.... you're racist... cool. Wanna join my branch of the KKK?","en","relativeinsight","2019-08-01T00:00:00"
"OMG WON'T SOMEBODY THINK OF THE CHILDREN!!!","en","relativeinsight","2019-08-01T00:00:00"
"How can you claim thunderfoot is generalising the whole of feminism whilst calling a bunch of different youtubers right wing, whilst, as far as i know, only Milo actually is. This video would be good if i knew it wasn't all bullshit, good metaphor for feminism, once you know your being fed shit you won't eat it, why do you think women are some of the most outspoken on the movement, because they know feminism has been reduced to women whose only interest is confirming their own narrative.","en","relativeinsight","2019-08-01T00:00:00"
"@0:15 Why is that manatee individual wearing a leather jacket and sunglasses situation, and what's it doing with that particular Nerf gun in its flipper situation?","en","relativeinsight","2019-08-01T00:00:00"
"OMG, I know who you are, you were there werent you? at the heart of the atheist youtube movement, along with Thunderfoot and Cristina Rad. I used to watch your videos, you all helped me become an atheist (wich was kind of hard for me because I felt like everyone in my family was a believer and I went to catholic schools all my life). Kind of weird finding you again in this form, your editing has clearly gotten much, much better Its a shame that even if you have solid points and your video is pretty good the title alone will be enough for people to give it a dislike, but be prepared because even if you try to maintain a neutral standpoint you will come of as part of the 'feminazi'  Even so, Welcome back to hell","en","relativeinsight","2019-08-01T00:00:00"
"I used to like your atheism videos, now you remind me of the very people you used to argue against, your 'social movement' has become your new church.","en","relativeinsight","2019-08-01T00:00:00"
"Your version of Thunderf00t's claim is wrong because you blatantly misrepresented & strawmanned what Thunderf00t has said on the subject, and carefully cherry picked your examples to make the community look worse than it is.","en","relativeinsight","2019-08-01T00:00:00"
"maybe the sjw people are the new idiots","en","relativeinsight","2019-08-01T00:00:00"
"feminists are not interested in having a real conversation and they never will be unless their feet are put to the fire.  which is what the men and women you so eagerly dismissed are doing. and if you think whimsical ad hominems are grounds for dismissal, then you are only pretending to be reasonable.","en","relativeinsight","2019-08-01T00:00:00"
"milo a gay nazi. while hilarious, it really does not fit. for one he could not be mistaken with any kind of socialist even after you emptied that red label in one sitting. if you just meant to insinuate he is a jew-hating racist, then im sorry, him being a jew who bangs black dudes on the daily kinda rules that one out. but thats just the level of accuracy i expected after you showed watsons videos and called them vlogs about science.","en","relativeinsight","2019-08-01T00:00:00"
"I know you've gotten a lot of feedback to this but I just want to point one particular thing out.  Your citation of Tf00t claiming that 'Feminism poisons everything,' conveniently leaves out the fact that Tf00t deliberately titled the video with 'Feminism' in quotes.  That should give anyone reason to presuppose that Tf00t is not claiming that the whole of Feminism is poisonous.  I find it hard to believe that this is unintentional but I'm more that willing to be wrong about this.","en","relativeinsight","2019-08-01T00:00:00"
"What a load of verbiage...","en","relativeinsight","2019-08-01T00:00:00"
"TL;DR might be a tedious antelope, but he's still smarter than your boring, Bob Ross sounding ass.  And he's more lovable too.","en","relativeinsight","2019-08-01T00:00:00"
"I watched the first 34 seconds of this and agreed with all of it.","en","relativeinsight","2019-08-01T00:00:00"
"beautiful. oh i am so glad you're back. :)","en","relativeinsight","2019-08-01T00:00:00"
"im skeptical of almost most claim you have presented here. but that aside yer most of the old guns in the atheist movement seems to have gone and have kids so yer we'll see them again in 2-20 years.  also yer sock justice is ideological poison it erodes all of reality.","en","relativeinsight","2019-08-01T00:00:00"
"What you will find in the comment section: Atheists, strawmans, cherry picking, and much more!","en","relativeinsight","2019-08-01T00:00:00"
"You are an idiot","en","relativeinsight","2019-08-01T00:00:00"
"Also, Elliot Rodgers was NOT AN MRA. Despite all the feminist claims, he never even had a subscription to any MRA channel.  He didn't belong to ANY group in this discussion.","en","relativeinsight","2019-08-01T00:00:00"
"Rather than learning Feminism, learn _about_ Feminism. Said otherwise, before accepting the presuppositions put forth by the ideology and using them to diagnose and prescribe and proscribe for the world, question whether the claims are based on sound reasoning.  You mistake Feminism for the values of Classical Liberalism which created the foundation for the Women's Movement, out of which grew the Women's Liberation movement of which the political ideology of Feminism is an outgrowth. Feminism is not all that proceeds it, even if it tries to lay claim to the values that permitted for it's birth. You are not your ancestors.","en","relativeinsight","2019-08-01T00:00:00"
"Hello Nykytyne2... Loooong time no see. Anyways, I didn't watch your second half of your vid, but I think you're exactly on the money when it comes to the death of atheism. The debate was won and people got tired of beating that dead horse... and moved on - to feminists, who were all too eager for their time in the spotlight... oh so confident that they could win the atheist community over by bullying them.","en","relativeinsight","2019-08-01T00:00:00"
"Mehhh...mehhh...mehhh so much mehhh in this video. You make a few good points but I'm not sure you've really thought any of this through and you definitely don't accurately portray Thunderfoot's arguments. Still, I hope you keep making videos.","en","relativeinsight","2019-08-01T00:00:00"
"Welcome back to Youtube, prepare to have your idea's wrecked.","en","relativeinsight","2019-08-01T00:00:00"
"Well, that's two videos that ended shitty.  Is this an ongoing theme?","en","relativeinsight","2019-08-01T00:00:00"
"Owned -> URL","en","relativeinsight","2019-08-01T00:00:00"
"You think people 'Only' look at examples like Anita Saarkessian, the radical feminist that slander the whole of the movement. But you miss the bigger picture; its ideological aproach.   What we see is feminist in the ONU promoting a model that excludes the fair treatment of men regarding rape, in India even abolishing in law the concept that men can be raped. Feminist in UK supressing important information regarding domestic violence to favor women leaving men and children victims excluded. Feminist in Canada attempting to censor free speech by acusing people of harrasment over twitter comments. Feminist in Argentina who assault violenty the catholic church. Feminist in Sweden who push children into gender indentity issues for political gain. GamerGate, and the list goes on, and on, and on.   What we see here aren't 'a few radicals' but the constant radicalization of diferent groups by an ideology that has gone without a formal and deserved rebutal for a long time in the public medium.   To put it simply feminist vision of 'equality' is based on the presuposition that women are treated worse or with 'less liberty' than men by society and those who hold power . If you deny it, it could be said you contradict the bases feminist founders like Simone de Beauvoir, and that you are part of the system 'He' has implemented, thus working against equality. In short, the ideology promotes the idea that if you don't believe the idea of the patriarchy, you are against equality, a misogynist.   You even do this in the video, by assuming that the diferences in representation on STEM fields are due to discrimination, when most can be explained other ways. Hell, even in the study you use in your video: 'Harmful Workplace Experiences' there are some presupositions about what is 'harmful', and label things like 'Unwanted Sexual attention' or 'sexual cohersion' (flirting) as harrasment which may not necesary be the case.  Things men  or women do not report as 'Unwanted' some of the time are presented as harmful for women. Hell, for those into psychology the categories the study presented make no sense and many categories overlap and present an a priory moral judgment. All the study seems to corroborate is that women tend to complain more about experiences that may or may not be experienced by men to the same degree.   And thats not to say that feminist haven't produced worthwhile studies somewhere, or that they haven't provided useful information about specific issues. But whatever benefit they provide will utimately reflect that bias that is shown for example in the implementation of  the way they have helped Domestic violence victims... by excluding men and boys. Even Malala Yousafzai shows this problem, which is not to say she hasn't helped her people.   But getting back at the core of the ideology, 'patriarchy' being the center of the feminist theory (and thus the movement) is demonstrably false. Each and every one if it's preceps or ideological pillars has been debunked hundreds of times by hundreds of different people. I personally preffer Karen Straughan videos to expose to laymen how most of the theory is wrong. higly recomend her videos, specially 'feminism and the disposable men' to begin. Because if you think Thunderfoot and Sargon are the other side of the spectrum (i believe them on the center) on gender you are clearly missing on other more 'radical' notions diferent groups on the manosphere have.   And that's how feminism poisons everything. In the same way Hitchens says religion poisons everything, by infecting us in our very being, by giving us a wrong idea about how and who WE are, and how we HAVE TO relate to one another. Thus the ideology reinforces the gender roles it claims to fight against everywhere it goes 'poisoning' everything.   Have at thee Sir, that's my answer.","en","relativeinsight","2019-08-01T00:00:00"
"Rofl, TL;DR, Rubin, and Sargon are right wing now? Give your head a shake before you put garbage like this out, but you won't, you'll be just like the feminists you're white knighting for, chanting 'not all.'","en","relativeinsight","2019-08-01T00:00:00"
"I'm glad to see that you're making videos again. This place needs reasonable people more than ever. I hope you sick around.","en","relativeinsight","2019-08-01T00:00:00"
"This is one of the dumbest near the most hypocritical bullshit video I have ever seen. Only a creationist is dumb enough to state more hypocritical nonsense.","en","relativeinsight","2019-08-01T00:00:00"
"Perhaps you should go back to your hobo life away from YouTube? Bias tends to get called out for what it is these days at least. You can at least reminisce about the old days and yell at kids to get off your lawn.  You sort of remind me of CNN. Manufacturing a center platform as not to come across as extremist, but missing the point, and factual evidence, as to why one or the other side might actually be right on an issue.   But shitty video is shitty. It lacks reality, objectivity, it's the very pseudointellectualism it lauds, painfully unaware of its own folly. Guilty of trying to speak with authority when really the author speaks through his anus. Enjoy those incoming dislikes. You've certainly earned them.","en","relativeinsight","2019-08-01T00:00:00"
"Dave Rubin and Sargon are RIGHT WING? Really?","en","relativeinsight","2019-08-01T00:00:00"
"haha, great to see you're back! Yeah, Thunderfoot got lazy and TJ is a... well... drunken peasant but Gay Nazi is pretty funny. The monster we created.","en","relativeinsight","2019-08-01T00:00:00"
"Wow, I was just searching for you on a whim the other day when the random thought of 'what ever happened to Nyk' inexplicably entered my mind. It truly gives me no pleasure and saddens me to see that you have clearly traded the conventional religion of your childhood with that of the equally deluded modern one of feminist social justice. You have vitiated your former critical thinking abilities with this nonsense rather thoroughly, I note. This is very unfortunate. Too bad.","en","relativeinsight","2019-08-01T00:00:00"
"Oh man, Justicar just destroyed you.","en","relativeinsight","2019-08-01T00:00:00"
"*Justicar* just ANNIHILATED THIS VIDEO. He went in on you like there was no tomorrow, as if we were on the brink of extinction... Raw, unannounced, no lube, just ripped your faggoty as panties apart and came all over you.","en","relativeinsight","2019-08-01T00:00:00"
"I have uploaded a video response to this video of yours. Whenever Youtube finishes processing it on its end, it'll be available for your viewing: URL","en","relativeinsight","2019-08-01T00:00:00"
"0/10 utter trash.","en","relativeinsight","2019-08-01T00:00:00"
"Can one Tf00t fan at least admit that the pelvis argument is very very lame excuse to look at ass. If you wanna look at ass, just be honest about it, I like ass too.","en","relativeinsight","2019-08-01T00:00:00"
"As a atheist woman, I disagree.  Feminism doesn't represent the ideals from back in the '70s.  It is now a ideological hug box of folks who refuse to take personal responsibility.  They blame their failures on others.  We are equal now but equal is no longer good enough for these snowflakes.","en","relativeinsight","2019-08-01T00:00:00"
"Just to be fair URL","en","relativeinsight","2019-08-01T00:00:00"
"Your double standard is so big, you would explode if it somehow got up your ass.","en","relativeinsight","2019-08-01T00:00:00"
"And to 3:36: I think that Thunderf00t was pointing out how Rebecca Watson could not contain herself and her feminist leanings in service of her goal to support a charity. Instead she put her ire with the youtube-atheist community and the supposed sexism within first. So, I don't think TF took any actual offense himself, I am not a mind reader. He simply stated, that male atheists on youtube will be turned off by the joke RW made. I think he rightly pointed out how RW's feminism got in the way of her other goal - promoting the charity.","en","relativeinsight","2019-08-01T00:00:00"
"Well, this was disingenuous as all hell.","en","relativeinsight","2019-08-01T00:00:00"
"Liking the Redlettermedia influence!","en","relativeinsight","2019-08-01T00:00:00"
"White Males Good point.  However.  I remain unconvinced.","en","relativeinsight","2019-08-01T00:00:00"
"One point of some: So at 5:42 Thunderf00t defeats his own argument that gender politics is not relevant to atheism or atheist conferences because he produced a lot of videos about feminism. How does that follow? He produced a lot of videos about creationism. Does that mean he actually thinks that creationism is a worthwhile world view? Or as you would put it: 'Is this the behavior of a man who actually thinks creationism is incorrect... Is that why you made so many videos about creationism, Thunderf00t?'","en","relativeinsight","2019-08-01T00:00:00"
"Oh, so you're kind of a voice of reason in all of this? Cool.  *1)* Can you link me to the post or video where Thunderfoot appointed himself the atheist community's leader?...since you don't like 'absurdly overstated' theses?  *2)* So...it's cool to ridicule religious people (as long as they're not Muslims!), those were 'the good old days', but now, though you _are_ aware that there's _'a lot of really bad stuff going on in Social Justice circles lately'_ because people are _'celebrating activists ugliest impulses'_ and _'crusading against trivial and nonsensical offenses'_,  (and let's be clear...that 'crusading' often means: trying to destroy lives, trying to get people fired, to end careers, getting people arrested, doxxing people, endangering people, making false accusations, re-establishing racial segregation, openly indoctrinating children into ideologies of hatred, promoting bigotry, defending oppressive religious beliefs, silencing dissent, etc.)...we're just supposed to...um, not, talk about any of that. Oh.  *3)* Fear-Mongering = Bad.  That's why we need to stop criticizing:  - '1-in-8/6/5/4/3 women are raped on college campuses'  - 'We live in a culture that condones, excuses, even encourages rape.'  - 'White Privilege is: knowing that your White kid can play with a toy gun in the park without being shot, because: Tamir Rice.'...even though in 2015, *5* Black people were shot for carrying a toy gun, while *TWENTY TWO* _White_ people were shot for carrying a toy gun, (though, I challenge you to remember _one_ of _their_ names.)  - White people are Vampires and Black people are incapable of being racist, because racism = discrimination + power...meaning, a mentally ill homeless White man laying in a puddle of his own urine in an alley way...is _soooper_ powerful...oppressing everybody left and right...with literally, more power in his hands, than Oprah Winfrey or Barack Obama have.   Well, your video was absurd and you are part of the problem. Have fun covering up for the kind of bigots who think it's 'Social Justice' to forbid little boys to play with Legos during free time at school, because boys have unfair advantages over the girls who have no interest in playing with Legos, and the people whose idea of 'discourse' is to pull fire alarms so the 'wrongthinkers' will be forced to stop talking at their own events.  People like you, the enablers, the apologists...you scare me more than the wack-O authoritarian ideologue/bigots. People like you make it _possible_.","en","relativeinsight","2019-08-01T00:00:00"
"Good thing you weren't around to have to address the bullshit that's been going on for the  years you were away. Now you can come back and act like you have a clue what's been going on. If you had some insight, you'd know how large a following Anita Sarkeesian had in the 'atheist community.' And yet, according to you, she's something of a bullshit artist, and Thunderfoot is wrong in mocking her, just as it's always been in the atheist/skeptic communities for years now: they mock people peddling bullshit. Interesting.","en","relativeinsight","2019-08-01T00:00:00"
"Sad to see u have gone down this path, also please show me when TF appointed him self the leader of atheism.  Also DP attacks men more then women.","en","relativeinsight","2019-08-01T00:00:00"
"And why the FUCK are you placing blame on Thunderfoot and other popular YouTube atheists for the climate we are in? Rebecca Watson was the main figure to bring her bullshit ideology into the atheism community, nobody asked for that shit. Then we had the Atheism+ nonsense. You then had Sarkeesian attacking the biggest entertainment industry in the world.  Climate changed? Yeah, it did. Atheists didn't start it, feminists did. You have two key figures in feminism who attacked a passionate group of people and they felt the wrath. Watson is viewed as a fucking joke now after having a pretty big push from other scientists before her elevator nonsense. Anita is becoming a joke after her UN debacle and South Park parody. Her using outdated and debunked 'research' from the 90s to connect real world violence with video games isn't helping her.  As for BLM, once again, this is the YouTube communities fault? People tired of the white guilt bullshit, it was a long time coming. Statistics and research shows the black community is harming itself but the media and the movement is placing blame on white people, going so far they are becoming the racists.","en","relativeinsight","2019-08-01T00:00:00"
"Haha, another Steve Shives.","en","relativeinsight","2019-08-01T00:00:00"
"You're back! Yay!  Thanks for the refreshing video. Also this may just be me or maybe I'm only remembering vlog style stuff from you. But damn if this isn't a well edited video with good audio. And both critical and funny!   I'm really looking forward to more from you.","en","relativeinsight","2019-08-01T00:00:00"
"So . . . . not all feminists are like that?  Well, Thunderfoot and his allies seem to have found an awful lot of them and they are the ones who screech the loudest and have the most influence.   Weirdly, you haven't put forward a single point of what a good discussion about feminism would be like . . . and I doubt there could be one, because it would be derailed instantly by the people Thunderfoot so aptly skewers.  I'm sure feminism has some good points.  Maybe you could tell us about them?","en","relativeinsight","2019-08-01T00:00:00"
"what happened to your other channel?","en","relativeinsight","2019-08-01T00:00:00"
"excellent","en","relativeinsight","2019-08-01T00:00:00"
"Nuance on YouTube? OMG how did that happen?","en","relativeinsight","2019-08-01T00:00:00"
"I hope feminism poisons Thunderf00t's coffee.","en","relativeinsight","2019-08-01T00:00:00"
"Nice to see you back again, Nyk. I don't agree with some of your conclusions but it's nice with some more people that has a bit more nuanced opinions than most on here.","en","relativeinsight","2019-08-01T00:00:00"
"I missed you so much <3","en","relativeinsight","2019-08-01T00:00:00"
"Hmm... I don't see the logic in the mere suggestion that feminism would ever destroy atheism/Satanism, especially since feminism CAME FROM and is a KEY VEHICLE of atheism, therefore, by default... actually STRENGTHENING IT to the point where it was... that is, before it began to fall hard on its face into the burning tar. Valerie Hitler's words have hit their marks and now it's reap-what-you-sow-time. It looks like Satanism may not be too far behind in its final downfall.  --The Final Justice","en","relativeinsight","2019-08-01T00:00:00"
"With respect, you may have misunderstood Thunderf00t's discontent relating to Ms Watson's video. The problem was that instantly, Rebecca forcefully moved the focus from helping blood cancer research to the topic of herself. As she did this she spoke in a manner which would push potential donaters away from donating to the charity through her branch. He is suggesting that Rebecca's self-serving methods hampered the altruistic goal. The problem with a lot of feminists today (not feminism, as a whole) is that they are interested in only the improvement of their own individual lives, rather than trying to make the world a fairer place for women as a whole.  As a sidenote, the anger that many (not all) people have for Anita Sarkeesian, is how immoral antics has allowed her to wrongfully achieve so much. If Anita was concerned teenager, releasing her videos with the intent of helping people then less people would complain. Unfortunately, Anita is a conwoman who happily lies to fill her purse, regardless of the damage she causes to those who listen to or look up to her.","en","relativeinsight","2019-08-01T00:00:00"
"I see why you have so few subs. you ignore context and pretend you know what outher YouTubes think. hope you enjoy your mediocrity.","en","relativeinsight","2019-08-01T00:00:00"
"Welcome back ! Please stay around.","en","relativeinsight","2019-08-01T00:00:00"
"I prefer to think that 'new atheism' is not a real thing, but zealots, extremists, and bores inhabit every public space.","en","relativeinsight","2019-08-01T00:00:00"
"BTW your instinct to address the strongest points of opposition is right on. Why quibble with emotions masquerading as reason? We can't reason people out of things they were not reasoned into.","en","relativeinsight","2019-08-01T00:00:00"
