"Text","Language","Source","Date"
"I feel like I know what the 'Sk sk sk sk' thing is a reference to, but can't put my finger on it. Seems like a George Romero-ism, but not sure.","en","relativeinsight","2019-08-01T00:00:00"
"I found Your mocking with him and hi's respons videos hillarious actually... I had to wath both of You that day... You saved my day! ha ha!","en","relativeinsight","2019-08-01T00:00:00"
"You don't understand how in-groups and out-groups work.   Yes, the Celts certainly would not Identify with the Romans, but that was THEN. When contact with cultures outside of Europe in general was very limited. Later when contact was more-so, different European peoples found themselves to have much more in common with each other than people's outside of Europe.   Since then there have been unifications of different European peoples under empires and other entities, etc... Roman Empire and Holy Roman Empire being examples. Christendom was also a unifying force in Europe by the medieval period (even though I'm not particularly pro-Christian) Also, shared IndoEuropean language and culture (Latin and ancient Celtic languages having marked similarities, for example). Along with a significant degree of genetic and phenotype similarity.   All of these factors point to 'whiteness' being a coherent concept and category.  Now, people who value that culture and heritage are not going to be in favor of huge amounts of immigration and multiculturalism, because those always tend to dilute culture in the long run. And inhibit cohesion and cultural expression. Not to say absolute homogeneity is necessarily ideal, but a supermajority is.   The US is a place of its own. It was to a degree multicultural from the start, but with a heavy white protestant majority. I'm personally against the US as we know it becoming an ethno-state. But I am against the forced integration of the races. And support freedom of association and the races segregating into their own communities, which is what the majority of people naturally do anyway.   Having a few friends of different races is fine in my book. I certainly do. As is race mixing. Just that it isn't promoted or occurs on a mass-scale.   All of this to preserve the beautiful human biodiversity of the planet. As well as preserve the cultural essence of peoples around the world. And not having that essence diluted through ideology, consumerism, etc...  See, this is an example of the kind of nuanced view that many so-called 'Nazis' hold. You are taking a bunch of base ideologues and assuming the entire set of these people hold such crude views.    'Race prejudice is a gift of nature, intended to preserve in purity the various divisions of mankind which the ages have evolved' -HP Lovecraft","en","relativeinsight","2019-08-01T00:00:00"
"Shame you flagged all the anti-loony videos then, what goes around comes around.","en","relativeinsight","2019-08-01T00:00:00"
"Ah yes has someone finally pointed out to SJW that hate speech includes all hate, including their own? LOL Hope fully we can get back to the free speech SJW et all are so keen on destroying.","en","relativeinsight","2019-08-01T00:00:00"
"Great video, great points. I'm certainly a European identitarian and my problem with 'white identity' is pretty much the one you raised. I'm European and my perspective is as a European and not that of an American. So over here... 'white' identity, it just doesn't feel right. Things are a lot more broken down than that, and not just to nations but down to regions within nations (see the Catalan movement in Spain as an example).  Europe has always been volatile. Patchwork. A sort of pan-European 'white identity' isn't going to fly here. We can see each other as fellow Europeans, and the EU project had a sort of 'good neighbourliness' aspect to it, but very much I saw it as a project to selfishly benefit Europeans, hopefully avoid more European wars, and absolutely not as a refugee safety net funded by us, for people from parts of the world either historically our mortal enemies or, in the case of sub-Saharan Africa, somewhere we went as predatory, hostile invaders.  The reality of the Old World is that it's a violent place with historical tensions. Mixing people who've had mind-blowingly bad histories with each other is a really, really bad idea. Now, the New World can have it's little experiment with throwing people together into a proposition nation united by values, and okay maybe you guys have a better chance than us in Europe making that fly, but in the Old World I'm seriously going to pass. Here in Europe we'll be doing extremely well just to keep the 'white people' from killing each other. Adding in Africans with grievances and some other folks with Islamist tendencies is a bridge too far. Those people are definitely going to die. I don't mean that maliciously or anything, if you can believe that, it's just that violent territorial behaviour is what we do. The whole point of keeping people apart is to prevent those behaviours resurfacing. If people want to avoid wars, keep people who want each other dead away from each other. They can visit each other as tourists but that's all.","en","relativeinsight","2019-08-01T00:00:00"
"'I fucked an Argonian' Ahahaha, I think you fucked many Argonians in your video about why Capitalism is Wrong <3","en","relativeinsight","2019-08-01T00:00:00"
"You should debate Jared Taylor. But most leftists don't like to debate so... You win by default? Lol","en","relativeinsight","2019-08-01T00:00:00"
"Great vid","en","relativeinsight","2019-08-01T00:00:00"
"I truly feel sorry for you.","en","relativeinsight","2019-08-01T00:00:00"
"Do a video on cultural industrialists","en","relativeinsight","2019-08-01T00:00:00"
"Joseph Goebbels was a dwarf with a club-foot, he was not blond like Hitler!","en","relativeinsight","2019-08-01T00:00:00"
"you make such good points, especially the one about historical concepts of race and ethnicity within europe. even today, not all white people are treated the same. a pole and a brit are going to have different experiences, privileges, and histories. to unify everyone who happens to be from the same continent as being the same is to erase history and culture. cultural diversity is inevitable - even within a group of people who are all of the same race.","en","relativeinsight","2019-08-01T00:00:00"
"No but for real could you do a video of how to fuck an Argonian as a trans-woman?","en","relativeinsight","2019-08-01T00:00:00"
"3:25 i just got chills all down my spine","en","relativeinsight","2019-08-01T00:00:00"
"One question, how do you oppose actual fascists without destroying free speech??","en","relativeinsight","2019-08-01T00:00:00"
"I'd fuck an argonnian","en","relativeinsight","2019-08-01T00:00:00"
"Rape is funny","en","relativeinsight","2019-08-01T00:00:00"
"Awesome is to small a word describe what you are doing and what you stand for.","en","relativeinsight","2019-08-01T00:00:00"
"Great video.  As you allude, we shouldn't even be debating these lunatics but here we are, in 2018, doing just that, alongside people who actually think the earth is flat.","en","relativeinsight","2019-08-01T00:00:00"
"FUCK BELGIAN WAFFLES","en","relativeinsight","2019-08-01T00:00:00"
"One third of the subscribers? LIES I TELL YOU! LIIIIES!!! This proves that this whole video is a this is an attempt to show that LGBTQ people have taken over the world. *clutches pearls*  ...  Just in case, cause interwebz, yes people, this was a joke.","en","relativeinsight","2019-08-01T00:00:00"
"Nationalism is not right...            Its far right.","en","relativeinsight","2019-08-01T00:00:00"
"In this whole video you have said little of value if at all. All your points are muddy and confusing at best and retarded at least.","en","relativeinsight","2019-08-01T00:00:00"
"you define white nationalism as people whose end goal is a single white state when in reality it is just the protection and preservation of European peoples, ways, identity, traditions, history and ethnicity while ensuring cooperation and national sovereignty, and unification. Get your facts straight at least when attempting to argue against the far right when all you are doing is showing that you can't insult.","en","relativeinsight","2019-08-01T00:00:00"
"I don't need to insult these facist fucks. Great just genius. Can you get more hypocritical?","en","relativeinsight","2019-08-01T00:00:00"
"I didn't know thesaurus.com could be a drug, but SonytoBratsoni proved me wrong.","en","relativeinsight","2019-08-01T00:00:00"
"1:56 Did that guy swallow a thesaurus? The fuck?","en","relativeinsight","2019-08-01T00:00:00"
"We libertarian left skeptics aren't the ones doing this.  We have the same enemy.  Yeah, we don't like feminism or critical theory, but this is not us.","en","relativeinsight","2019-08-01T00:00:00"
"I live in Bangladesh and all of our higher studies are english medium. We watch Hollywood movies, pirate Game of thrones, play witcher 3. Yeah, white culture is declining.","en","relativeinsight","2019-08-01T00:00:00"
"12:25 Yeah clearly you've not visited central Berlin or east London...","en","relativeinsight","2019-08-01T00:00:00"
"The alt-right prove themselves pretty weak by flagging your old video.","en","relativeinsight","2019-08-01T00:00:00"
"Well to be fair everyone hates belgians...","en","relativeinsight","2019-08-01T00:00:00"
"I like what u did there 'alt-right Germany' LOL!","en","relativeinsight","2019-08-01T00:00:00"
"i.. luv u :D","en","relativeinsight","2019-08-01T00:00:00"
"I'm on the dark side of YouTube.... SJW overtones everywhere...","en","relativeinsight","2019-08-01T00:00:00"
"6:36 Take that, Bart De Wever !","en","relativeinsight","2019-08-01T00:00:00"
"It's mostly likely because It's 3am as I watch this video and that I am in fact part Belgium.  However that moment of 'Fuck this Waffle!' and hitting it with a hammer had we laughing like a mad man for two minutes.","en","relativeinsight","2019-08-01T00:00:00"
"I occasionally forget you have a name thats not contra/contrapoint...","en","relativeinsight","2019-08-01T00:00:00"
"friends recommended you to me & i love it & thnx queen go offff <3 <3 <3 <3","en","relativeinsight","2019-08-01T00:00:00"
"Is anyone else having a weird attraction to the golden one?","en","relativeinsight","2019-08-01T00:00:00"
"Vive While people.","en","relativeinsight","2019-08-01T00:00:00"
"HA! TWP isn't around anymore and richard spencer doesnt want to do college tours anymore. Everybody point, point and laugh.","en","relativeinsight","2019-08-01T00:00:00"
"Starting a video  with Why, wow u just convinced me, not","en","relativeinsight","2019-08-01T00:00:00"
"memes","en","relativeinsight","2019-08-01T00:00:00"
"OMG THE ASMR ROFL","en","relativeinsight","2019-08-01T00:00:00"
"Transgenders are depraved","en","relativeinsight","2019-08-01T00:00:00"
"No You're a man .. no real woman","en","relativeinsight","2019-08-01T00:00:00"
"Why this liberal shit doesn't convince me in the least","en","relativeinsight","2019-08-01T00:00:00"
"As a hedonistic roman cosmopolitan I find this 'golden one' fool as particularly absurd and odious. Also I murderstomp the damn stormcloaks everytime I play skyrim. Fucking racist nords...  Also if you're not jacking off, then what is the point of having genitals? fucking prudes, no wonder they are so angry all the time, sexual repression tends to do that.","en","relativeinsight","2019-08-01T00:00:00"
"I was very amused to have this video, by sheer coincidence, pulled up right next to a video about the lives of ants.","en","relativeinsight","2019-08-01T00:00:00"
"I'm really tempted to start calling WWII-era Germany 'Alt-right Germany.'","en","relativeinsight","2019-08-01T00:00:00"
"As a Belgian myself, I can assure you I was never even mad at you for saying you hated us, Natalie! P.S. you're awesome.","en","relativeinsight","2019-08-01T00:00:00"
"First video I've seen of yours. Got yourself a new subscriber keep up the good work! PS almost shit myself @ the irked sound effect","en","relativeinsight","2019-08-01T00:00:00"
"Have you read the lusty argonian?","en","relativeinsight","2019-08-01T00:00:00"
"You made some interesting points. Overall you simply describe how you feel about White Nationalists and don't present valid points why their beliefs are generally wrong.  The alt-right - or the sub group of White Nationalists in general - can't be boiled down to a simple set of beliefs and mindsets. Some are more extreme and 'conservative' than others.  There was never the goal of an 'white ethno state' either. It's more about preserving the culture and peoples of each individual european country while uniting against external threats like immigration and globalisation.   Ethnic cleansing will have to turn violent at one point if people aren't leaving freely. But since people are driven by love for their own cultures and not by hatred for other races there will never be a genocide of a certain race.","en","relativeinsight","2019-08-01T00:00:00"
"My father has always branded himself as a centrist, but being a child of the Cold War has left him excessively paranoid and distrustful of anything even remotely left leaning.  He frequently uses 'progressives' as a pejorative and ever since the advent of Fox News, he's slowly been drawn in by far right wing mentality.  The moment anyone has anything critical to say about white/Western culture, even if that criticism is aimed at radical elements, he immediately writes them off.  If anyone brings up the insidious nature of the Alt-Right, all he does is go 'what about the Black Panthers and Antifa?'  I shared this video on Facebook, and he immediately said 'Well, I don't trust this video because the Japanese were fascist in WW II and they had no delusions of white supremacy.'  He tried to say you were 'grumping' about whites and western culture and making the argument that only whites can be fascist.  He later admitted he didn't even bother watching most of the video.  I explained that you never made the argument that only whites are fascist, that you qualified your argument by saying 'contemporary fascists,' and that in the context of your video, you were specifically discussing the Alt-Right.  I pointed out it's even in the title.  But he wouldn't have any of it. How do you maintain any kind of reasonable dialogue with someone entrenched in these mental filters?  I love my dad to death, and I try to avoid politics all together when I'm around him, but he's overly critical of everything I say and eager to pounce on something he thinks attacks his world view.","en","relativeinsight","2019-08-01T00:00:00"
"It's a sad day when we have to explain to people why Nazis are bad","en","relativeinsight","2019-08-01T00:00:00"
"Shaun is a racist.","en","relativeinsight","2019-08-01T00:00:00"
"Glad you didn't give up. But still glad I saw the original form, too.","en","relativeinsight","2019-08-01T00:00:00"
"lots of races and ethnicities have been miscegenated out of existence in the past, the ten lost tribes of israel is an example of this. the word genocide just implies an intent exists to the phenomenon of white people gradually existing less. Theres nothing about the term that is incorrect.","en","relativeinsight","2019-08-01T00:00:00"
"That voice change is fucking awesome.  I haven't watched a ContraPoints video in six months or so.  If I couldn't see it was your voice coming out of your face hole I would believe the channel had been taken over by a different person.  I didn't even know people could change their voice that much.  Is it all just practice speaking in a higher register?","en","relativeinsight","2019-08-01T00:00:00"
"i've literally been saying i wish there were more prominent women in like leftist youtube and here you are  keep up the good work natalie","en","relativeinsight","2019-08-01T00:00:00"
"i have no issue with anyone speaking their mind, though nazis/white nationalists are fucking retarded in my opinion, but as a libertarian, i believe everyone can speak their mind so long as they do not advocate violence or infringe the rights of others, based on the Non-Aggression Principle of course.   now with all that said, dear Natalie, i must say, this video was wonderful, you are a true artist, and i say fuck those bastards who flagged the original.   HAHAHA THE KLAN SAYING THEY ARE NOT A HATE GROUP, WOW... JUST SERIOUSLY WOW... sigh, and this is the world i have to deal with, you know? as a libertarian, pretty much everyone hates people like me because the far right and the far left think i'm useless (maybe i am).   by the way, i am curious about your view about countries like Japan? i haven't researched this much, but i heard it's difficult to immigrate to Japan, especially if you're not of Japanese heritage. if this claim is not just a rumor, do you think that it's not our place to criticize them because we don't live there? or would you think it would be more fair for the sake of liberty that Japan be more open to immigrants?   btw, in case you wanted to know about me: my ultimate ideals rest in Mutualism, though i've been bouncing between Anarcho-Syndicalism and Anarcho-Capitalism. i'm pro-gun, pro-abortion, pro-smoke weed every fucking day, pro-sex work, pro-egalitarianism, pro-freedom of speech, anti-drug war, anti-borders, but i am pro-private property rights, and i think we could do better without a centralized system ran by state-wide, or even federal/country-wide regulation.","en","relativeinsight","2019-08-01T00:00:00"
"5:05 'really? has it?' I burst out laughing. Honestly, if I had to edit a video I made when I was an egg, that's probably the kind of comments I'd be making.","en","relativeinsight","2019-08-01T00:00:00"
"What did the Belgians ever do to you besides have beer and weird bike races?","en","relativeinsight","2019-08-01T00:00:00"
"i wont lie, i ship ContraPoints and the Golden One to the fucking grave","en","relativeinsight","2019-08-01T00:00:00"
"ok look not only your channel is amazing (i just discovered it now) and all that jazz, but you're such a hot person. Like. You're sexy all around, brains and body and everything. Keep up the great work <3","en","relativeinsight","2019-08-01T00:00:00"
"Great vid , I learned lots thanks","en","relativeinsight","2019-08-01T00:00:00"
"'I fucked an argonian'  Do tell","en","relativeinsight","2019-08-01T00:00:00"
"Goddamn Belgium waffles taking job from hardworking American pancakes.","en","relativeinsight","2019-08-01T00:00:00"
"Loved the video, but I really need the advice on how to fuck an Argonian... It's for a friend. <.<","en","relativeinsight","2019-08-01T00:00:00"
"They are right about mysoginist transgenders.  Even a clock is right twice a day, lying Nick.  Next you'll claim to be a black woman and steal every penny in scholarships because you whine and complain.  White, pampered priviledged men with a delusion and fetish can claim prosecution because they can't access women's restrooms,  shelters and prison cells.   Ps you pos, your ass hole is not a cunt.","en","relativeinsight","2019-08-01T00:00:00"
"you like ant austrelia to? yea :)  so because eveybody speak english that makes the dislusion of the native english culture not a problem? well guess my little nation of bearly 16 milion is save :(","en","relativeinsight","2019-08-01T00:00:00"
"Wow it's been a while since I watched that video, walking that memory lane","en","relativeinsight","2019-08-01T00:00:00"
"You don't even know your gender and you want us to explain what alt-right is? Ok...","en","relativeinsight","2019-08-01T00:00:00"
"Yet another projecting moron, who thinks that feelings are more important than facts. But whatever. It only paves the way for 4 more years of Trump.","en","relativeinsight","2019-08-01T00:00:00"
"I hate that my enjoyment of the culture I grew up in and the folklore I was told by grandparents for bedtime stories is forever tied to nazis and other such idiocy =_=","en","relativeinsight","2019-08-01T00:00:00"
"Holy fuck they got me. Everytime i saw skyrim belongs to the nords I thought ah how lovely affection for a game I like is alive and well BUT ITS A FUCKING DOG WHISTLE GODDAMNIT. Ty","en","relativeinsight","2019-08-01T00:00:00"
"i too agree that white people gotta go","en","relativeinsight","2019-08-01T00:00:00"
"For some reason, 'fuck this waffle' will always make me laugh and I have no idea why","en","relativeinsight","2019-08-01T00:00:00"
"If being white involves doing squats, taking no drugs, and not masturbating, I'm out. I'm Irish anyway. Have fun with the Duggars.","en","relativeinsight","2019-08-01T00:00:00"
"You're wrong about Sweden though. I'm finnish, we get a lot of news from Sweden. There have now been 5 gang rapes in Malmo in under 4 months. The idea that there's a similar level of gang rape anywhere in Finland that just goes unreported is false","en","relativeinsight","2019-08-01T00:00:00"
"I LOST IT AT 'ALT-RIGHT GERMANY'","en","relativeinsight","2019-08-01T00:00:00"
"Belgians are not just for Christmas!","en","relativeinsight","2019-08-01T00:00:00"
"Amazing video! ^_^","en","relativeinsight","2019-08-01T00:00:00"
"Joseph Gobbles??????","en","relativeinsight","2019-08-01T00:00:00"
"I remember I used to love your old voice, but watching this, as soon as it cut to the old parts, my mind immediately went, 'THIS IS INCORRECT, THIS PERSON HAS A DIFFERENT VOICE' so hard :D","en","relativeinsight","2019-08-01T00:00:00"
"There is so much wrong with this critique. The biological understanding here is minimal as fuck. Much of this is the talking points of the average liberal. It's easily deconstructed.  And liberal democracy is the worst thing ever. Islamism is absolutely preferable to this. Stalinism is preferable.","en","relativeinsight","2019-08-01T00:00:00"
"The fact that you censored your chest makes it even more sexual. It's brilliant!","en","relativeinsight","2019-08-01T00:00:00"
"First off, love the channel.  Thank you for addressing the ridiculous notion that there will be no stratification and no irrational conflicts within the 'ethnostate.'   White nationalists and others who believe in some sort of physical separation from the 'other' need only to look at the numerous examples of utopian societies, here and abroad, that have failed miserably throughout the years. Human foibles nearly always trump ideology, and if they think that without some internal enemy to untie against their state will simply fall in line because everyone within its borders is vaguely the same they are delusional.","en","relativeinsight","2019-08-01T00:00:00"
"new favorite youtuber holy shit","en","relativeinsight","2019-08-01T00:00:00"
"My problem with white nationalists is that the 'sane' ones always try to argue that implementing the white ethnostate isn't going to involve mass killings, meanwhile the underlings of the alt-right actively signal that they're eventually going to go around killing people. There's a point where the 'Day of the rope' and the 'race war' stop being memes and turn into something very real.","en","relativeinsight","2019-08-01T00:00:00"
"Wish I could subscribe twice","en","relativeinsight","2019-08-01T00:00:00"
"This chick is wicked hot","en","relativeinsight","2019-08-01T00:00:00"
"what even is you?  Jesus Christ","en","relativeinsight","2019-08-01T00:00:00"
"You're the unicorn of this corner on youtube. Never stop being you and never stop making these videos - we need you!!!!!","en","relativeinsight","2019-08-01T00:00:00"
"Beige only gets brighter ..I mean whiter","en","relativeinsight","2019-08-01T00:00:00"
"so it's ok for the jews to have an ethno state but not whites","en","relativeinsight","2019-08-01T00:00:00"
"can someone summarize his arguments pls","en","relativeinsight","2019-08-01T00:00:00"
