"Text","Language","Source","Date"
"I'm actually Nordic - ethnically, culturally, historically, genetically, blahblahfuckingblahally, and I want these fucking ridiculous stupid conceited nazis to stop grabbing shit from my culture and history for them to make themselves feel righteous with their fucked up stupid beliefs. Yeah great, slather yourself with runes and sigils and iconography you know nothing about, just know that you look like an idiot, no one likes you, and if you ever tried to pull that 'brotherhood' shit around any actual Norse or Scandinavian person you'd have your face laughed all the way out your arse. Because no one likes you. And you suck.","en","relativeinsight","2019-08-01T00:00:00"
"I absolutely hate that it's even necessary to explain why -nazis- the alt right and white -supremacy- nationalism is wrong and bad... But my god, Natalie, if it has to be said, you are the one to say it! I literally snort-laughed vodka out my nose, three fucking times, I think it's safe to say this video made me laugh, think, and definitely cry (and waste my vodka, goddammit)","en","relativeinsight","2019-08-01T00:00:00"
"Hahaha I forgot 'hate the waffle'","en","relativeinsight","2019-08-01T00:00:00"
"She is so clever","en","relativeinsight","2019-08-01T00:00:00"
"OMG the ASMR bit, you could legit do this.","en","relativeinsight","2019-08-01T00:00:00"
"10:48 he just casually quotes joseph goebbels as if this is a thing that normal, rational, definitely-not-nazis do","en","relativeinsight","2019-08-01T00:00:00"
"I really enjoy your videos , I partially believe that people overuse alt-right and Nazi, which is why people have started to ignore it, However I believe the people you used the terms with perfectly fit the description. You're great and I hope you keep up the great work.","en","relativeinsight","2019-08-01T00:00:00"
"I only recently found your channel and have purposely avoided your older videos because you sound a bit uncomfortable with earlier you. That being said, your tummy in the snowy woods footage is just super yummy... Love your work and your look and your whole vibe.","en","relativeinsight","2019-08-01T00:00:00"
"idk why the german title but i will  just assume its coz you love me. As long as I believe it and you dont see this, that is the truth.","en","relativeinsight","2019-08-01T00:00:00"
"1:37 nipslip","en","relativeinsight","2019-08-01T00:00:00"
"Still waiting for solutions rather than accusations. Explaining a problem without offering resolve is merely grandiose ego fodder.","en","relativeinsight","2019-08-01T00:00:00"
"If you're that fuckin precious and sensitive to change then maybe you aren't actually the master race. And fuck that yellow dude. Golden my ass.","en","relativeinsight","2019-08-01T00:00:00"
"12:20 yes they do","en","relativeinsight","2019-08-01T00:00:00"
"By the UNs definition, white genocide is genocide","en","relativeinsight","2019-08-01T00:00:00"
"I can smell the body odour in the comments lol. Sjws fuckin stank.","en","relativeinsight","2019-08-01T00:00:00"
"I feel like I am fine with serious sonic lore analysis not being allowed","en","relativeinsight","2019-08-01T00:00:00"
"'not masturbating' fuck","en","relativeinsight","2019-08-01T00:00:00"
"This is a great video and all the same makes me wonder: Do we really need to explain this?","en","relativeinsight","2019-08-01T00:00:00"
"this is the closest thing to a transition timeline that we'll ever get on this channel lmao","en","relativeinsight","2019-08-01T00:00:00"
"Wait hold up, what 'far-right extremism' honestly explain that to me. People like the Golden Ones are a super fringe element, Antifa and other such Far-Left groups do much more damage. When far-right people march they get broken up for doing nothing, when far-left people march they get praised while they burn down a business and stop honest working class people from getting to work. What are you on about.","en","relativeinsight","2019-08-01T00:00:00"
"God I forgot both narrators were you for a tired minute halfway into the video and tried to look up who the guest star was","en","relativeinsight","2019-08-01T00:00:00"
"Why are nips blurred?","en","relativeinsight","2019-08-01T00:00:00"
"That last disclaimer was very comforting, i almost wanted to move out of Belgium to not displease The Mother","en","relativeinsight","2019-08-01T00:00:00"
"belgian here and yes brussels wafels are the worst ! let go that hate !!!!! >:D  btw: transgirl ehre found your channel when looking at philosophy tube at the same time that all my queer group of friends ( like we are synced) i looove your channel and your performance. very talented love your decors and the ightings you use . the over the board eotions are hilarious .... in short lova ya channel xD","en","relativeinsight","2019-08-01T00:00:00"
"So on youtube you cant say nazi but you CAN say, 'i fucked an argonian' and then have a picture of a female argonian with audio of a female porn star god i love contrapoints","en","relativeinsight","2019-08-01T00:00:00"
"","en","relativeinsight","2019-08-01T00:00:00"
"Argonians do not approve this video. But i am not an argonian. Am i?","en","relativeinsight","2019-08-01T00:00:00"
"Mein Kampf ASMR, ok, now that's original XD.","en","relativeinsight","2019-08-01T00:00:00"
"The best ASMR, and I hate ASMR.","en","relativeinsight","2019-08-01T00:00:00"
"Golden One is a big pussy, he's afraid to go full fascist on YouTube because he's afraid of getting sold for cigarettes and saurkraut in some German prison","en","relativeinsight","2019-08-01T00:00:00"
"The golden one, HAHAHA. He is the type of guy that jerks off to pictures of himself.","en","relativeinsight","2019-08-01T00:00:00"
"Natalie, you're a delight!","en","relativeinsight","2019-08-01T00:00:00"
"I'd consider myself somewhat aligned with AR for simple sake of preventing importation of third worlders who are visiting pain and suffering on Europeans. I'd prefer Europe to stay European as I believe its the least messy outcome of what Merkel has allowed to happen. Sure, the ''ethnostate'' is a bizarre idea.   Finland and Iceland already are ethnostates with Iceland having ancestry data dating back to the 9th century. the grand melting pot is a recipe for disaster and the UK 's hamfisted multiculturalism has produced a heap of racial tension where before there was none. mostly agree with video but you cannot ignore there are valid concerns amongst many people regarding the political situation and future outlook of some places. In Ireland we recently saw a ghanian woman cut off some guys dick, he was Malian or somesuch.   Historic nations make the world quite interesting, I always find it jarring when I speak to some ''Englishwoman'' in a hijab. Irish can't hate Brits now without feeling morally conflicted","en","relativeinsight","2019-08-01T00:00:00"
"Love this. *Subscribed*","en","relativeinsight","2019-08-01T00:00:00"
"Some days I think your backand Firth transition shots realllllly adds to the hilarity","en","relativeinsight","2019-08-01T00:00:00"
"Is nothing more contiguous than a old bad idea.  Fran Levobitz","en","relativeinsight","2019-08-01T00:00:00"
"thank god someone understands that argonians are top-tier fuckable","en","relativeinsight","2019-08-01T00:00:00"
"'Fuck this waffle' Hey that's offensive! #BelgianLivesMatter","en","relativeinsight","2019-08-01T00:00:00"
"Cultures are like languages: They come and go. They live, they thrive, they are absorbed into and by others, and they dissapear.","en","relativeinsight","2019-08-01T00:00:00"
"A masters at 20 years old? What cereals do you eat?","en","relativeinsight","2019-08-01T00:00:00"
"Why does The Golden One look like Thor if he had an aneurysm.","en","relativeinsight","2019-08-01T00:00:00"
"Basically 'we hate anything meaningful or fun!'","en","relativeinsight","2019-08-01T00:00:00"
"Sooooo, I kind make the terrible mistake to check out that dudes channel. HOLY FUCKING SHIT, I'VE NEVER SAW SO MUCH GARBAGE, PISS, VOMIT AND POOP AT THE SAME TIME. I'm actually a litle bit scared. I like you, Natalie, but I'm really one of those who are not really up to let someone like that talk. Theres just no way.","en","relativeinsight","2019-08-01T00:00:00"
"YouTube censor liberal views too but cuckservatives loooooveeee to play the 'oppressed conservative' card","en","relativeinsight","2019-08-01T00:00:00"
"Somehow, the best part of this video is knowing that The Golden One has seen hbomberguy's takedown of him and his best response seems to be 'he has a weak spirit'","en","relativeinsight","2019-08-01T00:00:00"
"'I happen to hate Belgians. Fuck this waffle!' I love","en","relativeinsight","2019-08-01T00:00:00"
"Why whould you even hate the Belgian, there are no Belgians :D half of them are French and the other half are Dutch xD","en","relativeinsight","2019-08-01T00:00:00"
"please do more of the ASMR :)","en","relativeinsight","2019-08-01T00:00:00"
"Lol I love how you blurred out your nips in the old video even tho you were presenting the 'wrong gender' as you put it","en","relativeinsight","2019-08-01T00:00:00"
"rofl, I was unprepared for what I saw when i alt tabbed to this video... I approve.","en","relativeinsight","2019-08-01T00:00:00"
"Oh my god, you're right.  HBomberguy IS a degenerate beta-leftist pleb tier sub human dog","en","relativeinsight","2019-08-01T00:00:00"
"ZOMG awesome remake, i was very disappointed to find the original restricted.  Great strategic blurring.","en","relativeinsight","2019-08-01T00:00:00"
"Greetings from Belgium :(","en","relativeinsight","2019-08-01T00:00:00"
"Holy shit I didn't realize how insane The Golden boy was..","en","relativeinsight","2019-08-01T00:00:00"
"Why does the golden one have to be such a daddy, ugh. It's hard to hate him when you're horny for him.","en","relativeinsight","2019-08-01T00:00:00"
"'All hate symbols censored' - Pixelates nippels.","en","relativeinsight","2019-08-01T00:00:00"
"Hurray! Since this vid you nearly have as many subs as the second most popular channel about ants! Yasher Koiach!","en","relativeinsight","2019-08-01T00:00:00"
"As a Belgian, I hate me too.","en","relativeinsight","2019-08-01T00:00:00"
"I lost it when you started crinkling a page you tore out of 'Mein Kampf'.  And: All of this video is pure gold.","en","relativeinsight","2019-08-01T00:00:00"
"I love your videos sister!","en","relativeinsight","2019-08-01T00:00:00"
"Do you want to know about reasearch that show: There was a direct association between higher childhood intelligence at age 11 and more liberal social attitudes and political trust at age 33. URL Sample of 8804 people","en","relativeinsight","2019-08-01T00:00:00"
"censored tiddies :3","en","relativeinsight","2019-08-01T00:00:00"
"If white nationalists want to make their own country, why not just go to the bikini atoll?","en","relativeinsight","2019-08-01T00:00:00"
"Jesus did that one commentor just vomit a dictionary","en","relativeinsight","2019-08-01T00:00:00"
"the remix is betta","en","relativeinsight","2019-08-01T00:00:00"
"This Belgian, loves you too :-)","en","relativeinsight","2019-08-01T00:00:00"
"So... we're all agreed that the Nazis can't have Skyrim right? I want to keep Skyrim","en","relativeinsight","2019-08-01T00:00:00"
"Golden One's master race of hare lips?","en","relativeinsight","2019-08-01T00:00:00"
"without the Belgians the Dutch and the French would not have any country to make fun of.","en","relativeinsight","2019-08-01T00:00:00"
"I love your videos, and your editing styles. You're a wonderful presenter.","en","relativeinsight","2019-08-01T00:00:00"
"I almost rage-quit when you said you hated the Belgians but then you apologised so we're good  jk I have just found your YT video and I haven't seen one yet that I haven't loved. Natalie, you are just brilliant. I will now go and watch another of your videos.","en","relativeinsight","2019-08-01T00:00:00"
"I personally believe in different kind of Nationalism, like being proud of your country, protecting it and protecting it's people. I am gay man that loves german marsches, does that make me a Nazi? No I just love good music and I say I love Soviet Union music too, tho I never gonna follow socialism or communism as my country was under it and I know how many people had died from it.","en","relativeinsight","2019-08-01T00:00:00"
"6:22 You should explain/debunk this (so people don't think you're trying to brainwash them)... I'm just gonna quote wikipedia:  Emil Maurice (the first picture) was Hitler's friend, bodyguard and personnal chauffer since 1919. He had jewish ancestry (from his great-grandfather) but definitelly wasn't a jew like the Golden One states. Hitler saw him as a very good friend but Himmler very much distrusted him.  Werner Goldberg (the second picture) was a Wehrmacht soldier (half jew this time) who got expelled from the army in 1940 because he was considered a first-degree 'Mischlinge'. And his father almost got deported to Auschwitz by by the Gestapo. So saying that nazis were his 'friends' is quite a long stretch from the truth.","en","relativeinsight","2019-08-01T00:00:00"
"'Why were so many Jews fighting in the *unintelligible*'  * proceeds to show a picture of someone NOT JEWISH (i recognize that photo it's of a very goyishe Auschwitz guard) *  Nice try you massive gold-plated douche canoe","en","relativeinsight","2019-08-01T00:00:00"
"You are fucking amazing. So glad I found your channel.","en","relativeinsight","2019-08-01T00:00:00"
"aww, i was looking forward to part 4 being how to fuck an Argonian as a Trans Woman... white genocide isn't as interesting or serious as the former","en","relativeinsight","2019-08-01T00:00:00"
"u started doing the thing with the paper and the mic and I had to ff because my blood pressure went up","en","relativeinsight","2019-08-01T00:00:00"
"'Naz...er, alt-right Germany' fucking hilarious","en","relativeinsight","2019-08-01T00:00:00"
"Just watching this video makes me want to get back to playing Skyrim","en","relativeinsight","2019-08-01T00:00:00"
"Fuck it where do I sign up to join the Homosexual Mixed Race Drug Gang?","en","relativeinsight","2019-08-01T00:00:00"
"i'm impressed that you chose to re-edit this video instead of just remake it entirely. seeing yourself in the context of the wrong gender must be, at least, really goddamn weird. but it's also definitely a fuck-you to the censors? idk. i just don't think i'd have the courage to keep any videos of me presenting as the wrong gender on the internet, even edited like this one was. but also, this was a super good video in general, so thanks for taking the time to re-edit it so it can help educate people in the future. much love.","en","relativeinsight","2019-08-01T00:00:00"
"r.i.p hbomberguy, killed by the golden one with a single bicep","en","relativeinsight","2019-08-01T00:00:00"
"White nationalism is extremely wrong, if you are a parasite invader in a white country. If you are a white man or woman, white nationalism is the most logical form of solidarity.","en","relativeinsight","2019-08-01T00:00:00"
"You transistioned FAST","en","relativeinsight","2019-08-01T00:00:00"
"2:59 - OH NO! You now have 265K Subs, so you totally ARE catapulting the Alt-Right into the mainstream.","en","relativeinsight","2019-08-01T00:00:00"
"Would you mind elaborating on your alleged sexual encounter with a Saxhleel?","en","relativeinsight","2019-08-01T00:00:00"
"Intelligent and solid as usual On a less serious note, I love the RHPS golden undies.","en","relativeinsight","2019-08-01T00:00:00"
"I'd love to see a video about Bolsonaro","en","relativeinsight","2019-08-01T00:00:00"
"I love that this feels like a collab between mysterious cape person and Natalie","en","relativeinsight","2019-08-01T00:00:00"
"inb you thought thumbnail was gurl.","en","relativeinsight","2019-08-01T00:00:00"
"Seeing you laugh like that in the end was so amazing","en","relativeinsight","2019-08-01T00:00:00"
"Don't hate the Belgians - we are OK, truly!","en","relativeinsight","2019-08-01T00:00:00"
"Fucking prequal loving degenerate","en","relativeinsight","2019-08-01T00:00:00"
"Fuck the fascists #impeach45","en","relativeinsight","2019-08-01T00:00:00"
"Us Belgians actually make more fries-- or chips-- we don't really have too many waffles in Belgium.... more just... a lot of fry shacks. We eat fries as full meals... Can you please love me though-?","en","relativeinsight","2019-08-01T00:00:00"
"Why are you so hot, Contra? I can't deal","en","relativeinsight","2019-08-01T00:00:00"
"Me, a white person who was raised in a house that speaks both Norwegian and English and has many Scandinavian traditions, agressivly trying to confuse white Nationalists: I identify as a norwegian american but I'm not white because the concept of whiteness is stupid Me, a white person, when around non white people and generally anyone who's not a white nationalist: lol yeah I'm super white, feel free to call me out","en","relativeinsight","2019-08-01T00:00:00"
"6:36  uhhhh Belgian isn't an ethnicity. weak joke 0/10","en","relativeinsight","2019-08-01T00:00:00"
"I want 'Fuck this waffle' on a t shirt","en","relativeinsight","2019-08-01T00:00:00"
"Did anyone else have to stop and re-watch 8:40 about a half dozen times?","en","relativeinsight","2019-08-01T00:00:00"
"The ASMR bit though ","en","relativeinsight","2019-08-01T00:00:00"
"To be perfectly clear: I am not a holocaust denier.  But were there actually jewish soldiers in the wehrmacht? Did Hitler really have jewish servants? That's really disturbing....","en","relativeinsight","2019-08-01T00:00:00"
"asmr political debate is my new favorite genre of youtube video","en","relativeinsight","2019-08-01T00:00:00"
"'In my case, I happen to hate the Belgian' *smashes hammer* 'Fuck this waffle.'     I fucking love your channel.","en","relativeinsight","2019-08-01T00:00:00"
"SKYRIM [?][?][?][?]","en","relativeinsight","2019-08-01T00:00:00"
"3:24 *whisper those sweet debate words to me mommy*","en","relativeinsight","2019-08-01T00:00:00"
"Now that I know you have a master in philosophy, I can't wait to watch your video on why you quit academia","en","relativeinsight","2019-08-01T00:00:00"
"Pleb-Tier Behtahs","en","relativeinsight","2019-08-01T00:00:00"
"Omfg I did not know that 'The Golden One' showed a picture of HBomberGuy as his example of a subhuman degenerate pleb tier white person. X'D That is the funniest thing I've seen in quite a while. Thanks for that one. Keep on doing you, ContraPoints. [?]","en","relativeinsight","2019-08-01T00:00:00"
"In Contra's defense, that waffle was a total cunt.","en","relativeinsight","2019-08-01T00:00:00"
"This is some shit load of great arguments. Then again, why the fuck do we have to talk about right wing's emotions all the time?  Can i just not declare that i find them wrong? Welhy do we have to attend their fragile feelings? Why the fuck do we have to explain to them having to see the people you don't like is different than genocide? Who cares how they feel?","en","relativeinsight","2019-08-01T00:00:00"
"Omg you have a really good asmr voice","en","relativeinsight","2019-08-01T00:00:00"
"I don't know whether anyone's had ever said this to you -- but Contra, you have an impeccable taste in music. You beautiful, filthy degenerate ","en","relativeinsight","2019-08-01T00:00:00"
"Isn't all nationhood built on violence?  Smash!","en","relativeinsight","2019-08-01T00:00:00"
"Nat-zis, those fascist fucks. Besides, Orcs own the north lmao.","en","relativeinsight","2019-08-01T00:00:00"
"So I've had something to drink before watching this but but 11:05 Where he just says 'pleb tier' in actual speech just fucked me up pretty hard.","en","relativeinsight","2019-08-01T00:00:00"
"White nationalism has more political influence than Islam in the west? You are a joke.","en","relativeinsight","2019-08-01T00:00:00"
"Why the fuck does the Golden One look like his sister is also his daughter","en","relativeinsight","2019-08-01T00:00:00"
"what do you mean, you love the belgians? only 20% of dutch and french people care about the belgians, nobody else ever thinks of them for a moment in their life! they're just a failed second netherlands mixed with a particularly lame corner of france. they went WAY too hard on the subjugation of the congo when everybody in europe was having themselves a grand old time, and when they got called out for it by the other racists who prefered being able to pretend that they were fulfilling some honorable white man's burden rather than making entire countries into open-air concentration camps for harvesting rubber, they just fucked right off the world stage in shame, never to be seen again except by armies passing through. now they just put their name on chocolate and pastries to give themselves a cute image, and they got the EU headquarters out of pity, because they're a nice inoffensive middle ground between an actual country and those tiny parasitic tax haven states, and because switzerland didn't want the job.","en","relativeinsight","2019-08-01T00:00:00"
"Dont talk shit about ants","en","relativeinsight","2019-08-01T00:00:00"
"Not even 3 minutes in and I don't think I've heard so many suffixes in one paragraph before","en","relativeinsight","2019-08-01T00:00:00"
"A masters at 28. Thats awfully impressive!!!","en","relativeinsight","2019-08-01T00:00:00"
"Whats wrong with cumming? Im seriously confused","en","relativeinsight","2019-08-01T00:00:00"
"How is a white ethnostate any worse than a black ethnostate?","en","relativeinsight","2019-08-01T00:00:00"
"Wait you didn't explain how to fuck an Argonian (as a trans woman). I was pretty curious :(","en","relativeinsight","2019-08-01T00:00:00"
"How is that thing named, the one when she crumples the paper net to the microphone? It's like a massage.","en","relativeinsight","2019-08-01T00:00:00"
"Next time Bethesda re-re-re-releases Skyrim, they should add in Contrapoints' character as a Nord preset.","en","relativeinsight","2019-08-01T00:00:00"
"I love how awkward you are, keep being outrageous","en","relativeinsight","2019-08-01T00:00:00"
"That golden dude/thingy doesn't seem like a real person.","en","relativeinsight","2019-08-01T00:00:00"
"I still need to know how to fuck an Argonian as a transwoman. For scientific reasons.","en","relativeinsight","2019-08-01T00:00:00"
"No one tell these idiots about the Iroquois Confederacy. Their heads will explode... Wait, no. Tell them about the Iroquois Confederacy.  'But... how can brown confederate?!'","en","relativeinsight","2019-08-01T00:00:00"
"I love everything about every video you do","en","relativeinsight","2019-08-01T00:00:00"
"I think this is a great video. If I'dd give the left three tips it would be these: 1. Debate white nationalists! Your stance is the right one, people will recognize that when you contrast it with that of a white nationalist. 2. Stay respectful. So near-everyone in the left can't talk about the (alt)-right without being demeaning. Stop that! If you needed to resort to calling names, you've lost the discussion. 3. Lose the fight but win the war. You can't win every debate. You'll encounter a white nationalist who is a better debater just when you took a risky stance. That's ok, you'll get them another time. It would be stupid to think that you're right in every way.","en","relativeinsight","2019-08-01T00:00:00"
"Your a retarded keep believing propaganda","en","relativeinsight","2019-08-01T00:00:00"
"I SCREAMED laughing at the Larry David part","en","relativeinsight","2019-08-01T00:00:00"
"God you're so funny","en","relativeinsight","2019-08-01T00:00:00"
"YOU NEVER TOLD ME HOW TO FUCK AN ARGONIAN","en","relativeinsight","2019-08-01T00:00:00"
"Wait but I wanted to learn about how to fuck an Argonian... Is there a cloaca I think it involves a cloaca.","en","relativeinsight","2019-08-01T00:00:00"
"It's funny that you had censor the shit they stand for to make the video okay.","en","relativeinsight","2019-08-01T00:00:00"
"Wait. Wait. Wait. Wait.   Did you and h. bomberguy .......... what","en","relativeinsight","2019-08-01T00:00:00"
"I was a little worried you may actually make a good point and destoy my entire ideology, because I would have accepted it with an open mind if you had. I am relieved.  I've heard all these arguements many times and they aren't very good ones.","en","relativeinsight","2019-08-01T00:00:00"
"kisses from a belgian","en","relativeinsight","2019-08-01T00:00:00"
"The partition of India is a great example of why removing an entire group of people from your country will not be peaceful.","en","relativeinsight","2019-08-01T00:00:00"
"i think the guy at 1:55 needs to read The Ransom of Red Chief.","en","relativeinsight","2019-08-01T00:00:00"
"Ethnic clensing is a very nice words for what is (and was) most often a genocide.","en","relativeinsight","2019-08-01T00:00:00"
"When I become Emperor of the Galaxy, can I have your DNA for my clone army?","en","relativeinsight","2019-08-01T00:00:00"
"I think the greatest obstacle to Natalie's reach is that current Western education. It's become so Newspeak that I wouldn't be sure they are up to her vocabulary :(","en","relativeinsight","2019-08-01T00:00:00"
"Man standing in the snow with your kit off was brave I assume they were short takes so you didn't get frostbite somewhere personal. Good vid BTW it's nice to know someone is sticking up to the neo right without losing your temper or will to live and doing it with humour.","en","relativeinsight","2019-08-01T00:00:00"
"'I F'd an Argonian' XD","en","relativeinsight","2019-08-01T00:00:00"
"White nationalist might enjoy Russia more than Wyoming.","en","relativeinsight","2019-08-01T00:00:00"
"'Free-speech for all', as long as it doesn't involve criticising Nazis. Gotcha.","en","relativeinsight","2019-08-01T00:00:00"
