"Text","Language","Source","Date"
"This is a reedit of a year-old video of mine, 'Why White Nationalism Is Wrong.' As I explain in the intro, that video was flagged into restricted mode, and is unwatchable in several countries. Since making that video I've done better videos on this same topic, but this is the video that got flagged, and I think there's something for the principle that whatever the Nazis want to silence, that's what we should amplify.  So here's the reedit, with all hate symbols censored and a little bit of new content too. Enjoy!","en","relativeinsight","2019-08-01T00:00:00"
"My plans for today got cancelled and I spent all afternoon playing Skyrim and binge listening to Contra Points videos, we've come full circle now.","en","relativeinsight","2019-08-01T00:00:00"
"This video got me into watching ant stuff. Antkeeping is a genius suggestion for people considering white stuff- a hobby where you can  add living space in a healthy way!","en","relativeinsight","2019-08-01T00:00:00"
"Alr-Right/White Nationalists suck.  Keep it up natalie!","en","relativeinsight","2019-08-01T00:00:00"
"The alt+right channels are also banned all the time. Soo....","en","relativeinsight","2019-08-01T00:00:00"
"William Blake s2","en","relativeinsight","2019-08-01T00:00:00"
"Actually got tingles from the ASMR and then burst out laughing at 'skt skt skt skt... Jews'.  Bravo.","en","relativeinsight","2019-08-01T00:00:00"
"Ha, ha, lots of the 'white' supremacist are already very mixed blood, so much for that theory.","en","relativeinsight","2019-08-01T00:00:00"
"God or imagnary magic person in the religious and non religious) the golden one is one sad, angry and boring person.","en","relativeinsight","2019-08-01T00:00:00"
"Your point on and I know your trying to win back some of the many misled and I applaud you. The problem is the white supremacist/nazis have learned to project two faces. One is calm. pseudo science false Christian, bible cultist, with lots of lies and propaganda, and conspiracy fantasies. The other face is the kkk, the nazis marching with clubs and guns and chanting about killing people. To many people only hear the false Mr. Rodgers and not the violent angry liars.","en","relativeinsight","2019-08-01T00:00:00"
"White nationalism is Amerimutt invention  So these mongrels can feel  part of something  But in their defense most of the European people are related but mixing them all together wouldn't do any good  Only an amerimutt will think that's good","en","relativeinsight","2019-08-01T00:00:00"
"so are you straight? cause i love you and i'm a guy.","en","relativeinsight","2019-08-01T00:00:00"
"6:14 You could be someone who isn't a Religious-JEW and at the same time hold Lots of Money & Assets!","en","relativeinsight","2019-08-01T00:00:00"
"1:54 What pretentious, head-so-far-up-their-own-ass nonsense.","en","relativeinsight","2019-08-01T00:00:00"
"'Even Naz- I mean Alt-Right Germany...'  Amazing.","en","relativeinsight","2019-08-01T00:00:00"
"PICKLES WILL PREVAIL!!!","en","relativeinsight","2019-08-01T00:00:00"
"A big question is why any atheist at all would side with this antisemitic garbage coming from the right considering that if these Christian fucks hate jews and start gasing them again we're next.","en","relativeinsight","2019-08-01T00:00:00"
"now i wanna play skyrim.","en","relativeinsight","2019-08-01T00:00:00"
"Proud to be a Nazi, when I saw you guy.","en","relativeinsight","2019-08-01T00:00:00"
"2:07 Look closely. This is Sesquipedalian Loquaciousness at its worst.","en","relativeinsight","2019-08-01T00:00:00"
"I love the early running gag of Natalie quoting troll posts/wingnut book excerpts with silly voices. Especially.... * The guy in this vid who sounds like a thesaurus exploded (Foppish 'Woohoo!').. * The guy in 'Pick Up Artists' with the pro-wrestler voice yammering about metaphorical anal-rape ('....Good Johhhhb!').. * Her take on Roosh....'Congratulate yourself on the notch' and the 'Deep South/Texas NASA Guy' voice for the description of copulating sex organs in the most clinical way possible. * 'Fuck this waffle!' (and the apology Brick Joke at very last seconds of this video). * 'BHHHAAAAAANNNNG!'","en","relativeinsight","2019-08-01T00:00:00"
"So normally I think you're pants on head retarded, but I'd agree with you on the point you made about whites not necessarily getting along with one other. However, when you bring up the example of what happened to the Native Americans, you completely miss a fundamental point. Excepting the Spanish in Latin America, it didn't start with mass murder. The original Jamestown and arguably the Roanoke colonists didn't start immediately murdering their new neighbors. It really ramped up when the new population reached a sort of critical mass. Minority populations aren't a problem on their own. The problem comes when that group has a fundamentally different way of life, hates the other one, and then gains power either through sheer numbers or gaming the political system. See South Africa and Tibet for modern examples. Tibet especially, as the Chinese government is moving Han Chinese to the region en masse is order to dispossess the native Tibetan population.","en","relativeinsight","2019-08-01T00:00:00"
"No-one should stop you from speaking. What you fail to understand is that in Europe the Left is openly celebrating the day when native Europeans cease to exists. If you don't believe me do a google search. When questioned on this issue the liberals in Europe agree with the Left. If this was said about any other RACIAL group it would be decried as genocide but not apparently for native Europeans. The Alt Right and the Dissident Right is the natural response to this. You make the totally false argument that Germans do not exist as a racial group. So, you must think that when they are eradicated in effect nothing has happened, yet in the same breath you vilify Nazi's.","en","relativeinsight","2019-08-01T00:00:00"
"how to fuck an argonian XDXDXD lmao died","en","relativeinsight","2019-08-01T00:00:00"
".We do not hate, we just hate. Manga de giles.","en","relativeinsight","2019-08-01T00:00:00"
"Hippity hoppity argonians are property.","en","relativeinsight","2019-08-01T00:00:00"
"'My cousin is out fighting dragons, and what do I get? Nazis...' ha-HAAA!","en","relativeinsight","2019-08-01T00:00:00"
"No!  Don't ASMR ME!  Aaaaaaah the tingles, I'm gonna fucking take a drill to my head!","en","relativeinsight","2019-08-01T00:00:00"
"Natalie...you are awesome!","en","relativeinsight","2019-08-01T00:00:00"
"wtf is this pornography.","en","relativeinsight","2019-08-01T00:00:00"
"Sweden will be minority Swedish in around 20-30 years. Around 25% of Sweden's population is either born abroad or of two foreign parents right now. The same destiny will follow other European nations, just slightly later (Britain, France and Germany being the next) unless something radical is done soon.","en","relativeinsight","2019-08-01T00:00:00"
"I think we should deport all the people who want a white homeland to the middle of the sahara desert, don't send any food or water with them, they're right wingers they can pull themselves up by their bootstraps. I'm sure they'll be fine. Obviously build a wall around it so that no innocent camel herders make the mistake of entering into this new white nation, most people making the dangerous trek across the Sahara are non white after all. I don't see any local governments objecting, what are they going to do with those sand dunes anyway. I would suggest sending them to Antarctica since that's technically not under any governmental control, but I think Camels and dung beetles are more likely to be able to defend themselves against some angry virgins with pent up sexual frustrations than penguins are. After all, penguins have only ever met human scientists, who may be virgins, but are not angry, they're rather zen virgins, where as African desert fauna have survived wars and angry white men that were fighting the people they live near.","en","relativeinsight","2019-08-01T00:00:00"
"the KKK: We do not hate any group of people we hate... Homosexuality... Sure sounds like you hate the gays by your own admission. hate to tell you this, guys, but the gays are a group of people On the subject of the gays, I'm an aryan dude and I don't like being on top of the racial higherarchy, I often find myself below black, latino, and asian men, and I quite enjoy that.","en","relativeinsight","2019-08-01T00:00:00"
"One of the delights of ContraPoints' videos is that the more you absorb the thinking and the arguments, the simultaneously funnier they become; thereby become both more informative and more entertaining.","en","relativeinsight","2019-08-01T00:00:00"
"Natalie, your naked body is not a hate symbol. Its a love symbol.. unblur it.","en","relativeinsight","2019-08-01T00:00:00"
"7:45  most of them know it happened they just don't want other people to know it happened so they seem less crazy and murderous.","en","relativeinsight","2019-08-01T00:00:00"
"can i have more anti white nationalism asmr please and thanks","en","relativeinsight","2019-08-01T00:00:00"
"sksksksksksksk... jews","en","relativeinsight","2019-08-01T00:00:00"
"How the F did elder scrolls get involved with this in the first place :O talk about ruined *cough* childhood *cough* Skyrim belongs to the nerds I'd say!","en","relativeinsight","2019-08-01T00:00:00"
"It's absolutely crazy how much you have changed through your transition so quickly! Jeez. You're a whole new person.","en","relativeinsight","2019-08-01T00:00:00"
"The extent to which your voice back then sounds like a dfab person trying to do a 'male voice' is astounding.","en","relativeinsight","2019-08-01T00:00:00"
"You originally got those gold shorts for Rocky Horror, didnt you?","en","relativeinsight","2019-08-01T00:00:00"
"Nothing triggers my ASMR so effectively as the crinkling of the page torn from mein kampf.","en","relativeinsight","2019-08-01T00:00:00"
"3:44 are you say 'suka, suka, suka... jews'?","en","relativeinsight","2019-08-01T00:00:00"
"One remark tho - you showed some trupm pence photos. None of them are exactly alt right. And I think even marie and othet far right european parties are not alt right since they do not advocate for ethnic cleansing of europe. The most important thing imo what distinguishes alt right from other far right or conservative groups is the belief in racial realism aka pseudo scientific racism","en","relativeinsight","2019-08-01T00:00:00"
"jeez natalie you know i think you're the only chick i like.. i think you straw man the center a little bit too much and that you dunno shit about economics, capitalism or communism but damn if i'll judge anyone with rad ass antics such as yours. let me know if you ever wanna hang out some time, do some heavy drinkin and dress up as grey gender nazis or something","en","relativeinsight","2019-08-01T00:00:00"
"Euphemisms on point","en","relativeinsight","2019-08-01T00:00:00"
"Yezhov was a nice touch","en","relativeinsight","2019-08-01T00:00:00"
"all right, all right... enough with the common sense already... move along, move along, nothing to see here","en","relativeinsight","2019-08-01T00:00:00"
"Some idiot Christians: 'all white nationalists are Christians too!' Some white nationalists racist demons: *Literally practice Odinism because Jesus is too much of a pussy for them* Some idiot Christians: 'Sorry I don't speak what you're showing me.'","en","relativeinsight","2019-08-01T00:00:00"
"I'm currently living on a mid sized town in Italy, with a proud story of over 1000 years killing people on wars with the nearby town (by nearby I mean less than 25 km) and the funny thing is that that's the normal story of Europe. How delusional is the idea of a 'white nation' hahahah.  Also, the only Superior race I'm willing to acknowledge is the PC Gamer Master Race.","en","relativeinsight","2019-08-01T00:00:00"
"6:04 Lmao he's literally making the 'I'm not racist because I have a Jewish friend' argument for HITLER. How fucking dense can you get?","en","relativeinsight","2019-08-01T00:00:00"
"Hi comrade. Your videos are excellent. Keep up the good work. Here in the 'UK' we have many ignorant people who don't understand how easily they could slide over to letting the Fascists come to power. thing is when they do their idiot marches they are vastly outnumbered by a mix of Liberals, Socialists, Communists, and many others including me and my Anarchist comrades. They are just 'thick' people who only understand violence (Thugs), ignorant people who don't know what they are getting in to or members of the rich establishment who attempt to intellectualise their evil ideology (which as we know is impossible). Keep it up. No Passaran!","en","relativeinsight","2019-08-01T00:00:00"
"I hate the alt right however isn't it true that European societies are better to live in? Is that not objectively true?","en","relativeinsight","2019-08-01T00:00:00"
"Where the hell did she get a drinking horn?!","en","relativeinsight","2019-08-01T00:00:00"
"I've always loved you Red Letter Media/Mr. Plinkett style of video-making.","en","relativeinsight","2019-08-01T00:00:00"
"Please actually do a video on fucking argonians. Asking for a friend","en","relativeinsight","2019-08-01T00:00:00"
"This is an extremely weak video, strawmans, stawmans everyhere! Whites are obviously being shat on at the moment, particularly straight, white men","en","relativeinsight","2019-08-01T00:00:00"
"I like you contra-points but you didn't argue this in good faithful attempt to understand there reasoning. Thats a shame cause thats what we need now, everyone to be understood including jews as yourself.","en","relativeinsight","2019-08-01T00:00:00"
"There is still a peaceful way for the former white nations  to  regain themselves-  Viktor Orban in Hungary is close to what an Alt Right govt.  would look like-  so where are the pogroms ?  How many people have been sent into concentration camps in Hungary ?  The Alt Right does not  embrace 30's style party politics,  is not imperial,  etc...Equating the  Alt Right with Nazism is ridiculous. Whites now have to think internationally in a sense due to our shrinking numbers  or lower percentile of the population, the smothering of identity by globalists, consumerism, hi tech  etc.  This is why the new way now is to incorporate Romans into Celts, Slavs , Nordics etc.   When a negro thug mugs a white person who wandered too near the edge of the hood,  he isnt thinking 'Im gonna get that Mick ( or WOP, etc.)   he is thinking 'Im gonna get that white boy'...All whites have been targeted, we are one.    But white nationalism is still mainly  a US thing.  Mass immigration, combined with abortion, drug abuse,  homosexual promotion, miscegenation...are all part of white genocide. We see leftist Jews and  multinational cartels  as  prime elements  behind these trends, this cannot be denied.  What is essential is that others recognize that whites are real, have value, and have rights as a group.  Organizations that are pro white need to  crop up, similar to the NAACP  or the ADL.   The problem which is feeding the rise in the Alt Right or the far right is the war being waged against whites  by hostile elites.  End the war, and everything will be much better for all.","en","relativeinsight","2019-08-01T00:00:00"
"I've always fucking hated waffles.  Thank you for giving me a voice. I will not live in silence!","en","relativeinsight","2019-08-01T00:00:00"
"That ASMR!     I almost fell off my chair!","en","relativeinsight","2019-08-01T00:00:00"
"'White nationalism is an affront to everything good about Western civilisation. Ideas like individual freedom and religious tolerance are the best products of European political thought... White nationalism is therefore incompatible with the values of liberal democracy, to an extent perhaps only rivalled by Political Islam (at least in theory). In practice, White Nationalist ideas are much more dangerous to liberal values in Western countries since they have more influence here over governments and institutions than Islamism does'","en","relativeinsight","2019-08-01T00:00:00"
"13:29 Skyrim reference ","en","relativeinsight","2019-08-01T00:00:00"
"At 14:01 that guy is flying the union flag/Union Jack  upside down... probably voted for brexit too haha ","en","relativeinsight","2019-08-01T00:00:00"
"Came here from a article about alt right extremeists and youtube in fear that i may have fallen down the same rabbit hole as the person the article was about, glad to say though that i am not a white nationalist and agreed with basically everything. Honestly those people who try to rationalize racism are destroying the image of conservatives and the Republican party. Same with the left and the feminazis too though (i dont call them feminists because they do not want equality, they want female superiority.) Sorry about the censorship though, i hate it in every form. I think the best way to fight people such as these white nationalists and feminazis is to make videos that completely destroy their logic, of which there is none.","en","relativeinsight","2019-08-01T00:00:00"
"'Emergency Door Cock'","en","relativeinsight","2019-08-01T00:00:00"
"My cousin is out fighting dragons, but what do I get? Nazis","en","relativeinsight","2019-08-01T00:00:00"
"Your apology to the belgians is accepted","en","relativeinsight","2019-08-01T00:00:00"
"The argument that a white ethnostate is inherently wrong or unethical; not because of that only whites can be a part of it, is quite racist in itself.  It assumes that black and hispanic people would loose something by not living in a white nation, and that they possibly can't create a functioning society on their own.   Sorry for my english.","en","relativeinsight","2019-08-01T00:00:00"
"Whites living together after half a century of peace: bad idea, will never work, even if it's not a wide variety of nationalities: will never work  Muslims, gays, whites, Jews, and oompa-loompas: perfect and peaceful","en","relativeinsight","2019-08-01T00:00:00"
"So... 'Space Jam' is racist?","en","relativeinsight","2019-08-01T00:00:00"
"That comment at 2:22 is so goddamn gnarly. Easy highscore. 'Femimonilith'; he must have got like, triple bonus points for that one.","en","relativeinsight","2019-08-01T00:00:00"
"U.S.-based claims of 'white genocide' ..... on stolen Native land ..............,,,,,  i-","en","relativeinsight","2019-08-01T00:00:00"
"In the photo John Abarr is 'far right'. kek.","en","relativeinsight","2019-08-01T00:00:00"
"2:45 as someone who used to be a fascist/white nationalist debunking the ideas was never really the problem. it was rather when you feel like you've done something wrong by holding these ideas so instead of shedding them you defend them more and retreat further into the sunken place. if it no longer feels like you are the one being discussed that's when minds are changed.","en","relativeinsight","2019-08-01T00:00:00"
"The idea of individualism is not a ''European'' idea, and it certainly had nothing to do with the US constitution. That is a vicious myth created by eurocentric nationalists. European countries are extremely homogeneous and collectivist. If you have actually lived in Europe you would know that. Americans are more open minded and tend to be less judgemental, but Europeans aren't like that all. Europeans are more like East Asians. There is no such thing as individualism to begin with. We all conform to established norms, the difference is that some societies have more social norms than others. America for example have less, largely because of its history of immigration, but European societies are homogeneous, and they have lots of social norms. They prioritize social cohesion to individual choice. That's why Europeans are also socialist, they prefer a system where all people contribute to a welfare state, and provide safety net. They put the group before the individual. In America, the predominant mindset is that the individual must be free to make its own choices, but in Europe, the well being of the group is central.     Also, the US constitutions was written, scrapped, and then written again at least several times in the span on several years as different forms of government were tried. Some of the Founding Fathers wanted America to be an agrarian society with government that has no power, others wanted America to become like England, a centralized imperial State with powerful government. Eventually the two sides came to a compromise and established a system known as separation of powers, in which the government is strong but its powers are separated so they don't concentrate on one place. Such system did not exist in Europe, and it was strongly detested by European Empires for obvious reasons. The FF were influenced by their environment of living under an imperial tyranny, not by a book written 2K years ago. The idea that they took these ideas from Europe makes no sense since first of all these ideas were not implemented in Europe, and second, these ideas did not even exist in Europe to begin with.     Lastly, the US constitutions is not based on individual liberty like people falsely claim, as the word individual is not found in the constitution. The constitution was based on collective rights of ''the people''. People is a collective term, and certain groups were excluded from ''people''. People referred to a certain group of people only, and they were given the right to vote, so that's a collective right, not individual like people falsely claim.","en","relativeinsight","2019-08-01T00:00:00"
"3:45!!!! Contra points was always about asmr!!!","en","relativeinsight","2019-08-01T00:00:00"
"He's quoting Joseph Gobbels and still doesn't understand why people would accuse him of being a nazi This is beyond ignorance","en","relativeinsight","2019-08-01T00:00:00"
"*I FUCKED AN ARGONIAN*","en","relativeinsight","2019-08-01T00:00:00"
"3:14, I thought I heard Mac and Charlie yelling 'Reason will prevail!' after you said it....","en","relativeinsight","2019-08-01T00:00:00"
"Don't talk shit about ants Australia tho. Ants are amazing","en","relativeinsight","2019-08-01T00:00:00"
"Oh god, The Golden One is Swedish, isn't he? I wouldn't be surprised.","en","relativeinsight","2019-08-01T00:00:00"
"Lol I love this Channel","en","relativeinsight","2019-08-01T00:00:00"
"Tbh both SJW's and the Alt-right are retarded","en","relativeinsight","2019-08-01T00:00:00"
"Nazis are awful They killed waaaaay too many white people","en","relativeinsight","2019-08-01T00:00:00"
"What's wrong with wanting a country for you and your kin?","en","relativeinsight","2019-08-01T00:00:00"
"I'm here from Mr. Obvious :D","en","relativeinsight","2019-08-01T00:00:00"
"It is hard for me to believe 'The Golden One' isn't satire. I had not heard of him until watching this video, but wow! He is pretty damn ridiculous!","en","relativeinsight","2019-08-01T00:00:00"
"The skyrim jokes im weezing","en","relativeinsight","2019-08-01T00:00:00"
"I almost vomited while watching this garbage...","en","relativeinsight","2019-08-01T00:00:00"
"Dude, you have been brain washed and indoctrinated by joo sexual degeneracy agenda   you must have a low IQ and easily swayed into self loathing.","en","relativeinsight","2019-08-01T00:00:00"
"Eat my white nationalist conservative nazi alt-reich penis  freakshow trannie     (      )(      ) ::::::::::::::::::::::: D ~ ~  :D   <~~~ your face","en","relativeinsight","2019-08-01T00:00:00"
"This mutha fuqa is hilarious","en","relativeinsight","2019-08-01T00:00:00"
"Can we just do a video on why the right is wrong? Or what is even the point of the right?  Seriously what is the end goal of conservatism? City-states? It's city-states, isn't it?","en","relativeinsight","2019-08-01T00:00:00"
"I want to be Molag Bal to your Vivek. And yes - it happen to be a transphobic rape joke about how much I love you","en","relativeinsight","2019-08-01T00:00:00"
"Seeing you as a man makes me uncomfortable","en","relativeinsight","2019-08-01T00:00:00"
"As a Jewish American with family that escaped from Poland I teared up at 'fake Jewish gas chambers'.","en","relativeinsight","2019-08-01T00:00:00"
"Being attracted to Contrapoints in every gender she has been is peak pansexual genital energy.","en","relativeinsight","2019-08-01T00:00:00"
"You make me laugh constantly with your cleverness. Your personality shines above all. You hit beauty on many levels...says the man (Because that is what I want to be identified as).","en","relativeinsight","2019-08-01T00:00:00"
"3:23 fou rire","en","relativeinsight","2019-08-01T00:00:00"
"This is a masterpiece. Goldilocks bro is a baffling person and it's a shame he made racism and larping as an amalgamation of supposedly white people the hill he was gonna die on.","en","relativeinsight","2019-08-01T00:00:00"
"'Whiteness' isn't a sketchy topic. All Europeans are descended from the Indo-Europeans. If a person is an Indo-European descendant, who is indistinguishable from the rest of the ingroup (other whites), they are white.","en","relativeinsight","2019-08-01T00:00:00"
