"Text","Language","Source","Date"
"I'm austrian, and also leftist but growing up here, the Idea of europ beeing one big culture is so weird to me. Like every country makes jokes about every outher contry beeing alien and weird, mostly the contrys that have the most incomen. Like We fucking hate the germans in a playfull fun kinda way. What I want to say with this is that everybody in europ is pretty aware that poland is culturaly pretty different to spain. Heck even north and south austrians have a divernet culture.","en","relativeinsight","2019-08-01T00:00:00"
"Jesus fuck that Sonyto comment needs to be filtered back through thesaurus.com, then printed off, steeped in cheap wine, and burned over a yule log.","en","relativeinsight","2019-08-01T00:00:00"
"I've asked you before, and I'll keep asking you: please make vaguely sexual, uncomfortable ASMR videos. You're my only hope.","en","relativeinsight","2019-08-01T00:00:00"
"i don't know why you have to bring Wagner into it.","en","relativeinsight","2019-08-01T00:00:00"
"The different ethnicities of Europe do have a historical connection though. The vast majority of European languages are related under a family called into-European, and when you showed Anglo-Saxon and Norse people as separate groups on your map remember that they basically had the same mythology with the gods having different names, kind of like the Greeks and Romans. In fact, the Nordic gods even had Nordic equivalents and similarities in the stories pointing to a possible common origin.   In any case, with the spread of Roman technology and Christianity and with various royal families constantly marrying into each other and changing the borders, European cultures have been slowly merging and sharing for centuries. Africa on the other hand, is a foreign isolated corner of the globe. Genes have slowly made their way around Europe and sub-Saharan Africa respectively, but until the age of exploration the two gene pools were utterly separated during the long course of evolutionary history.","en","relativeinsight","2019-08-01T00:00:00"
"I'm against censorship no matter which side of what debate it comes from.","en","relativeinsight","2019-08-01T00:00:00"
"ants are cool tho","en","relativeinsight","2019-08-01T00:00:00"
"Don't worry Natalie, you'll get TGO to turn one day.","en","relativeinsight","2019-08-01T00:00:00"
"Hey, really love your stuff! Thank you for producing content that's not only informative but also entertaining.","en","relativeinsight","2019-08-01T00:00:00"
"Just discovered your channel, very interesting. Only saw a couple of videos so far but what I've seen I like.   As a child my father told a story from his youth that has always stuck in my mind. During the 1920s he was raised at a old copper mine in the mountains of Arizona. Near the town of Mayer. Because their lives were so isolated they spoke only Italian until he was about ten years old. It was at that age my family moved to Kansas. It was in Kansas that he and his young brother saw a large tent and huge cross being erected near their home. That night the field filled with a bunch of good old boys who set the cross on fire. As young boys would do they walked over to see what was going on. When confronted these upstanding fellows realize the boys could not speak any English. They grabbed  the two boys and beat them. Dad was ten and my uncle was six. He cared this to his dying day.  Every time the KKK paraded by on TV he would become livid. I learned to dislike the KKK myself, mostly from his experiences. But a few of my own.  Hate is such a horrid thing.   I too deal with gender dysphoria. This is one of those conditions that have many causes. I happen to have been born with a embryonic sexual development intersex condition. Long story but it all boils down to the fact my gonads failed to fully develop. I have boy parts as well as girl bits.","en","relativeinsight","2019-08-01T00:00:00"
"I really feel for you. Censorship is bad. I can't imagine anyone would be moronic enough to actually advocate for it. Even purely on ideological grounds... cough...","en","relativeinsight","2019-08-01T00:00:00"
"the 'golden one's' arguments in defence of Hitler not hating Jewish people sounds eerily similiar to the alt right's defences of Milo Yiannopoulos.","en","relativeinsight","2019-08-01T00:00:00"
"'My cousin is out fighting dragons and what do I get? Nazis!' Bless.","en","relativeinsight","2019-08-01T00:00:00"
"Hahaha!!! That was awesome! It's the second video by you that I've seen and I must say, your irreverence and flair for sarcasm is positively brilliant! Keep up the good work and don't let the haters tear you down! <3","en","relativeinsight","2019-08-01T00:00:00"
"'Alt-right Germany', bless you Natalie","en","relativeinsight","2019-08-01T00:00:00"
"You complain of censorship, yet you censor your chest! Hypocrite!  :p","en","relativeinsight","2019-08-01T00:00:00"
"You're one sexy mofo","en","relativeinsight","2019-08-01T00:00:00"
"White nationalism is just a burger meme because they are too much of a mongrel to know their ancestry and try to hold on the closest branch. Plus 'merica was built on immigrants from all over the world, that's why its pretty dumb to want these ethnostates of one particular race.  However, when it comes to Europe (where I am from) I would prefer to stay as it is. Germany for germans, sweden for swedes, serbia for serbs etc...and no you can't become a swede just because you were born there.","en","relativeinsight","2019-08-01T00:00:00"
"I forgot how great this video was.","en","relativeinsight","2019-08-01T00:00:00"
"Does anyone ship The Golden Twink and Natalie? Like, really hard?","en","relativeinsight","2019-08-01T00:00:00"
"I WAS LOOKING AT THE BOOKS WENDY!!","en","relativeinsight","2019-08-01T00:00:00"
"Hhhhh.. you're such a fucking troll","en","relativeinsight","2019-08-01T00:00:00"
"Your my favorite YouTuber ","en","relativeinsight","2019-08-01T00:00:00"
"","en","relativeinsight","2019-08-01T00:00:00"
"Bloody fascist sympathising, white supremacist befriending, alt-right and identitarian disguising snowflakes, I'm sorry you had to go through the process of editing it again and re-uploading, which makes it deserve a third watch and thumbs up as usual.","en","relativeinsight","2019-08-01T00:00:00"
"FUCK YOU TOO CONTRAPOINTS!!!!!!!!!      JK much love from Belgium!","en","relativeinsight","2019-08-01T00:00:00"
"Dude, you're my favorite YouTuber, you are a Goddess.","en","relativeinsight","2019-08-01T00:00:00"
"See, this is how ya do trolling","en","relativeinsight","2019-08-01T00:00:00"
"This guy is funny, and i enjoy his videos. but he is still wrong.","en","relativeinsight","2019-08-01T00:00:00"
"Please stop changing your voice. Loved your original voice! :)","en","relativeinsight","2019-08-01T00:00:00"
"I'm so thankful for you and your videos. there was a period of a few months where I started to get taken in by this sweep of 'skepticism' and you completely pulled me back from it. plus, you're smart and entertaining as hell GOD BLESS US EVERYONE","en","relativeinsight","2019-08-01T00:00:00"
"","en","relativeinsight","2019-08-01T00:00:00"
"This is beautiful lmaoo","en","relativeinsight","2019-08-01T00:00:00"
"YES BABEEEEEEE","en","relativeinsight","2019-08-01T00:00:00"
"So Good","en","relativeinsight","2019-08-01T00:00:00"
"@6:35 As a dutchman living close to the Belgian border. Yeah... They deserve to be hated. *Peers angrily across the border* 'Damn dumb belgians and their succesfull national football team, fuck you guys! Stick to one language already!'","en","relativeinsight","2019-08-01T00:00:00"
"Contra!  OPEN BOB!!!","en","relativeinsight","2019-08-01T00:00:00"
"they attack you, beaceuse they're scared of how easily you see through their bullshit, keep up the good work!","en","relativeinsight","2019-08-01T00:00:00"
"New voice sounds great, Natalie.","en","relativeinsight","2019-08-01T00:00:00"
"Clickbait thumbnail","en","relativeinsight","2019-08-01T00:00:00"
"I love/hate the fact that humorous and ironic portrayals of ASMR trigger my ASMR so much more than most normal videos.  Also happy to see a page of Mein Kampf being used productively :-)","en","relativeinsight","2019-08-01T00:00:00"
"How is Milo a white nationalist? I also can debate you whenever and wherever.","en","relativeinsight","2019-08-01T00:00:00"
"A fucking loophole. I heard about this several weeks ago in which they would use your gender identity as a way to flag you. Fucking clods.","en","relativeinsight","2019-08-01T00:00:00"
"MIssed You!","en","relativeinsight","2019-08-01T00:00:00"
"white supremacists claim to love White ppl but worship a man who killed countless Germans, plunged them into pointless wars, and brought upon Germany incredible shame as the nation which enacted a brutal genocide. where the love at?","en","relativeinsight","2019-08-01T00:00:00"
"Stupid Nazis can't leave things well enough alone. At least with this re-edit we know know your full name: Natalie ContraPoints!","en","relativeinsight","2019-08-01T00:00:00"
"That was some great ASMR","en","relativeinsight","2019-08-01T00:00:00"
"lol! You>>>>>>>>>>>>>>>>>>>the golden one.","en","relativeinsight","2019-08-01T00:00:00"
"We in Germany (a VERY powerful country) can't have the swastika and so on (illegal), it will be restricted on Youtube as well.","en","relativeinsight","2019-08-01T00:00:00"
"My favorite parts of these vids is your snarky comments about your former male presentation also watching these has made me realize just how much progress, you've made, congrats!","en","relativeinsight","2019-08-01T00:00:00"
"OMG Anne Frank was an INTERNATIONAL Jew not just some poor girl, I KNEW IT!!!","en","relativeinsight","2019-08-01T00:00:00"
"Natalie, you're the best SJW.","en","relativeinsight","2019-08-01T00:00:00"
"You seem more tired and subdued in this video, for some reason.","en","relativeinsight","2019-08-01T00:00:00"
"George Lucas would love this video.","en","relativeinsight","2019-08-01T00:00:00"
"I just got done 'arguing' with a person who saw one Pornhub ad for Hannukah and was saying that it was clear evidence that Jews control the porn industry (to create interracial norms and destroy the white race).","en","relativeinsight","2019-08-01T00:00:00"
"Contra's voice work is amazing. I'm listening more than watching and old Contra, and proper Contra sound like 2 different people","en","relativeinsight","2019-08-01T00:00:00"
"In this reedit on the alt-right you missed two very big inspirations for the mass flagging campaign.  -The alt-right is trying to make their women into PR agents to soften up their message and make it more palatable to the mainstream. There were of course upon discovery that some of them who push traditionalism don't live traditional lifestyles themselves and just push the message for pateron shekels.  With the help of the manosphere and the nazbols, they managed to make Tara McCarthy quit youtube admit revelations about her and other's pasts.   -Kraut & Tea despite my numerous disagreements with him has been doing a good but flawed series on the scientific merits of the alt-right and race realism. The pollacks being the unhinged trolls and autists they are managed to record discord conversations of Kraut saying politically incorrect things about JR, and it pretty much was a total shitshow on the Warski stream today with mass flagging of all kinds of videos and such.","en","relativeinsight","2019-08-01T00:00:00"
"Having just watched all of your videos for the first time over the last three days - this does feel like the Season Finale of a really bizarre and beautiful web series.","en","relativeinsight","2019-08-01T00:00:00"
"You should do a video discussing dogwhsitles","en","relativeinsight","2019-08-01T00:00:00"
"SMASH ALT-RIGHT","en","relativeinsight","2019-08-01T00:00:00"
"I cant believe that 'ad hitlerum' comment is real. White nationalists have their heads so far up their asses.","en","relativeinsight","2019-08-01T00:00:00"
"I'm glad the nazi whisperer did an asmr cameo","en","relativeinsight","2019-08-01T00:00:00"
"2:23 where does that 'haha!' Come from? Is it a reference to something?","en","relativeinsight","2019-08-01T00:00:00"
"Thanks for re-uploading. Sorry you had to edit.","en","relativeinsight","2019-08-01T00:00:00"
"Islamisation is failing the fringe tests of tolerance now that Anni Cyrus is explaining the Islamic State of Iran to us. Once that is obsolete, there won't be much left in the white nationalist arsenal.","en","relativeinsight","2019-08-01T00:00:00"
"You're now at more than twice the number of subs as that ants channel, so this was a good way to see how far you've come I guess.","en","relativeinsight","2019-08-01T00:00:00"
"while you discuss alt right fantasies about a white north america, Jews in Europe are fleeing en mass due to Muslim antisemitic violence. SJW's in NA call speech violence while Jewish children have to play behind bullet proof glass in Sweden.","en","relativeinsight","2019-08-01T00:00:00"
"ever notice how white nationalism blew up a short time after BLM formed and 'whiteness' started being explained as the root of all problems in universities. Hmmm. wonder if there's a connection!?","en","relativeinsight","2019-08-01T00:00:00"
"This didn't show up in my subscription box. Anyone else?","en","relativeinsight","2019-08-01T00:00:00"
"the question isn't 'why does the alt right support free speech', it's 'why don't liberals support free speech.' the illiberalism taking over the left just handed the issue to the right. that's not their fault.","en","relativeinsight","2019-08-01T00:00:00"
"When Contra uploads, it feels like Christmas","en","relativeinsight","2019-08-01T00:00:00"
"You have become Waffle Fucker! Destroyer of Breakfast!","en","relativeinsight","2019-08-01T00:00:00"
"ContraPoints, I agree:  great video!  I enjoyed the original.  However, allow me one Alt Right rebuttal:  isn't there something inherently anti-democratic in the way that politicians push open border policies and promote unrestricted immigration without bothering to ask their fellow citizens if they want a million or 5 million people from another country moving into their countries?   It is inherently racist to say the French have a right to keep France French... just as Israelis have the right to keep Israel an officially 'Jewish state'?  It seems to me that the refusal of the political class to even discuss the concerns of their citizens about mass unrestricted immigration -- the knee-jerk dismissal of all questions about burkas and assimilation and rapes in Sweden as simply racist  -- has led inevitably to the rise of more extremist parties and groups.  Let's face it:  there are already neighborhoods in good, old decadent Paris, Natalie, where you would get the shit kicked out of you for violating Shariah law.  Why are leftists the champions of mass immigration of groups that hate them the most?  Why is it racist to say that in France, you obey French customs and laws... or we don't want you in France?  Bikinis, not burkas.","en","relativeinsight","2019-08-01T00:00:00"
"'Why water is wet'","en","relativeinsight","2019-08-01T00:00:00"
"May we fuck?","en","relativeinsight","2019-08-01T00:00:00"
"Love your background music","en","relativeinsight","2019-08-01T00:00:00"
"Dipshit white nationalists and alt-righters claim to be pro-free speech unless that speech challenges theirs. Fuck those whiny bitches.","en","relativeinsight","2019-08-01T00:00:00"
"So awesome you did this because an old video got flagged.","en","relativeinsight","2019-08-01T00:00:00"
"'Fuck this waffle!' (ContraPoints, 2017)","en","relativeinsight","2019-08-01T00:00:00"
"i lOVE YOU","en","relativeinsight","2019-08-01T00:00:00"
"Yay contra uploaded a video","en","relativeinsight","2019-08-01T00:00:00"
"'Meme-based alternative ethnocentrists?'","en","relativeinsight","2019-08-01T00:00:00"
"Her name has always been Natalie.   Man, my memory sure has been spotty recently. It's like reality shifted.   Is my nose bleeding?  Who am I?","en","relativeinsight","2019-08-01T00:00:00"
"URL please tell that to the commies","en","relativeinsight","2019-08-01T00:00:00"
"I am surpried neo nazi nutjobs have not bum rushed this video yet.","en","relativeinsight","2019-08-01T00:00:00"
"Love the Grados!","en","relativeinsight","2019-08-01T00:00:00"
"14:41 'We can't really be friends as long as you're like this....  Scratch that, we can't really be lovers as long as you're like this.","en","relativeinsight","2019-08-01T00:00:00"
"Raises an interesting point.  Male/Masculine nipples/boobs are not considered naughty/pixel worthy on YT and other platforms. Female nipples/boobs are.  At what point in your transition would they block your vid for showing boob?  At what point could a FTM trans person take off their shirt and be YT safe?","en","relativeinsight","2019-08-01T00:00:00"
"Loved you as Nick. Love you as Nat.  Will love you whoever you choose to be :)","en","relativeinsight","2019-08-01T00:00:00"
"I'd totally forgotten you hated the Belgians. I still love you Nat, I'd forgo waffles to be allowed in the cult!","en","relativeinsight","2019-08-01T00:00:00"
"'really? Has it??? hahhahahahahah LOVED IT","en","relativeinsight","2019-08-01T00:00:00"
"Thanks for this informative video on Argonian sexuality","en","relativeinsight","2019-08-01T00:00:00"
"Pretty much this. Even if they achieve their white ethnostate, they will begin to fight among each other based on racial purity. It's an 'utopia' that's been proven to lead to disastrous ramifications by history.","en","relativeinsight","2019-08-01T00:00:00"
"To talk about your mention of western culture, the language is popular and reach is indeed very broad, but the population is by far one of the smallest and therefore the most fragile in the world. That's why there's a rise of extremists: To protect from the over abundance of immigration in places like Europe where they feel the state has failed them. The alt-right is mistaken in its extremism, but their worries come from a very real place. Hopefully the moderate movement will triumph.","en","relativeinsight","2019-08-01T00:00:00"
"This is a beautiful re-edit, thank you for making it! The old video seems to have disappeared in my country, so I'm happy I can still watch it this way. Stupid restricted mode.","en","relativeinsight","2019-08-01T00:00:00"
"Lusty Argonian Maid","en","relativeinsight","2019-08-01T00:00:00"
"This is a video that should be spread. Proof that rational argumentation can work. There will always be nazis, there will always be irrational people, but that's not most people. Naziism only thrives when free expression is shut down and political terrorism thrives.","en","relativeinsight","2019-08-01T00:00:00"
"Lusty Argonian Maid Vol. 3","en","relativeinsight","2019-08-01T00:00:00"
"I like the idea of all the white nats moving to uninhabited territory because somehow Stormfront managed to reason from 'non-whites should be exiled' to 'whites should exile themselves'","en","relativeinsight","2019-08-01T00:00:00"
"Looking great Natalie. <3","en","relativeinsight","2019-08-01T00:00:00"
"Marxist Postmodernist shit-bags have a nerve talking about shutting down dialogue when that is all the left have done to right wing and Conservative voices for the last two years, be they peaceful protests, campus lectures, or media outlets; the left have used violence, smear campaigns and attacks on people's livelihoods.   Was it respect for the Constitution, law and democracy that inspired Democrats to send violent thugs to Trump's campaign rallies, or attempt to rig the vote (as revealed by Project Veritas), or threaten members of the Electoral College, or deny the lawfully and democratically elected President and then riot in the streets, causing millions of Dollars worth of damage to public and private property?","en","relativeinsight","2019-08-01T00:00:00"
"Contrapoints for president 2020","en","relativeinsight","2019-08-01T00:00:00"
"You look lovely.","en","relativeinsight","2019-08-01T00:00:00"
"White nationalism is the biggest danger to western culture/values.","en","relativeinsight","2019-08-01T00:00:00"
"I kinda lost it at 'I fucked an Argonian.'","en","relativeinsight","2019-08-01T00:00:00"
"*Trans commies of the world unite!*","en","relativeinsight","2019-08-01T00:00:00"
"The sk's during the ASMR made me LOL (again). I hate that it still gave me tingles, tho. Brains are weird.","en","relativeinsight","2019-08-01T00:00:00"
"Wow Natalie it's amazing to hear how much you've changed in a year.  Like wow your voice!  You seriously have made such a transition and you look beautiful! I'm super happy to see this video back on your account.  Watching now (with adblock turned off obviously)","en","relativeinsight","2019-08-01T00:00:00"
"hhhhhuite Nationalism :D  Reminds me of that whip (Stewie-fans out here?)","en","relativeinsight","2019-08-01T00:00:00"
"What a fantastic birthday present!","en","relativeinsight","2019-08-01T00:00:00"
"Natalie Yagoda?","en","relativeinsight","2019-08-01T00:00:00"
"I want more ContraPoints ASMR.","en","relativeinsight","2019-08-01T00:00:00"
"I hate censorship of boobs ","en","relativeinsight","2019-08-01T00:00:00"
"Did you actually tear a page out of Mein Kampf LMAO?","en","relativeinsight","2019-08-01T00:00:00"
"Sooo, your nipples are hate symbols?","en","relativeinsight","2019-08-01T00:00:00"
"Is this sissy for real?  Lmao fucking mentally deranged psychopath.","en","relativeinsight","2019-08-01T00:00:00"
"This is well done and informative but it feels like a rehashing of the painfully obvious. I know there are some alt-right people out there that maybe don't get this but isn't your view generally the mainstream position? How many people could this possibly be targeting? It is not socially acceptable to be a nazi in the 21st century and in my experience in the real world outside of YouTube and Twitter (where the flies tend to gather), I've not once met anybody that would feel sympathy for any of these simple-minded views. And no, I don't accept the election of Trump as evidence of their influence. I know plenty of Trump supporters and they view neo-nazis as just as un-American as anybody else does. There have always been neo-nazis but now they have chat forums where they can make their presence seem much larger than it actually is. The Charlottesville march was what, 1000 people? From all over the country? That's utterly pathetic. I fear our collective hysteria may be giving them a false sense of achievement.","en","relativeinsight","2019-08-01T00:00:00"
"Fuck these guys. Fuck them to hell.","en","relativeinsight","2019-08-01T00:00:00"
"I'm Swedish and I have never heard of 'The Golden One' before. But damn, he is so embarrassing!","en","relativeinsight","2019-08-01T00:00:00"
"this golden one is like a live-action All Might","en","relativeinsight","2019-08-01T00:00:00"
"Classical liberalism only exists because of healthy in group love. It isn't synonymous with cultural Marxism, and to suggest otherwise is just nonsense. Tribalism and liberalism are compatible.","en","relativeinsight","2019-08-01T00:00:00"
"I, as a property of the german states ruling class, deny that there's one german people. There are at least 17, probably much more, from a only historical point of view. And 5, if you divide us by culture (or 9 in greater germany, if you believe, that danes, elsassers, austrians and german-switzers are german too. Nationalism is a shitty idea in every moment, especially if its build on race. And liberal democracy produces this kind of thoughts. It encourages them, cause if we are all equal (cause there arent any social classes in liberal democracy, of course), then someone, let's call him a jew or a trans or a refugee, must be the reason why we still suffer.","en","relativeinsight","2019-08-01T00:00:00"
"Contra you do know that you cant  generalize the whole White race as English? On the whole white genocide seqment your point is how white culture is everywhere, but other white cultures exist and arein decline because of americanization alone. So yeah that's like saying asian culture is everywhere cuz Chinese people own restaurants everywhere. Also  foreign countries donate to build mosques in my beloved country and spread Islamic propaganda in a catholic land so there are similarities. You only took the extreme case of white genocide while there are lots of actual problems that need to be addressed rather then shrugged off as nazism and white supremacy.","en","relativeinsight","2019-08-01T00:00:00"
"Woah, your videos were some of my favorites before, but now you've amped up the production and you are wearing a dress! And the substance is as solid as ever ! That''s awesome! keep em comin","en","relativeinsight","2019-08-01T00:00:00"
"Yes! I've wanted to watch this video for so long but by the point I actually came across your channel (via Lindsay Ellis btw) it was already unwatchable in Germany. So thanks a lot for making the effort of reediting it! And sorry for Pegida and the Afd. You'd think a country could learn from its mistakes but alas.","en","relativeinsight","2019-08-01T00:00:00"
"I get the impression that the Golden One is trying to encourage more guys to go to the gym so he has more material to try not to wank over. Someone is trying too hard.","en","relativeinsight","2019-08-01T00:00:00"
"It's the fucking current year (or is it the 30s?) and the right sinks to the lefts level and flags vids. Fucking dispicable guys, i thought we all agreed in that /pol/ thread to not do that shit.   In the end these videos do more harm than good to the left. Much like it is on our side, this is just a massive circlejerk. Remember that.","en","relativeinsight","2019-08-01T00:00:00"
