"Text","Language","Source","Date"
"Fantastic hand movements,  another chilling classic from the amazing ContraPoints","en","relativeinsight","2019-08-01T00:00:00"
"5:33 ((( a e s t h e t i c )))","en","relativeinsight","2019-08-01T00:00:00"
"Communism = all equally STARVING ","en","relativeinsight","2019-08-01T00:00:00"
"New Contrapoints yaaay~~~~","en","relativeinsight","2019-08-01T00:00:00"
"Thanks for the consistently high quality content.  I have to thank you for coming on Destiny's stream because your videos have helped my political views mature a lot.   The dialogue between your characters mirrors the running conversation going on in my head about these issues, and I share a lot of your views and complaints. It's nice to see them distilled in this entertaining way. I give you a lot of credit for saving me from a lot of the more insidious faux centrist crap on youtube.  The ICE COLD idea makes a lot of sense-- the more collected and calm we are the less we get put in SJW TRIGGERED LOL compilations. I've noticed this on Destiny's debate streams. His opponents were able to make him angry and emotional in the past but recently he's made more of an effort to be cool and collected and they've just made themselves look stupid. It's unfair that the other side will always seek to misrepresent us and laugh at our passion, but I think you've touched on a really key issue regarding the optics here, so thank you.","en","relativeinsight","2019-08-01T00:00:00"
"basically, your point is white people are hopeless? i can agree with that","en","relativeinsight","2019-08-01T00:00:00"
"NOT EXTREME LEFT = FASCIST ","en","relativeinsight","2019-08-01T00:00:00"
"It is the few self-conscious lefties like you keeping liberalism alive, fresh, and approachable. Please never stop. Your degree is not going to waste. I'm in grad school now and I think how we think is even more important than what we think about. You're totally right. Quoting theory and philosophers means nothing to most people. Knowing how to make a just movement appealing is what real intelligence is.   Also, from the little I've seen from undercover stories in fascist groups, they do sell themselves as very approachable on the surface. They gain so many followers or sympathizers that way. Their theory is still there, though. It's just that they provide it only to those who seek it out rather than spewing it in people's faces like Tabby does here. It's on the backwater forums and in dark, intimate coffee shops that Hitler and the like are talked about in theoretical and applicable ways. But on the streets and on the internet there are the vast majority of Americans who like their stuff, desire normalcy, and have the capacity to sympathize, but end up confused as to who to sympathize with. It sucks that fascist rhetoric is about convincing a crowd that they should be mobilized to act for themselves while more liberal rhetoric is about convincing a crowd that they should be mobilized to act for others.","en","relativeinsight","2019-08-01T00:00:00"
"I don't like the fact that you never refer to rightist as what they are. Rightist. You seem to simplify it down to leftist, centrist, fascist. There is a difference to be made from rightists and far/alt-right nazis. Never will the left be taken seriously if everyone who is opposed to them is a fascist.","en","relativeinsight","2019-08-01T00:00:00"
"Had high hopes for this one.","en","relativeinsight","2019-08-01T00:00:00"
"ugh...","en","relativeinsight","2019-08-01T00:00:00"
"'real communism does not lead to starvation and dictatorship' 'has there ever been 'real communism'?' lmaooo","en","relativeinsight","2019-08-01T00:00:00"
"air","en","relativeinsight","2019-08-01T00:00:00"
"my main take away was that Contra as a catgirl is the sexist thing ever; jk (that's true but it wasn't my main takeaway).","en","relativeinsight","2019-08-01T00:00:00"
"This is one of the best videos I've seen on YouTube in general. You have everything: relevant points, comedy, nuance, aesthetixxx... and I think the argument is something leftists really need to consider right about now. Thanks so much for making this content, I've not seen anyone do it so well before.","en","relativeinsight","2019-08-01T00:00:00"
"My partner tried to talk to me while I was watching this, and I had to interrupt: 'I'm sorry, this video is changing my life.' You perfectly encapsulated so many sides of this discussion, and hopefully we'll get to talking about how to reconcile these issues, assuming we can.","en","relativeinsight","2019-08-01T00:00:00"
"I would agree with your critique of using black bloc in our current political moment; small mobilizations of anarchists is actually pretty anti-worker because it operates under the assumption that only the activist core understands the threats of fascism and that workers won't fight to protect themselves. I'm in the ISO, and while we don't disagree with violence we would agree that tactically mass mobilizations like the one in Boston are much more effective.   The left needs to be recruiting, we need to be mindful of our image but I won't compromise on my beliefs to attract workers to our side; the only way that we're going to get better at recruitment conversations is by having a lot of them. Ultimately people's attitudes change through struggle so getting more folks involved in fights for reforms and fights against oppression in our current day is essential to building any revolutionary workers movement. Also we need an independent labor party in the US and DSA could become that party potentially if they don't squander their moment and right now they don't seem to be.  If you're looking for some sexy Marxist literature you should definitely check out haymarketbooks.org. I'd love to talk to you privately about the politics of the ISO and how we're building for another world.","en","relativeinsight","2019-08-01T00:00:00"
"Tabby is a QT","en","relativeinsight","2019-08-01T00:00:00"
"'Actually... I'm a Mutualist' is my response. Not any better, maybe worse.","en","relativeinsight","2019-08-01T00:00:00"
"Centrists have killed far more people in the last decades years than any other group.  Fuck them.","en","relativeinsight","2019-08-01T00:00:00"
"The trouble is, you fail to acknowledge subset of those on the left, who are as awful as the right wing when it comes to anti-intellectual, conspiratorial nonsense.  This is the crowd that mocks conservatives for being anti-science (when it comes to evolution, climate change ect...) while at the same time decrying economists as tools of the global neoliberal ruling class. It is a profoundly hypocritical and anti-intellectual to dismiss areas of economic consensus among economists, while believing only research that supports their priors. I am talking about the Naomi Klien, and Nancy McClain crowd who wade into Alex Jones level of conspiracy to the point where they sound like left wing versions of Jordan Peterson. If the 'Alt-Left' is going to be a serious force, it needs to stop relying on dogmatic cranks like Richard Woleff.","en","relativeinsight","2019-08-01T00:00:00"
"you're a very engaging filmmaker and i love all your characters.","en","relativeinsight","2019-08-01T00:00:00"
"Why are guillotines and 'libs get the bullet too' more alienating than free helicopter rides and gas chambers? I honestly don't think they are. Can improvements be made on code switching? Probably, but leftist shitposts about killing kulaks is the road to being ice cold. You can't be cool while worrying about optics.","en","relativeinsight","2019-08-01T00:00:00"
"this is hilarious and i love it","en","relativeinsight","2019-08-01T00:00:00"
"Hey, you take that Wagner background music off right this instant. Wagner was no fascist.","en","relativeinsight","2019-08-01T00:00:00"
"I wish I had more friends that were leftist militants, or you know just more friends.","en","relativeinsight","2019-08-01T00:00:00"
"6:03 That line did things to me I feel a little guilty admitting to.","en","relativeinsight","2019-08-01T00:00:00"
"This was actually a really good video. Tabby was the perfect personification of the left: its inflexibility, ideological purity tests, and nitpicking bullshit. I have to say though that I have problems with the your criticisms of centrists. I actually think that centrists have an advantage being able to play devil's advocate and see the flaws in opposing arguments. The majority of people that do not give a fuck are the ones who have jobs and families. Also, Nazis were defeated in WWII. Any true Nazis that remain are in exile in the Americas or elsewhere but Neo-Nazis suck also.","en","relativeinsight","2019-08-01T00:00:00"
"that mao poster at 2:36","en","relativeinsight","2019-08-01T00:00:00"
"I'm a centrist who thinks your sjw philosohpy is poison but you are fucking brilliant. bravissima! more! more!","en","relativeinsight","2019-08-01T00:00:00"
"I have this theory, after Tina Fey was eaten recently. That all the people know who hold themselves at the fore front of social progression on the left. Will be replaced by even further left people. And then those people that ate Tina, that point the finger at centrists as if their evil. Will then be eaten, by the new most progressive segment. And on and on and on and on...  But what the fuck do I know.","en","relativeinsight","2019-08-01T00:00:00"
"Your hair is so pretty","en","relativeinsight","2019-08-01T00:00:00"
"A E S T H E T I C M A R X","en","relativeinsight","2019-08-01T00:00:00"
"I dunno how much I agree with this video. I've spent some time on Tumblr, so I know people like the cat leftist totally exist. However, far from being the majority I think the examples that right wing people complain about routinely come from pretty moderate presentable people. Even Anita's videos, which are peak making online people mad, are presentable and don't go in for a lot of the more confronting leftist ideas. Conversely I think actual fascists have little self awareness, and turn people off pretty fast.","en","relativeinsight","2019-08-01T00:00:00"
"I have that exact same Marx Engles reader book!","en","relativeinsight","2019-08-01T00:00:00"
"This is how the Matrix soundtrack was meant to be used.","en","relativeinsight","2019-08-01T00:00:00"
"we need a contrapoints wiki to keep track of the contrapoints characters and lore","en","relativeinsight","2019-08-01T00:00:00"
"As an antifa leftist trans catgirl I'D LIKE TO SAY SOMETHING...  ...Kings can't check themselves by moving next to Kings.  Also, great video! (I'm not a catgirl)","en","relativeinsight","2019-08-01T00:00:00"
"Like with the punching natsees video I sort of vehemently agree with both. I see myself in both characters and I'm not sure how to strike a balance.","en","relativeinsight","2019-08-01T00:00:00"
"You know you're a contra fan when Jackie appearing on screen makes you laugh for 5 minutes straight.","en","relativeinsight","2019-08-01T00:00:00"
"Die Linke!","en","relativeinsight","2019-08-01T00:00:00"
"I think antifa are cool, american antifa not as much but in europe, especially greece they're fucking cool as shit","en","relativeinsight","2019-08-01T00:00:00"
"You're the greatest YouTuber of all time","en","relativeinsight","2019-08-01T00:00:00"
"Brilliant as usual!","en","relativeinsight","2019-08-01T00:00:00"
"I used to tweet stuff about nuking the politicians who disagreed with me from orbit, but my uncle told me to give up that life...","en","relativeinsight","2019-08-01T00:00:00"
"Was Bruce the one with the hammer?","en","relativeinsight","2019-08-01T00:00:00"
"Fucking 'Nightclubbing'-era Grace Jones! - that's what you need. Just listen to 'Pull up to the bumper' - you'll know what I mean...    It's practically a bose-einstein condensate it is yes. Edit; I mean like yeh. Ahem. There's a song called 'Pull up to the bumper' you may want to check out by Grace Jones from her album 'Nightclubbing'. swooo  [some words that cannot be said or thought...] it's cool.","en","relativeinsight","2019-08-01T00:00:00"
"Progress isn't a game of swaying centrists. It happens by marginalized people fighting for their own interests, not by petitioning liberals.","en","relativeinsight","2019-08-01T00:00:00"
"each video a little piece of art, and each one better than the last one. amazing. this is developing amazingly. and that i say as a more center-right guy. congratulations.","en","relativeinsight","2019-08-01T00:00:00"
"Also... it might NOT be a good idea to BAN every person from commenting on your Antifa FB pages that DARES criticize you?  Just makes you look like a fucking echo chamber and cowardly","en","relativeinsight","2019-08-01T00:00:00"
"I have never felt so personally called out before","en","relativeinsight","2019-08-01T00:00:00"
"One issue is that I don't really buy that SJWs are the same people undertaking dangerous street action as Antifa. The idea that there is something baby-bathwater about effective proximal resistance and bad, misdirected propaganda (I used the word) is something I don't buy. The Antifa SJW portrayed here is more an amalgam of two tendencies that probably don't coincide in the same person so much in reality. Making a plausible case for one's politics, using public standards of reason and not failing to recognize that liberal demonizing and self-exonerating claims of ideological purity are unhelpful, is not inconsistent with direct action.","en","relativeinsight","2019-08-01T00:00:00"
"I actually agree more with the cat lady/man.","en","relativeinsight","2019-08-01T00:00:00"
"I also think it's perhaps a bit 'pathetic' that antifa is *out in full force* when, say, a group of fascists and Nazis come to someone's town to do a rally or protest, and then... that's it.  After safety has been guaranteed, where are the antifa people to STILL HELP the marginalized groups?  Poof! They're gone... for those black or brown or trans folks to, in some respect, still live in 'squalor.'  DO most antifa members also, say, help poor folks out with charity or getting them better jobs under the current system, or contribute to shit like The Trevor Project for LGBT Americans?  Do they fight to ensure far less harassment and murder of trans people?  do they fight to keep shit like DACA legal?  How many 'potential rapes', esp. of women, have members of antifa prevented? Or is the 'extent' of their 'revolutionary leftism' just punching nazis every now and then... and talking theory on their 'off-days'?  If most members of antifa ARE, in fact, contributing to several worthy leftist causes OUTSIDE just 'punching nazis' then... PROMOTE THAT SHIT!  Tell people THAT'S WHAT YOU ALSO DO. SHOW EXAMPLES, FFS! Don't let the Right and fascists distort your movement.  You guys seriously need to do a much-better PR JOB!  QUit assuming that, 'Well, at SOME POINT, most people will 'get it' w/ no help from us'","en","relativeinsight","2019-08-01T00:00:00"
"What is this song? Am I hearing Inglourious Basterds rn? -_- pls help","en","relativeinsight","2019-08-01T00:00:00"
"6:06 very cathartic","en","relativeinsight","2019-08-01T00:00:00"
"Finally, acknowledging the problems with the far left without playing to this ridiculous narrative that they're in any way equivalent to Nazis and the far rught","en","relativeinsight","2019-08-01T00:00:00"
"We have to go back to the leftism of the early 20th century. We have to appeal directly to the working class with our theory put in less academic terms and we have to appeal to their emotions, while staying cool. The right does that significantly better than us.  Also I think being edgy kind of helps more than it does harm. It gets especially young people into leftism. Leftism is kind of booming on the internet right now. Only 2 years ago there was hardly anything to find.  I have to add that I really love your videos, they're great!","en","relativeinsight","2019-08-01T00:00:00"
"I'm... left?  passionate about lot of social justice issues, and science-based medicine (anti quacks etc)  atheist  learning&practing  Street Epistemology (online mostly)  Using what I learned on REBt to put things into perspective. Can't say I'm always cool  (that'll make me not human*)  but I'm getting close...   *that Jordan Peterson guy is making my blood boil recently. If only English was my first language, I would even consider making a video about his 'psychology'... Anyone aware about a video exposing him, pls share?  Awesome video as always Contra","en","relativeinsight","2019-08-01T00:00:00"
"My favorite video you've created! If you want to make more, I wouldn't mind.","en","relativeinsight","2019-08-01T00:00:00"
"what was the mile davis song though?","en","relativeinsight","2019-08-01T00:00:00"
"So, if I understood the video correctly, vaporwave Karl Marx will defeat neoliberalism?","en","relativeinsight","2019-08-01T00:00:00"
"I was fool for following Abigail Cockbane. Taby is my master now.  I really enjoy to see you establish a unique style. Watching the evolution if your channel is nothing short of mesmerizing.  The Ice Cold argument is intriguing. But I wonder how this would look when applied. Isn't the dispassionate thing partially what HRC was trying to pull off? Also, would you say that the Charlottesville was met with such backlash partly because it showed the Alt Right losing its cool?","en","relativeinsight","2019-08-01T00:00:00"
"Can't stand that term- 'praxis'  When you REALLY look at what it 'describes', it's pretty simple, but the fact that a lot of leftists feel the need to USE SUCH A 'CRYPTIC' WORD is really fucking obnoxious.  Just say, 'Directly getting involved in Movement X or Y or punching Nazis', not 'praxis', ffs  'Praxis' seems to imply something far more complex and mysterious than just... leftist direct action (more or less).  Funny enough, I think many militant leftists use the word 'praxis' to sound or feel 'smarter', but, to everyone else, they just come across as conceited know-it-alls.  And it's not just praxis but constantly using 'dialectical' and other 'esoteric' terms very-few people outside a certain circle are familiar w/ or really give a shit about.  You're def. NOT gonna 'win the information war' by constantly referencing all of this 'academic' shit.    You have to win hearts and minds *on the ground w/ language that they can understand and are familiar with*.  I know that seems 'too regular' for the bourgeois elites w/in 'militant leftism', but it must be done.  :)  Also... I think it's many of the white, middle-class (or higher) Marxists and left-anarchists who mainly do this overly-academic shit.  One could, interestingly, say that their 'privileged disconnection from a harsh life' allows them to talk all day long about theory and various philosophers and use all kinds of fancy terminology, forgetting that lots of people *don't have time to waste reading a gazillion Marxist and anarchist books and have to, say, scrape to get by and *already know* how fucked-up the system is directly.  However, Marxists and anarchists from worse-off socioeconomic bgs who are in various marginalized groups who know *the full reality of growing up in shit conditions* don't have time for that 'academic all the time' shit; they likely know how to 'explain in layman's terms' what they're after politically.  They can relate in a way that a lot of these 'bourgeois', elitist, mainly-white Marxists and left-anarchists probably 'can't.'","en","relativeinsight","2019-08-01T00:00:00"
"Oh my god I'm fucking dying over the marx and engels book cover cus I watched your livestream making it, and the hours it took you to make that in comparison to how quickly and effortlessly you 'make' it here is amazing","en","relativeinsight","2019-08-01T00:00:00"
"The left has some really good marketable points - let's not fuck up the planet too much, let's treat people with dignity, let's help the poor, let's make life a little less shitty for working stiffs. This all seems like easily marketable things. And if you have a conversation about incremental aims - socialized medicine, better public schools, more taxes on the rich, cutting the military budget, etc. - there is a lot of agreement. These ideas can be marketed well and win elections. Heck, that's what brought the Liberal Party into power in Canada (even though they turned out to be mostly centrist shit bags).","en","relativeinsight","2019-08-01T00:00:00"
"Nice video but wtf is up with your voice?","en","relativeinsight","2019-08-01T00:00:00"
"should i feel bad for liking the tannhauser overture?","en","relativeinsight","2019-08-01T00:00:00"
"Shocked and upset to see Mao has regained his frame from Dark Mother.","en","relativeinsight","2019-08-01T00:00:00"
"bramds","en","relativeinsight","2019-08-01T00:00:00"
"But importing millions of people from third world countries is factually a bad idea no one benefits from it...","en","relativeinsight","2019-08-01T00:00:00"
"I was cracking up so hard at 6:18. This is fantastic.","en","relativeinsight","2019-08-01T00:00:00"
"Omg that was so great.","en","relativeinsight","2019-08-01T00:00:00"
"1:41 has made me quesiton my sexuality. YOU'RE SO CUUUUUUTEEEE","en","relativeinsight","2019-08-01T00:00:00"
"I thought I had lived, but now I realise that my life was incomplete until I heard a cat communist lisp her way through: 'Marxth is a thoundathional thinker in the hiftory of..'  Brilliant as always Contra, kudos.","en","relativeinsight","2019-08-01T00:00:00"
"I love the style you choose for these videos. It's tongue in cheek enough that it really gets you thinking about which character is closer to how you act and how you actually believe, how the criticisms of the other character really apply, etc. I'm glad there's at least one person out there who isn't afraid to get hate from ALL sides of the liberal spectrum in pursuit of a bit of constructive analysis ","en","relativeinsight","2019-08-01T00:00:00"
"Tabby rules.","en","relativeinsight","2019-08-01T00:00:00"
"This is great!","en","relativeinsight","2019-08-01T00:00:00"
"Justine is way ahead of the curve.","en","relativeinsight","2019-08-01T00:00:00"
"Nice bewbs","en","relativeinsight","2019-08-01T00:00:00"
"Heheh, I'm a filthy liberal centrist myself and I love your stuff. It's always genuinely thought provoking and ofttimes makes me question my own principles. Not to mention the production values are dope af.","en","relativeinsight","2019-08-01T00:00:00"
"Your videos are some of the only things to make me laugh out loud anymore. 'Actually, I'm an anarcho-syndicalist' XD How many times have I said that to someone...","en","relativeinsight","2019-08-01T00:00:00"
"love it (so far) - hello from (doomed) germany","en","relativeinsight","2019-08-01T00:00:00"
"Very well done....","en","relativeinsight","2019-08-01T00:00:00"
"Awesome video!!!!! tbh i needed to hear some of the things that justine told tabby","en","relativeinsight","2019-08-01T00:00:00"
"most of my stuff was made by Chinese slaves....go on...why change the subject?","en","relativeinsight","2019-08-01T00:00:00"
"why invoke the 'marketplace' meme when talking about intellectual exchange? you need to read some Graeber.","en","relativeinsight","2019-08-01T00:00:00"
"you're outta sight! keep up the good fight!","en","relativeinsight","2019-08-01T00:00:00"
"I absolutely loved the video, and practically all your videos. I'd call myself a leftist, a progressive, and a social democrat. Up until this year, I would've called myself a far leftist until this year with Antifa, when I suddenly found myself labeled as a 'liberal' (I actually still consider myself one. I tend to use liberal and progressive interchangeably, which probably annoys a lot of other leftists) and a 'centrist' (Maybe I'd be Center-Left in Europe, but DEFINITELY NOT in America) due to my opposition to punching Nazis and Antifa violence (I feel uncomfortable saying 'FUCK ANTIFA!' as I feel that there's more to Antifa than just the nazi punching and property destruction that people love to paint Antifa as and I don't want to misrepresent them, but fuck the ones who punch people and destroy property. Progressive Values 101: No Offensive Violence allowed) and the fact that I don't want to completely destroy Capitalism (I want Social Democracy. I want Universal Healthcare, Universal College, All the systemic ___ist systems destroyed, a New New Deal, and a Basic Income for when the robots take all of our jobs, but I still want businesses to exist. I still want to buy shit. I want Coca Cola, Disney, Tesla, etc to exist and make a profit. Just not own everything and buy all the politicians and run everything). I feel like this video sums up almost all the complaints I have with the left. Another excellent video, from a progressive Social Democrat fan.","en","relativeinsight","2019-08-01T00:00:00"
"Also Also, to the tabbys of the world: Don't tell me what I can start with, tell me what's good enough.","en","relativeinsight","2019-08-01T00:00:00"
"Also, this video for me brought back the magic I found when I first discovered you. Job well done.","en","relativeinsight","2019-08-01T00:00:00"
