"Text","Language","Source","Date"
"Political videos tend not to be interpreted very charitably (I know this video is going to be upheld by centrists as evidence I've 'gone full Antifa' and by leftists that I'm a closet centrist) so I'd better state unambiguously what I think.  The character Tabby represents a lot of what I think is wrong about leftist strategy: the indifference to optics, the undisguised hostility to the ideologically impure, the sectarian nitpicking, the alternation between extreme optimism ('a communist revolution can happen in the United States and it will go well if it does') and extreme pessimism ('neoliberal propaganda has so tight a grip on the general public that why should we even bother trying to appeal to them?'), the blurring of lines between recognizing the necessity of violence in certain situations and the aesthetic celebration of violence as an end in itself. Nevertheless I try to represent Tabby with some sympathy, and anticipate that my viewers will like her--my audience is at least 95% trans Antifa cat girls, but I hope that doesn't prevent them from thinking about the critique.  The character Justine is a mouthpiece for a lot of my complaints about the left, and the recipient of some leftist criticisms of me ('you go to brunch with these people?'), but I chose not to represent her as an attractive alternative. She's complacent, frivolous, and ineffective, full of derision for the way other leftists do things but not contributing much for her own part either. When a fascist comes knocking on the door it's better to have Tabby there than Justine. To see if Justine can put her money where her mouth is we'd have to see what speech she delivers following the fascist speech. This YouTube channel is effectively my attempt to make that speech, and I can't be the one who judges how successful it is.","en","relativeinsight","2019-08-01T00:00:00"
"Why do you try to appeal to centrists so much? Right wing aka nazis don't deserve any attention. Punch nazis. Fuck yes communism.","en","relativeinsight","2019-08-01T00:00:00"
"What a massive faggot","en","relativeinsight","2019-08-01T00:00:00"
"Tabby is fucking awesome.   That is all.","en","relativeinsight","2019-08-01T00:00:00"
"In the end...don't we all get the bullet? In life?","en","relativeinsight","2019-08-01T00:00:00"
"Hey sounds like the bit on fascism. Don't show your power!","en","relativeinsight","2019-08-01T00:00:00"
"not gonna lie the fascist girl at the start was really fucking hot","en","relativeinsight","2019-08-01T00:00:00"
"this video is super valid and i try to keep that cool as cucumber strategy (emphasis on try). But... is kinda hard to believe thats all when there are right-winged people screaming about video game characters and and how having a black little mermaid is ruining their lives so i guess we could tackle on that too? i guess?","en","relativeinsight","2019-08-01T00:00:00"
"Tabby is utterly adorkable! I love the way she paws her way through the curtains in the beginning.","en","relativeinsight","2019-08-01T00:00:00"
"What is 'negative materiality' ?","en","relativeinsight","2019-08-01T00:00:00"
"SJW like to buy both the right and the left","en","relativeinsight","2019-08-01T00:00:00"
"Looked this up after hearing about it on NPR and all I can say is A - freaking - men, sister! I'm a little tired of us being right, yet still losing the argument.","en","relativeinsight","2019-08-01T00:00:00"
"throughout this clip you essentially say that you have a public voice, and a private voice. fucking creepy and gay. glad I'm not on the 'right side of history'.   stop dressing like a woman you fop","en","relativeinsight","2019-08-01T00:00:00"
"No-one:  Not a soul:  Nobody, not a person, no entity in the entire universe:  CP:  [bangs on the door] Hello fellow whites,","en","relativeinsight","2019-08-01T00:00:00"
"VERY good ! Very useful. And Miles as the paradigm for the left ! Why didn't I think of that?","en","relativeinsight","2019-08-01T00:00:00"
"Why is tabby everything I need","en","relativeinsight","2019-08-01T00:00:00"
"my dick explode","en","relativeinsight","2019-08-01T00:00:00"
"Is it really propaganda if it's true?","en","relativeinsight","2019-08-01T00:00:00"
"As a social democrat, I'm in love with Tabby.","en","relativeinsight","2019-08-01T00:00:00"
"Honestly I love Tabby's aesthetic.","en","relativeinsight","2019-08-01T00:00:00"
"Only a true fascist would have Tannhauser in Eb. Spot on.","en","relativeinsight","2019-08-01T00:00:00"
"I went to Amazon to  buy your M-E Reader.  Please, please, please!","en","relativeinsight","2019-08-01T00:00:00"
"If things don't calm down soon Tabby's gonna go stabby","en","relativeinsight","2019-08-01T00:00:00"
"Why do leftists exist?","en","relativeinsight","2019-08-01T00:00:00"
"i always love the debates between tabby and justine. lots of good ideas presented through dialogue and the sexual tension really spices it up","en","relativeinsight","2019-08-01T00:00:00"
"commenting for my algorithm","en","relativeinsight","2019-08-01T00:00:00"
"Almost 2 years later and Tabby was still right about everything.","en","relativeinsight","2019-08-01T00:00:00"
"When the right claims the left can't meme, just point them to the most unexpected matrix reference of all time here. They'll be comrades in no time.","en","relativeinsight","2019-08-01T00:00:00"
"8:29   but Tabby, madelines are fucking great","en","relativeinsight","2019-08-01T00:00:00"
"5:37 ay you didn't include 'enjoy yourself' by saint pepsi in your tracklist lol","en","relativeinsight","2019-08-01T00:00:00"
"Since this video was first released, I've drifted politically over time from agreeing with Justine to agreeing with Tabby. I'm fairly uncomfortable with this development, though I still agree with Justine on points like optics and 'feeling boring' ie being more difficult to understand.","en","relativeinsight","2019-08-01T00:00:00"
"I kind of wish i was having these discussions","en","relativeinsight","2019-08-01T00:00:00"
"Professional advise. It doesn't matter how left your cat girl is, if you give her fangs and ears people are going to fucking fall all over her.","en","relativeinsight","2019-08-01T00:00:00"
"This is enlightening A.F !!!!!!","en","relativeinsight","2019-08-01T00:00:00"
"contra points is a male. Debate me.","en","relativeinsight","2019-08-01T00:00:00"
"not justine's best moments! freya always makes me laugh and i lowkey love tabby (and justine!)","en","relativeinsight","2019-08-01T00:00:00"
"Does anyone else get a Tarantino vibe from this channel?","en","relativeinsight","2019-08-01T00:00:00"
"'Death to capitalism, hail Satin.' is going to be something I say from now on.","en","relativeinsight","2019-08-01T00:00:00"
"We stan Justine","en","relativeinsight","2019-08-01T00:00:00"
"How do you manage to be so devastating with words while still keeping the tone?  I never seen a channel filled with so much meaningful content and cinematography. Its like your the reasonable eye in the middle of a culture storm that brings it all together without being nasty. Also, your hot sauce in any character. If I had a friend like you to BS with at work (in tech) my life would just be absolutely complete.","en","relativeinsight","2019-08-01T00:00:00"
"As a Leninist I feel called out. Lol","en","relativeinsight","2019-08-01T00:00:00"
"I love how you even made the hand gestures of the Nazi look like Trumps'","en","relativeinsight","2019-08-01T00:00:00"
"Fascists support a large, redistributive welfare state, and government control of the means of production.  Yes, they are horrible racists.  But they are also socialists.  As a first cut, Fascism is a racist form of socialism.  And they do tend to look good in black leather...","en","relativeinsight","2019-08-01T00:00:00"
"I love Tabby so much, oh my god.","en","relativeinsight","2019-08-01T00:00:00"
"I feel like Justine is the closest representation of your gender/sexuality, but nothing else not your ideals.  She wants Tabby bad, the fascist should come back while Tabby is in the bathroom, then won't leave when asked nicely by Justine, then gets a little handsy, then Tabby comes out and chases her off and then Tabby and Justine should have some angry passionate sex or at least make out a little.  I realize this may be hard to film as you don't have a parent trap style budget, but I'll just imagine it until then.  ","en","relativeinsight","2019-08-01T00:00:00"
"In which two people who don't quite know the rules of chess attempt to play chess.","en","relativeinsight","2019-08-01T00:00:00"
"I will allways shipp Tabby and Justine. Its anny fanfiction about it out there on the internet?","en","relativeinsight","2019-08-01T00:00:00"
"I have to say the chick on the right threw the game away, should have marched her king towards the past pawn on a2 and promoted, she needs to study endgames","en","relativeinsight","2019-08-01T00:00:00"
"more Tabby!","en","relativeinsight","2019-08-01T00:00:00"
"'yaaas girl YAAAAAAAAAAS-' 'i just realised that i actually hate you' i love this fuvuckign channel","en","relativeinsight","2019-08-01T00:00:00"
"'afternoon tea?! does Jeeves bring madeline cookies and fresh-sliced lemon wedges??' omg","en","relativeinsight","2019-08-01T00:00:00"
"'You're not a Communist? Why?'   'Well... the millions of dead bodies? Also, I like having... things? Like... food?'  'Yeah, but you know that Marx differentiates between...'   'Yeah, I'm sure that's of great comfort to the literal tens of millions of dead bodies.'","en","relativeinsight","2019-08-01T00:00:00"
"ICE. COLD. MOTHERFUCKERS.  You gave yourself away, Contra, by spelling it correctly.","en","relativeinsight","2019-08-01T00:00:00"
"i feel like tabby represents a group leftist THEORISTS most commonly seen on the internet and not outside making changes toward their ideological ideals. actual anarchists help out their communities and feed people and put their life on the line at blockades (and often don't even mention anarchy while doing so) instead of spurting political jargon and getting into twitter fights. most legit anarchists i've met don't go on the internet much if at all. Armchair commies are a shitty subset but unfortunately the most visible image of the radical left.","en","relativeinsight","2019-08-01T00:00:00"
"2:45: well the politician and the giant corporation that run media actually does side with the left, or at best uses them as useful idiots for their own agenda.. even then they barely win these days. 3:44: that's what happens when you demand a high minimum wage, they'll outsource slave labor abroad. 4:21: bingo! and you'll never convince the left to change, instead you'll push them to something nasty to counter it.","en","relativeinsight","2019-08-01T00:00:00"
"I Love Love Loooove this. This is too perfect.","en","relativeinsight","2019-08-01T00:00:00"
"I know I'm fairly late to comment, but I think part of what holds the left back is that centrists/moderates and especially those on the far right see violence as justifiable or even non-violent when done by the state. I was talking with a friend who said he hadn't considered police arresting people and courts incarcerating them as violent actions. When I proposed that they were, he tepidly agreed but said my viewpoint was cynical. Thinking about this video and my experiences, it really is an uphill battle helping largely unmotivated people drill through their own social conditioning. The solution is to motivate them to do the work themselves. It's the only way to bring change non-violently.  This is coming from someone who is fairly new to the left. I'm still unsure about where I stand exactly within the left and how to best communicate/advocate ideas that are still somewhat new to me","en","relativeinsight","2019-08-01T00:00:00"
"Holy shit I feel so understood by Justine.","en","relativeinsight","2019-08-01T00:00:00"
"Lmao the Mao-Zedong photo in the background","en","relativeinsight","2019-08-01T00:00:00"
"Schrodinger's queer cat can be both feminine and masculine without being inside the box","en","relativeinsight","2019-08-01T00:00:00"
"going to have to keep an eye out for a Miles Davis bio.","en","relativeinsight","2019-08-01T00:00:00"
"I can't believe I just watched a 10-minute Socratic discussion on the left.   Incredible. Succinct, incredibly informative and witty. Subbed!","en","relativeinsight","2019-08-01T00:00:00"
"'Neo' as in new?  What happened to the old?  Neo-conservative, Neo-liberal, Neo-marxist, Neo-whatever!  Please explain the old one first.","en","relativeinsight","2019-08-01T00:00:00"
"I have noticed that the more the Yanks talk about Marxism, the more the young people read Marx.  Jordan Peterson and Ben Shapiro aside, young Americans may come to embrace the social construct, knowing that we are the most social animals on earth.","en","relativeinsight","2019-08-01T00:00:00"
"Why will no one bring up people like Kropotkin, Goldman, Godwin or Bakunin? Fuck Engels and Marx.","en","relativeinsight","2019-08-01T00:00:00"
"ANTIFA is pretty much the real-life Nights Watch, they wear black and guard human civilization against the white nationalists. They also wear black and no one is listening to their warnings.","en","relativeinsight","2019-08-01T00:00:00"
"If you dont look at tabby and think shes awesome maybe you're the one with the problem","en","relativeinsight","2019-08-01T00:00:00"
"I mean, what happened between Jastin and Jacky? Thay seem so friendly new;(","en","relativeinsight","2019-08-01T00:00:00"
"7:08 Rojava","en","relativeinsight","2019-08-01T00:00:00"
"This only confirms my theory that fascism wants security and therefore that's why they have that simplistic discourse.","en","relativeinsight","2019-08-01T00:00:00"
"The ice cold motherfucker bit really makes sense to me. I find myself and other Leftists frequently frustrated with the question of how to win hearts without watering down our politics or opening ourselves to being co-opted by counter-revolutionaries. Big fucking thank you Miles Davis and ContraPoints [?][?][?]","en","relativeinsight","2019-08-01T00:00:00"
"But punching Nazis is fun.","en","relativeinsight","2019-08-01T00:00:00"
"It's a good illustration of the left confusion. The fascists pull together with conservatives, religious, free market, gun lovers. The left has to form a coalition of inclusive liberty. Rare  and autoantonymic libertarian socialists, evangelical communists, liberty, justice, and fun for all. Top down? Bottom up? So you have a 2nd amendment. Maybe that means a socialist America gives guns, ammo, and training to all who want to be the well regulated militia. BUT no imperial army global army. Every citizen is the people's army. Filter out and prevent trouble. Equal protection under the law? Make all lawyers public defenders. Rich, poor, individual, collectives, corporation all get an assigned public defender. Eliminate justice to the highest bidder. Instead of scary titles like socialist or communist, how about egalitarian? Be aware, if you get traction, you be infiltrated, studied, and denatured.","en","relativeinsight","2019-08-01T00:00:00"
"*gasps in leftist illiteracy*","en","relativeinsight","2019-08-01T00:00:00"
"Didn't know leftists could read lol","en","relativeinsight","2019-08-01T00:00:00"
"As a fucking CENTRIST I am thrilled to see you chastise these fucking ignorant 'communists.' I consider myself a socialist and a capitalist, therefore a CENTRIST. Capitalism is AMAZING, albeit flawed (US Healthcare). Socialism is AMAZING, albeit flawed, (look at the US military industrial complex.) America WAS the greatest nation on earth after world war two -- besides the virulent racism -- because it managed the best synthesis of these two ideas ever seen on earth. Capitalism and socialism are a match made in heaven and I wish more people could see that.","en","relativeinsight","2019-08-01T00:00:00"
"ANTIFA are the Fascist NAZI you fool ! !","en","relativeinsight","2019-08-01T00:00:00"
"Ice cold motherfuckers. Ok","en","relativeinsight","2019-08-01T00:00:00"
"There's a lot of left-wing speeches from back in the day that would still resonate today. There's also a lot of Rock 'n' Roll that we can use.","en","relativeinsight","2019-08-01T00:00:00"
"L A B O R W A V E","en","relativeinsight","2019-08-01T00:00:00"
"man this brings me back to 2009 YT where we had scenes actually acted out instead of vlogs with big ass intros.","en","relativeinsight","2019-08-01T00:00:00"
"Snickgers","en","relativeinsight","2019-08-01T00:00:00"
"A chess game realy? But good video","en","relativeinsight","2019-08-01T00:00:00"
"2:55  It seems someone has decided to try and use Lelouch's chess strategies in real life.","en","relativeinsight","2019-08-01T00:00:00"
"Great video and on point! Btw Whats the music playing with the pink Marx bust animation?","en","relativeinsight","2019-08-01T00:00:00"
"i've watched this video before but never noticed the picture of mao","en","relativeinsight","2019-08-01T00:00:00"
"every single one of those chess moves were illegal AHH","en","relativeinsight","2019-08-01T00:00:00"
"That Tannhauser Overture playing at the start though <3","en","relativeinsight","2019-08-01T00:00:00"
"The only correct thing in the video was what the 'fascist' said.  Telling.","en","relativeinsight","2019-08-01T00:00:00"
"What the fuck was that chess game....","en","relativeinsight","2019-08-01T00:00:00"
"I am in ardent agreement with the first one minute and thirty seconds of this video.  But even after the 1:30 mark, Natalie's critique of the Left was hilariously spot on.","en","relativeinsight","2019-08-01T00:00:00"
"Would unironically pay big money for that vapourwave Marx design","en","relativeinsight","2019-08-01T00:00:00"
"TANNHAUSER! Love me some Wagner. Too bad he was pretty much a Nazi.","en","relativeinsight","2019-08-01T00:00:00"
"'Calm and Collective': the strategy that might be the most effective game plan, if and only if executed correctly ... might be.","en","relativeinsight","2019-08-01T00:00:00"
"So I guess no one wants to mention how many millions of people were murdered under communism. Or how those ideologies always produce psychopathic murderer's to become the dictator? No that would make too much sense.","en","relativeinsight","2019-08-01T00:00:00"
"I never heard a person from the right say that another person is not 'something' enough. They are more welcoming than the left, it's a winning strategy. They are supposed to be horrible xenophobes or racists, yet black people can run for the republicans. When I was a teenager, I got really interested by the Punk movement but rapidly understood I could never fit the mold for various reasons but the first one is being fat. Did you ever notice that fat punks don't exist nor big punk clothes? It is problematic that leftist movements that are supposed to be anti-establishment are like ultra private clubs with strict rules about behavior and apearance. It's not just the intellectual elite that does that, it can be a group of crusty squatters. There are Straight Edge punks that are against taking any drug. The idea is that you have to have a clear mind, free of distraction to see reality as it is and combat it's evils. A good idea in theory, but what happens if you become physically or mentally sick? And there are other hippie-like groups that think if you don't do all the drugs especially psychedelics you can't have an open mind and see reality as it really is. There is also infinite conflicts inside ideologies like the famous Marxist-Leninist/Trotskyst clash. It is totally okay to debate and question things but dividing incessantly can be counter productive. My favorite sketches from the show Portlandia were about the fictional bookstore 'Women and Women first', I'm a lesbian feminist and I laughed heartily at those caracters that were supposed to spread their ideology but just ended alienating every single person they met instead.","en","relativeinsight","2019-08-01T00:00:00"
"I feel so fucking stupid lmao I saw ACAB and assumed it was 'assigned cat at birth'.","en","relativeinsight","2019-08-01T00:00:00"
"I am a liberal and I sure as hell don't protect facists. Even though I don't really agree with the Marxist way (and also think it's absolutely impossible to apply in reality and is just an unrealizable utopia), when it comes to combating the facist scum, I think we're all in this together, socialists and liberals alike. We may not agree on everything (or maybe anything, really) when it comes to economy, but we sure as hell have a common enemy when it comes to human rights, acceptance and tolerance.","en","relativeinsight","2019-08-01T00:00:00"
"I love how this is a dialectic roasting people who use of the word dialectic - makes me feel seen","en","relativeinsight","2019-08-01T00:00:00"
"antifa girl can take my queen any time","en","relativeinsight","2019-08-01T00:00:00"
"Left is crazy!","en","relativeinsight","2019-08-01T00:00:00"
"These videos are works of art.","en","relativeinsight","2019-08-01T00:00:00"
"Omg the matrix...you are a fucking goddess.","en","relativeinsight","2019-08-01T00:00:00"
"Trump is an open Zionist with a Jewish daughter and son in law. Portraying him as a Nazi makes you look.....well not very bright is the nicest way I can put it.  PS- To the rabid fans already typing how fascist I am; nope I'm a Zionist too. I believe that Israelis have a right to have a country and not be exterminated.","en","relativeinsight","2019-08-01T00:00:00"
"Honestly I think the left fetishes the right and one cannot exist without the other, for the right as we currently know it to go away so does the left have to vacate the stage for the centre ground.","en","relativeinsight","2019-08-01T00:00:00"
"The left is completely evil And hates whites","en","relativeinsight","2019-08-01T00:00:00"
"I think it's safe to say Destiny won this debate.","en","relativeinsight","2019-08-01T00:00:00"
"i know this is an old video but i love the way you can play two characters where neither is completely right or wrong. i think most people would frame the one they disagree with as crazy and wild while their own mouthpiece character is logical and chill and eye-rolling at the strawman. you allow both characters to be both reasonable and make good points, and also be wrong at different moments. you allow the audience to decide what they believe, rather than handing them your own opinion, which i think is what makes writing good. its also more realistic than heavy handed hypothetical debates. thanks.","en","relativeinsight","2019-08-01T00:00:00"
"You're cute for a guy, no homo.","en","relativeinsight","2019-08-01T00:00:00"
"Cat Girls of the Left Unite! TABBY FOREVER!","en","relativeinsight","2019-08-01T00:00:00"
"I have a nazi uniform fetish so this gave my mental dick a boner  Good vid tho","en","relativeinsight","2019-08-01T00:00:00"
"Am I the only one triggered that the king and pawn endgame got randomly swapped out with a different position?","en","relativeinsight","2019-08-01T00:00:00"
"As a centrist, I have nothing but mixed feeling about everything in this vid. I don't even know if I should thumb' up or down.","en","relativeinsight","2019-08-01T00:00:00"
"10:16 what's the soundtrack?","en","relativeinsight","2019-08-01T00:00:00"
"Watching this video and reading Natalie's explanation of it really does get me even further aboard the 'Contrapoints is the best thing to happen not only to Youtube since its inception but possibly to the whole goddamn internet since it came alive and started eating human thoughts, like zombies but more metaphorical' train.","en","relativeinsight","2019-08-01T00:00:00"
"I have that chess board","en","relativeinsight","2019-08-01T00:00:00"
"10:15 I am CRYING","en","relativeinsight","2019-08-01T00:00:00"
"Sadly anyone's libel to being lined up against the wall when the revolution comes.","en","relativeinsight","2019-08-01T00:00:00"
"666k views","en","relativeinsight","2019-08-01T00:00:00"
"you definitely won this centrist over.","en","relativeinsight","2019-08-01T00:00:00"
"as someones whos antifa and an anarchist, i super enjoyed this video! and youre 100% right, one of my issues with my fellow anarchists is that they arent very eloquent in their arguments, they cant participate well in debate, and they cant calm down. understandably so! a lot are poor, homeless, mentally ill, targeted on a daily basis, have no interest in out fucked school system. i get it! i was extremely angry and outbursty in my debate before i even knew what being an anarchist was. i think a good way to solve this would be to advocate for our antifa to join a local speech and debate club at their school or college, have one of your actor friends to teach you some shit, idk just find ways to learn how to make your ideology seem better and 'cooler' and more appealing","en","relativeinsight","2019-08-01T00:00:00"
"actually decent video... not for me but, decent information","en","relativeinsight","2019-08-01T00:00:00"
"Tabby is my spirit animal","en","relativeinsight","2019-08-01T00:00:00"
"Never thought I'd be jealous of a nazi punching person in car fangs but nazis aren't good at all","en","relativeinsight","2019-08-01T00:00:00"
"damn i just realized me and Tabby are the same person","en","relativeinsight","2019-08-01T00:00:00"
"#<3!","en","relativeinsight","2019-08-01T00:00:00"
"Why are you so fucking hot as a fascist","en","relativeinsight","2019-08-01T00:00:00"
"'Ladies and gentlemen a leftist'  'Reeeeerrrrrrer' I almost died, this is so hilarious and accurate[?]","en","relativeinsight","2019-08-01T00:00:00"
"Tabby is life","en","relativeinsight","2019-08-01T00:00:00"
