"Text","Language","Source","Date"
"I think this was one of the best videos I've seen on this channel, it just works so well. I'm a leftist and I study politics and social services at university. I run into alot of far left communist types and at the start I was very much interested in what they had to say but now I keep away. Although I'm more of a democratic socialist I empathise with them but the way they go about spreading their message is detrimental not only to them but the left as a whole. They've burst into lectures, constantly harass everyone and show up and try and sell you stuff at rallies they don't have anything to do with. They are now despised on campus which ruins any leftists groups chance to gain stable ground. For them it's mostly about the image then the goal, they like the idea of being a radical so much that they no longer care about public perception. Unfortunately this sets not only them back but every other left leaning person back too. They need to understand the consequences of poor public perception.","en","relativeinsight","2019-08-01T00:00:00"
"*Gordon Ramsey voice* FINALLY some good fucking takes!","en","relativeinsight","2019-08-01T00:00:00"
"THIS VIDEO IS A MASTERPIECE","en","relativeinsight","2019-08-01T00:00:00"
"Does anyone know where to find literature on the eastern kamerun communist period?","en","relativeinsight","2019-08-01T00:00:00"
"Done it. Patreon now. No date option tho :'( iiiiiits faaaaine","en","relativeinsight","2019-08-01T00:00:00"
"This is so clever. It blows my mind. How do i patreon you? And how do i date you?","en","relativeinsight","2019-08-01T00:00:00"
"social justice, drugs, and rock n roll","en","relativeinsight","2019-08-01T00:00:00"
"3:23 basically why I can't go eco-warrior. I like stuff.","en","relativeinsight","2019-08-01T00:00:00"
"I would love to see you on the sam harris podcast:) love your work:)","en","relativeinsight","2019-08-01T00:00:00"
"a e s t h e t i c music","en","relativeinsight","2019-08-01T00:00:00"
"ok but tabby is me irl","en","relativeinsight","2019-08-01T00:00:00"
"I have that exact copy of the Marx/Engels reader. I think it's standard issue for philosophy undergrads.","en","relativeinsight","2019-08-01T00:00:00"
"There's no way in hell I can hear the music at 0:38 and not envision that sumptuously fat, floral-wreathed horse bounding down the hill like some kind of equine goddess, with a cross-dressed Bugs Bunny on its back. <3","en","relativeinsight","2019-08-01T00:00:00"
"yknow? im what ppl consider an 'angry sjw uwu' and like, this is one of the few good videos questioning leftism ive actually seen. its still poking fun at the our teen weeb aesthetic, but theres no making fun of lgbt people and our identities, or or using straw arguments, or making us a human personification of the 'autistic screeching' meme. its a video which lets you sympathize with both sides, address shit we actually say and do without painting ppl as 'angry ess jay double u feminazis uwu' and is all in all a well written video with good counter points from both sides, regardless of if people agree with them or not. real cool of you to make this! ill definitely show it to some of my friends.","en","relativeinsight","2019-08-01T00:00:00"
"HA the Vaporwave Marx Reader made me laugh. And social justice, drugs, and [various kinds of music] is basically my life already! Great video. I don't know how I only just now found your stuff.","en","relativeinsight","2019-08-01T00:00:00"
"Man, Wagner's music is greate!","en","relativeinsight","2019-08-01T00:00:00"
"My one complaint about this video is that it fails to capture the sort of nihilistic hopeless 'bash the fash' that exists among the great many of us who've looked at the reality of our current political landscape, at the reality of climate change, at the reality of entrenched systems, and have decided that there is nothing productive to do. There truly is no revolution. There's just revenge. And I feel morally and ethically compelled to keep trying to improve things even in the face of futility--I think it would be wrong to do otherwise--but I don't for a second confuse that for real hope.   We're fucked. I mean, that's the real truth of it, right? And we can keep fighting all the way down like goddamned good people or we can lay down and it happen. There's a middle ground between those that Justine here is espousing, but it only exists for those who believe there's any reason to pursue it.   I don't think anything in this video is wrong. I just have a hard time grappling with how it might fit with my worldview, and in the end I don't think it does, and I don't think I'm anywhere close to alone in that worldview.","en","relativeinsight","2019-08-01T00:00:00"
"Love this style! Cool video!","en","relativeinsight","2019-08-01T00:00:00"
"you are to the left what arca is to music today. i love you","en","relativeinsight","2019-08-01T00:00:00"
"I lolled. A lot.","en","relativeinsight","2019-08-01T00:00:00"
"Tabby is my hero","en","relativeinsight","2019-08-01T00:00:00"
"you know, you can argue than most of the traditionals societies were communist. Look at the kula, the potlatch or the affluents societies as described by Sahlins","en","relativeinsight","2019-08-01T00:00:00"
"Your brain is so sexy","en","relativeinsight","2019-08-01T00:00:00"
"Im surprised how compeling your point about being cool is. I thought at first it was gonna be a dumb joke but you are cool, by your definition, and that does make you and, by extension, your ideas more appealing and i would absolutely read hegel if it had those covers. I might sound stupid or only take what you said as is, but I like to think I'm aware of my biases and tht i am a confroming centrist, so hey, maybe all you said is true.","en","relativeinsight","2019-08-01T00:00:00"
"I love your channel because it's peak libra","en","relativeinsight","2019-08-01T00:00:00"
"Does anyone know the song name at 5:37? Thanks!","en","relativeinsight","2019-08-01T00:00:00"
"I own the same Marx-Engels reader and I've never bothered to open it ","en","relativeinsight","2019-08-01T00:00:00"
"I enjoy these videos, and I'm an ancap. Antifa has shit optics, the left really needs some M A R X W A V E.","en","relativeinsight","2019-08-01T00:00:00"
"You seem to be unhappier in these earlier episodes. Or maybe you just got better at acting?","en","relativeinsight","2019-08-01T00:00:00"
"It's really weird to see a clip of my friend as an exhibit of an 'uncool' figure.","en","relativeinsight","2019-08-01T00:00:00"
"The problem the Left is they don't understand that their current tactics are a waste of time. Especially when the vast majority of people have negative associations with both the far left and far right for different reasons. Take advantage of capitalism, grow high-value skills and dominate the market. Improve capitalism by becoming part of the 1% so that your battle actually has the chance to make real change occur.","en","relativeinsight","2019-08-01T00:00:00"
"love the wagner during the fascist speech","en","relativeinsight","2019-08-01T00:00:00"
"I want the Left to be the best it can be. Here's a video with what we might call a feminist activist ex-Muslim Canadian and a Canadian Jew who was a kind of refugee from Lebanon . Both have critical words for The Left from this perspective.  Why is that not worth considering?  The problem is the use of right wing buzzwords that are somewhat inaccurate given their genuine definitions (postmodernism, etc.) but represent their Real Lived Experience.  Especially a female who escaped a forced marriage to Al-Qaeda.  She should be a leading champion for Leftists instead of being rejected and despised. 'My goal is to tear down Linda Sarsour ...' ~ Yasmine Mohammed Why does she have to aim to do that with Dave Rubin instead of with someone more from Leftist politics? URL","en","relativeinsight","2019-08-01T00:00:00"
"Absolutely brilliant! I'm going to use this (and other ContraPoints videos) in some of the college courses I teach.","en","relativeinsight","2019-08-01T00:00:00"
"my god, you are absolutely phenomenal. i am so glad i found this channel.","en","relativeinsight","2019-08-01T00:00:00"
"It feels so good to hear from someone on my own team who isn't whacked out on shrooms.","en","relativeinsight","2019-08-01T00:00:00"
"Neither of them know how to play chess... I feel like that's a meta joke somehow but I don't get it","en","relativeinsight","2019-08-01T00:00:00"
"You're fucking genius","en","relativeinsight","2019-08-01T00:00:00"
"That mouth twitch right after the 'No!' was fucking perfect.  Oh, and the video was very thoughtful and edifying.  'I'm an anarcho-syndicalist.' COME AND SEE THE VIOLENCE INHERENT IN THE SYSTEM, HELP, HELP, I'M BEING REPRESSED","en","relativeinsight","2019-08-01T00:00:00"
"Talking with fascists has its place. Too. You seem to think of liberals as unprincipled but we are capable of dissecting fascist and racist movements as well with honest tactics.   Moreover, fascists fall on their face and look absolutely 'uncool' all the time. Be it serious scandals such as domestic abuse and rape threats toward their own side or small stuff like being heralded by fat neckbearded edge loads. The alt-right and its constant rebranding will not take over America.","en","relativeinsight","2019-08-01T00:00:00"
"I _really_ like Tabby. :D","en","relativeinsight","2019-08-01T00:00:00"
"God the music choices are soooo goood","en","relativeinsight","2019-08-01T00:00:00"
"#freemarketlyfe  Well done! It's been a wonderful break from Sargon. Although I'll always love Dankula, probably because I was in TEST.  o7 Fly safe.","en","relativeinsight","2019-08-01T00:00:00"
"Love the tribute to vaporwave [?]","en","relativeinsight","2019-08-01T00:00:00"
"So great! I fully endorse ice cold motherfucker politics for the left!","en","relativeinsight","2019-08-01T00:00:00"
"that was truly inspiring","en","relativeinsight","2019-08-01T00:00:00"
"So, in the video where you tell that fascists try to cover up their power level. Isn't this just the same? Aren't you covering radical ideas in a more accessible cover?  I do agree though. It's hard to have a conversation with someone who loses their cool. So I think it's not 'hip' or 'propaganda-like' to stay cool (as you suggest), it's practical.","en","relativeinsight","2019-08-01T00:00:00"
"hey most of my stuff was made by slaves too!","en","relativeinsight","2019-08-01T00:00:00"
"What is this Team Mystic propaganda.","en","relativeinsight","2019-08-01T00:00:00"
"I think Earthling Ed is a good example of someone who is cool yet unpopular (with the mainstream).  The left needs more people like him.","en","relativeinsight","2019-08-01T00:00:00"
"that white and black wig tho <3","en","relativeinsight","2019-08-01T00:00:00"
"this has summed up and clarified a lot of things for me. this is a good channel","en","relativeinsight","2019-08-01T00:00:00"
"Not that I disagree with any of these points - but doesn't it seem a little weird that the right never has to have these sorts of conversations?  I mean, they don't have to appeal to moderates or centrists... they just let their freak flag fly and still win.  And it doesn't even matter how moderate or controlled a leftist portrays themselves, half the country is still going to make believe they're to the left of noam chomsky.","en","relativeinsight","2019-08-01T00:00:00"
"Why does the leftist look more like Melanie Martinez?","en","relativeinsight","2019-08-01T00:00:00"
"Love the self-referential meta of this video. You are literally promoting Marxist ideas that otherwise none would learn about by wrapping them in a high quality, 'cool' production. Workers of the world, unite!","en","relativeinsight","2019-08-01T00:00:00"
"damn this girl has a Mao portrait.","en","relativeinsight","2019-08-01T00:00:00"
"'social justice, drugs and rock and roll ' shit how can i reject that?","en","relativeinsight","2019-08-01T00:00:00"
"Ice cold leftism is the only way","en","relativeinsight","2019-08-01T00:00:00"
"the bells jingling got me :D this was a really really interesting conversation","en","relativeinsight","2019-08-01T00:00:00"
"I am astonished by your wisdom and acumen. I learn scores from your videos. Thanks for your work on this channel. The presentation is great, you always have me laughing, and I needs must mention again how much I learn from you.","en","relativeinsight","2019-08-01T00:00:00"
"Lol better hope the Trump crisis blows over","en","relativeinsight","2019-08-01T00:00:00"
"Yeap. That's Jordan Peterson's idea of the 'left'. Don't you have real left in USA?","en","relativeinsight","2019-08-01T00:00:00"
"I like figures like the Matrix's Neo. Self-composed and slightly reserved but with warm undertones. They should rule the world! ;-) But I guess the war can be won only by the ice cold mofos.","en","relativeinsight","2019-08-01T00:00:00"
"Libertarian minded straight brown nigga right here. Big fan of your channel. Love the truediltom reference. Both of y'all got fly taste in music. And mad props for being so audaciously trans. You remind me of my homegirl in Seattle. She probably a subscriber too. Staying true and holding it down. Much needed fucking role for the community. I don't think I'd be able to do what you do without drinking at least twice as more than your ass. Your video on the lobster one had me hysterical. Especially the part in the bath.","en","relativeinsight","2019-08-01T00:00:00"
"Am I the only anarcho-capitalist here? I'm feeling lost !","en","relativeinsight","2019-08-01T00:00:00"
"I like Jacky!","en","relativeinsight","2019-08-01T00:00:00"
"This is amazing honestly, thank you for the effort","en","relativeinsight","2019-08-01T00:00:00"
"'You seem to not even care about what's actually possible, that's how deep you are in pure theory. And if anything is anti-marxist, it's that.'  Daaaaamn girl","en","relativeinsight","2019-08-01T00:00:00"
"an anarcho syndaclist with a red on red and a hammer and sickle? lol","en","relativeinsight","2019-08-01T00:00:00"
"i'm only here for the intelligent humor, creative delivery, interesting topics and original perspective","en","relativeinsight","2019-08-01T00:00:00"
"Love the reference to Bruce and Trixie at the end! I've only just discovered this channel, and have instantly become a huge fan of the intelligent, nuanced take on issues. I'm also loving the humour and aesthetic, and the cast of characters, so the callback to the previous video where you already tried this kind of dialogue is superb, and helps cement the feel of a contained ContraPoints universe. Keep up the work, these videos are by far and away some of the best content on YouTube, and very valuable and thought-provoking. And laugh out loud funny!","en","relativeinsight","2019-08-01T00:00:00"
"Jeez Contre, just how many different costumes do you have? They're great.","en","relativeinsight","2019-08-01T00:00:00"
"Tag yourself I'm the leftist","en","relativeinsight","2019-08-01T00:00:00"
"For all thing's Anarcho-syndicalist check out libertarian socialist rants","en","relativeinsight","2019-08-01T00:00:00"
"These roleplays are great!","en","relativeinsight","2019-08-01T00:00:00"
"'Victory Gin'. I feel so smart for getting that. Sorry if that's depressing but it's true.","en","relativeinsight","2019-08-01T00:00:00"
"this is SO goood","en","relativeinsight","2019-08-01T00:00:00"
"But...is it true that for-itself can only be actualized through the in-itself? I wanna know, damnit!","en","relativeinsight","2019-08-01T00:00:00"
"My only critique of this is that I think you painted with too broad a brush. Your caricature of the left is a homolgomation of aynsyns, trots, SJWs, and I guess leftcoms?  There is little utility in painting 'the left' with so broad a brush. We're talking about schools of thought that fundamentally disagree on both methods and motives. There will never be 'left unity' because 'the left' is defined only by our opposition to 'the right,' a term nearly as vague as its opposite. The left will never agree on how to confront the problem because we disagree on what the problem is, and we also fundamentally disagree on the best way to go about combating the problem.   It's okay to be specific about who you are and who you oppose. I'm a Marxist Leninist and I am opposed to Imperialism above all else because I believe that imperialism is the greatest barrier to working class power, and I believe that all the specific forms of oppression are expressions of imperialism. Therefore, to dismantle bigotry, poverty, etc, we have to confront the root of the problem. This belief and approach differs on a fundamental level from the beliefs and approaches of anarchists, leftcoms, trots, etc. Anarchists, for example, barely (if ever) recognize the existence of imperialism at all.  I think this video is pretty good overall as its criticisms of certain elements of the left ring true. We do need to be doing a better job of cultivating an image that is appealing to the masses. We also need to do a better job of meeting people where they're at instead of demanding people abandon their fundamental beliefs at the drop of a hat. All that being said, however, I felt that the video fell a bit flat on how to move forward. Simply improving PR will not move us forward. Only class struggle can do that. I agree with Boots Riley for the most part on this. We have to prove to the masses that our methods work by winning real material victories, not symbolic ones. Only then can we begin to build a working class movement. An appealing public image is a component of that, for sure, but without the class struggle component, it will be just as futile as knocking over trash cans.","en","relativeinsight","2019-08-01T00:00:00"
"I'm a Liberal, and I'm watching. :P","en","relativeinsight","2019-08-01T00:00:00"
"Darn. No girl on girl action! D:","en","relativeinsight","2019-08-01T00:00:00"
"Too pink. It needs some purple! Come on, girl!","en","relativeinsight","2019-08-01T00:00:00"
"7:30-7:50  Wow that is the most accurate destruction of fringe-extremist group mindset I have ever seen, well done and GG","en","relativeinsight","2019-08-01T00:00:00"
"tabby is me","en","relativeinsight","2019-08-01T00:00:00"
"You are so so so wonderful <3","en","relativeinsight","2019-08-01T00:00:00"
"Alex Jones has this video on his phone.","en","relativeinsight","2019-08-01T00:00:00"
"Not trying to be rude, but it's first time when i found channel about transgender person that's into science, politics, and not into make up and wigs. Amazing content, subbed","en","relativeinsight","2019-08-01T00:00:00"
"This is why I love Natalie, she doesn't pretend that one side is perfect. Her videos say 'hey I like what you're trying to do, but maybe do it this way.'","en","relativeinsight","2019-08-01T00:00:00"
"I loooove tabi  she's cool to me","en","relativeinsight","2019-08-01T00:00:00"
"Amazing channel! The internet is a headfuck and its good to hear some(what) level headedness. Quite a relief actually. Your cool.","en","relativeinsight","2019-08-01T00:00:00"
"Leftist cat girl is awesome........and adorable","en","relativeinsight","2019-08-01T00:00:00"
"Absolutely love the book cover makeovers ","en","relativeinsight","2019-08-01T00:00:00"
"Well you won this centrist over AHAHHAHAHA","en","relativeinsight","2019-08-01T00:00:00"
"THE QUALITY AND AESTHETIC OF THIS VIDEO IS SO GOOOOODDD","en","relativeinsight","2019-08-01T00:00:00"
"Hi Tatiana Maslany I really love your acting!  On a more serious note, it seems like the less-radical-but-still-kinda-left crowd had it right with the coolness and memes? I mean, the one fucking headline I vividly remember, of all things, went something like 'One group Bernie Sanders is very popular with is peddlers and producers of internet memes'","en","relativeinsight","2019-08-01T00:00:00"
"Natalie spending 20 minutes arguing with herself is the successor of the Socratic dialogues.","en","relativeinsight","2019-08-01T00:00:00"
"Was I the only one who imagined Elmer Fudd wielding his spear and magic helmet during the opening speech?","en","relativeinsight","2019-08-01T00:00:00"
"the catgirl still makes all the best points in this video though","en","relativeinsight","2019-08-01T00:00:00"
"Anywhere approaching the middle is one of the hardest places to be in any debate.  You don't have the solidarity available to those who pick one side or the other, and your fellow in-the-middlers are more likely to quibble with you over minor differences of opinion than to effectively oppose an extremist group.  Also...good grief, you're attractive.","en","relativeinsight","2019-08-01T00:00:00"
"You really hit upon something, I never put to words before but rings so true to me, it really is that detachment that appeals to so many centrists","en","relativeinsight","2019-08-01T00:00:00"
"Love you, hail satan!","en","relativeinsight","2019-08-01T00:00:00"
"Hay what's wrong with Trots","en","relativeinsight","2019-08-01T00:00:00"
"Interesting! This is what I was trying to tell all my liberal friends ( before trump) who don't understand the culture war! Instead they shunned me and think I am a trump supporter lol. While I do agree that the left no longer has that cool rock and roll vibe! (One of the reasons why they took an L) I think it's too late to get it back! thanks to the regressive feminists who are gatekeepers and complain about every little thing as micro transgressions. Kudos for the Van Halen riff! But I think the new rebellion that are about that life are the kekistan boys and the troll edgelords! Not the sjw nor the alt right!","en","relativeinsight","2019-08-01T00:00:00"
"E N J O Y  Y O U R S E L F","en","relativeinsight","2019-08-01T00:00:00"
"Market socialism or bust, you beta commie fuckers. Also doxing people is still a crime and a scumbag move, even if said people are dickbags.","en","relativeinsight","2019-08-01T00:00:00"
"Contra, your articulation of multiple viewpoints makes me sapiosexual.","en","relativeinsight","2019-08-01T00:00:00"
"7:21 to 7:45  THE CRUX AND CORE of TANKY COMMUNISTS ARE A JOKE.","en","relativeinsight","2019-08-01T00:00:00"
"can agree, good shit","en","relativeinsight","2019-08-01T00:00:00"
"I am literally in love with you. You're doing the lord's work!","en","relativeinsight","2019-08-01T00:00:00"
"ehh tbh i love the leftist haha, even down to the cat stuff and hissing (especially that!) soo on point. though i gotta agree ice cold is a good idea !","en","relativeinsight","2019-08-01T00:00:00"
"you're so sexy when you're pretending to be a Nazi <3 But I think that's just because I'm a filthy degenerate man who likes women who talk in authoritative tones.","en","relativeinsight","2019-08-01T00:00:00"
"I like stuff! I like this, and I like this, and I like this! That's why I can't be a communist!","en","relativeinsight","2019-08-01T00:00:00"
"New subscriber here! I love these videos a lot and this one is extremely important to the left. I feel as if the visuals and memes of the left are actually pretty damn confusing to the average person who isn't used to this sort of thing, but also understanding that at times the violence is necessary. That was a great point made. I eventually slipped onto the leftist side due to Black influencers like Angela Davis and Fred Hampton, who spoke on issues like this. Hoping your observations and skits here will gain more attention!","en","relativeinsight","2019-08-01T00:00:00"
"The problem I see with communism is a group mentality where in what is perceived as good for the group overrides the needs of individuals and their needs. This was highlighted pretty well in a debate with Laci Green against a TERF marxist (can't remember her name) and she argued that it doesn't matter if a woman does something they feel is personally empowering if it is perceived to make women look bad, or is perceived to hurt women causes.","en","relativeinsight","2019-08-01T00:00:00"
"wagner intro","en","relativeinsight","2019-08-01T00:00:00"
"No, sjw arguments suck aswell as the way they act","en","relativeinsight","2019-08-01T00:00:00"
"I, unironically, would fuck tabby.","en","relativeinsight","2019-08-01T00:00:00"
"What's it say about me, that I'm SUPER into Tabby's cat ears and fangs and anime hair look?   My strange proclivities aside, I love the way you show the catch-22 of how good intentions and ideals keep getting lost amongst the rhetoric and increasingly berzonkers extremist tendencies people are falling into these days. She's got some good points, but it's overshadowed by an inability to look at things from a more rational perspective, and things only seem to be getting worse, not better. Each time one side of the politically extreme perspective pushes, the other side pushes back even harder, with neither coming out the victor in an ever-increasing escalation.  Also, don't mind me, I just found your channel and have been bingewatching everything for the past couple of days because it's all so good. I probably look like a wierdo with all of these comments I'm leaving. I promise, I'm not. ","en","relativeinsight","2019-08-01T00:00:00"
"7:34","en","relativeinsight","2019-08-01T00:00:00"
"I love these characters together. The chess debate was adorable and informative!","en","relativeinsight","2019-08-01T00:00:00"
"I'm on a huge ContraPoints binge, and I'm convinced that this channel is pretty much the best thing to ever happen to YouTube.","en","relativeinsight","2019-08-01T00:00:00"
"'This detached, ironic, pretend-not-to-give-a-shit posturing that white men mistake for rationality is really just a self-celebration of privileged, comfortable ppl with nothing at stake' on point!","en","relativeinsight","2019-08-01T00:00:00"
