"Text","Language","Source","Date"
"Is this primarily out of an america-centric perception? I presume as much but wondering because it might help me get past the whole playing characters bit. A lot of it hits European equivalents as well, but certain portions stick out as odd to me, especially the denomination 'a leftist' and equivocating them all to being boring academics and well, being anti-religion. Including the perception of communism being very different depending on which country you go to. (I'm ignoring all the aesthetic talk because I'm broken on that level, I have no understanding of aesthetics) Also, a million thanks to the black bloc, while I agree with some of the criticism of their usage of violence when it's indiscriminate, they've saved the lives of some of my comrades on the streets. Literally.   (Communists in my country for example, are not anti-religion, at least the largest communist party. I'd also go deeper into it, but if it's america-centric, I'll be out of my depth but, fuck centrists. <3)  P.s That ice cold joke... I cringed so fucking hard.","en","relativeinsight","2019-08-01T00:00:00"
"this is downright fucking *socratic*","en","relativeinsight","2019-08-01T00:00:00"
"Okay, I can't be the only one who wouldn't mind Tabby nibbling on their neck with her fangs before she softly hisses into my ear? I can't handle all of these pretty Contras anymore!","en","relativeinsight","2019-08-01T00:00:00"
"I like how the Anarcho-Syndicalist is literally an angry cat.","en","relativeinsight","2019-08-01T00:00:00"
"+ContraPoints , while I really like this video I was trying to grab a fact from it regarding your point that there was successful Communism; 1910 - 1912 Revolutionary Eastern Cameroon. I was not successful in finding any resources on Google to back this up. I was hoping to use this fact in a discussion I was in the middle of. Would you mind listing some resources to this?  Unlike other SJW Youtubers, you are very precise with your facts and details. I'm guessing you have better links to this information. History of Communism is not exactly this skeptic's wheel house if your know what I mean. Thanks!","en","relativeinsight","2019-08-01T00:00:00"
"Man, you're fucking brilliant. I haven't been this stimulated  (titillated(?)) by anyone in a long time. Your channel is my favorite thing on the internet right now. Keep up the amazing work. You're a role model in my eyes.","en","relativeinsight","2019-08-01T00:00:00"
"I kinda think the focus on identity politics and the 'opression race' is what's wrong with the left. They focus too much on dumb stuff like who shits where. The focus should be economic.","en","relativeinsight","2019-08-01T00:00:00"
"You clearly have some hidden white pride feelings. You should explore them more openly, it would be a healing experience for you.","en","relativeinsight","2019-08-01T00:00:00"
"I don't disagree with most of this but you guys act like Nazis are taking over. Its a little dramatic, most 'Nazis' are just people who hate the establishment.","en","relativeinsight","2019-08-01T00:00:00"
"Contrapoints singlehandedly brought me back from a personal political crisis this week about exactly this sort f shit (me being Justine)","en","relativeinsight","2019-08-01T00:00:00"
"Make the Left great again?","en","relativeinsight","2019-08-01T00:00:00"
"Hahaha.... sublimely superb!","en","relativeinsight","2019-08-01T00:00:00"
"+ContraPoints , this video was brilliant. I come from the conservative end of the spectrum. After watching some of your content, you seriously pose the best points in support of progressive thought. I also noticed that your videos are hardly ever targeted by the likes of Ranting Monkey or Bearing. This video here really shows why that is. You make good content and smart, well thought out, arguments.","en","relativeinsight","2019-08-01T00:00:00"
"This video is a beautiful tribute to all of those Ed Wood films.","en","relativeinsight","2019-08-01T00:00:00"
"hmmm well, I want to see more of your stuff.","en","relativeinsight","2019-08-01T00:00:00"
"Hell, i think the video puts forth a good point - Straight brute force won't win any favor, but going purely for hearts and minds won't either. Nuance, cleverness and a bit of plain luck in what's used where are key.","en","relativeinsight","2019-08-01T00:00:00"
"Was the Cameroon (Kamerun? ... French Congo?) thing made up for this bit? I can't find anything mentioning it.","en","relativeinsight","2019-08-01T00:00:00"
"You should unblock me on twitter, Contra. I promise I'm friendly.","en","relativeinsight","2019-08-01T00:00:00"
"The left hates itself most, true.","en","relativeinsight","2019-08-01T00:00:00"
"...I'm keeping my fursona, damnit! I needed this roast and I'm not alone it looks like. Your videos are great, I can focus on what's being said. I don't know if it's how awesome you are or if I've opened my mind more from the doubt and reflection? I clicked so fast in the middle of my How It's Made bingeing, but I jumped when the lefty came out from the curtain. :'U(Amygdala tamed.) Centrists are just living and I need to chill more when approached. I'm in good company now with fellow leftists who have it together, few learning and farther ahead. I need to suck it up and ask for help. I've forgotten how I got to the left and I think if I met myself a few years ago I'd be quite upset about where I'm at, politics and praxis wise. Cause it's going nowhere good. I'd like to help my fellow SJWs who don't have it together, once I do. Maybe not approach them, but share my progress and of course these videos!","en","relativeinsight","2019-08-01T00:00:00"
"Hey Contra...it would have been more accurate for you to wear a red balakava, black hoodie, and come out waving a ANTIFA flag in order to be more up-to-date with the new 2017 fascist look...just sayin....","en","relativeinsight","2019-08-01T00:00:00"
"Please make sequels.","en","relativeinsight","2019-08-01T00:00:00"
"I always hate how the right hijack the best composers","en","relativeinsight","2019-08-01T00:00:00"
"So talented. Just love this so much!!!!","en","relativeinsight","2019-08-01T00:00:00"
"Why are you playing chess without dice and the loud call 'Cheeeeesssssssssssssss!' if you roll snakeyes and fold the board?  But nice video.","en","relativeinsight","2019-08-01T00:00:00"
"The whole 'communism is always bloody and leads to famine' thing? Yeah, San Marino and the Indian state of Kerala would like to have a word with anyone who says that. These regions both elected communist governments and did pretty damn well for themselves. San Marino's commies (actually a coalition of the Sanmarinese Communist and Socialist Parties) held office from 1945 to 1957 and were voted out peacefully in the end. As for Kerala, they turned out better off than much of the rest of India.  I wouldn't mind if we Americans gave communism the old college try for one year if it meant kicking the rich in the ass and stopping 45. Take one year to go commie and redistribute all the wealth. After that year is up, we then adopt a blend of European social democracy and Chinese socialism--the best of both and none of the flaws of either. From there, we'd only go communist once every fifty years to keep the playing field level. If you decide you don't like it, you'd only have to go through it once, maybe twice tops. Maybe three times if you're born in a commie year AND make it to your 100th birthday. And keep in mind that this is coming from a guy whose politics are a mix of left-libertarianism, anarcho-socialism, technocracy, and a dash of Maoism.","en","relativeinsight","2019-08-01T00:00:00"
"I don't agree with much of your stuff but you are truly talented. That was well done. Very entertaining and thought provoking. Thanks for making the effort.","en","relativeinsight","2019-08-01T00:00:00"
"I work at a really progressive media outlet and we don't ever talk about Marx or Hegel, so I am feeling like the leftist is kinda a strawman, (though I recognize some of the antifa arguments),  having said that, the points you make are pretty interesting.  Keep on keeping on!","en","relativeinsight","2019-08-01T00:00:00"
"Why do the left defend communism so much? Why is it always 'I'm 100% right on everything' with you people? Btw I'm not a Nazi before you liberals start calling me that","en","relativeinsight","2019-08-01T00:00:00"
"Lindsay Ellis sent me to your channel.  You are amazing.","en","relativeinsight","2019-08-01T00:00:00"
"Absolutely genius video. I applaud you","en","relativeinsight","2019-08-01T00:00:00"
"This is the best thing I've ever seen.","en","relativeinsight","2019-08-01T00:00:00"
"I thought I was straight until I discovered this channel the content is amazing and so well acted out","en","relativeinsight","2019-08-01T00:00:00"
"Ok were did you get 5:38 song?  I want to know!!!!!  you make good vids.  I love your face x2 and 3,  but 4?????","en","relativeinsight","2019-08-01T00:00:00"
"Love how all the characters are so chill and engaging, great job","en","relativeinsight","2019-08-01T00:00:00"
"rip bruce and trixie","en","relativeinsight","2019-08-01T00:00:00"
"'well, it's more of a bourgeois afternoon tea..' *'afternoon tea?!?!'* hahahahaaaha","en","relativeinsight","2019-08-01T00:00:00"
"Very, very, very, very well done. Certain tools of psychology could be used to help many learn to be ice cold, primarily cognitive behavioral therapy and dialectical behavioral therapy.","en","relativeinsight","2019-08-01T00:00:00"
"'The Rose stays' wtf is this renegade kautskyite bullshit.","en","relativeinsight","2019-08-01T00:00:00"
"The Left needs to rebrand. Facts don't win arguments, emotions do, and how the issue affects the person you're trying to convince. It's up to us to swallow our pride for the greater good - we gotta make this freedom shit palatable to normies. It might feel degrading to sanitize yourself and dumb everything down, but is it worth the alternative?","en","relativeinsight","2019-08-01T00:00:00"
"patton oslwalt say cool is the enemy of comedy, maybe even the enemy of life....","en","relativeinsight","2019-08-01T00:00:00"
"'Liberals get the bullet too'  Does that include minority liberals? Sounds wacist.","en","relativeinsight","2019-08-01T00:00:00"
"This was hilarious and nice lamp, too haha.","en","relativeinsight","2019-08-01T00:00:00"
"Death to capitalist Hail Satan lmao","en","relativeinsight","2019-08-01T00:00:00"
"Give anarchy a chance though","en","relativeinsight","2019-08-01T00:00:00"
"the hands. the fucking hands are so perfect","en","relativeinsight","2019-08-01T00:00:00"
"i love you and your videos so........much................","en","relativeinsight","2019-08-01T00:00:00"
"This one is my fave, watched it several times. Any chance you could throw raddle.me a plug?","en","relativeinsight","2019-08-01T00:00:00"
"I WILL NOT GET RID OF MY HAMMER AND SICKLE!","en","relativeinsight","2019-08-01T00:00:00"
"Poly tics . Yes lets fix the broken  thing by useing it to repair  lol .","en","relativeinsight","2019-08-01T00:00:00"
"Yeah that was not sided at all. So even this guy thinks there is nothing wrong happening in the refugee front, they just let them come and destroy everything we love and it is fine. We can't say anything about it, if these people had the technology they would stop you for even thinking about saying anything. Also you do know you would be stoned to death in a muslim country. Even in Germany there have been stoning of trans people but that's fine so long as those poor 'refugee children' get a place to live and free money for doing nothing at all. There is no good explanation to be ignorant at the times of internet, you can google the stoning's in Germany or mass rapes in England sad so sad.","en","relativeinsight","2019-08-01T00:00:00"
"You walk out to your driveway one morning, to see a hunched figure beside your car.  You hear a loud scraping sound, so you run up to the person. 'HEY! WHAT THE HELL ARE YOU DOING?' The person slowly rises to their feet and stares at you. Fury radiates from their face. You find yourself face to face with a leftist.  'Every day, at least one black person is killed by the police. The amount of police officers who've faced consequences for the murder of black-'  You look over to your car. The letters 'BLM' have been scraped into the paint.  You turn to the leftist.   'WHAT THE FUCK? WHAT HAVE YOU DONE TO MY CAR?'   The leftist's face contorts into a snarl. Their eyes well up with tears.   'Fuck your car', sobs the leftist. 'Fuck your privileged life. Black people are D Y I N G.'  You stand there in disbelief as you attempt to process the situation.  You look once more at the letters now etched into your passenger side door. You look again at the figure standing before you. Their fists are clenched, eyes full of defiance. You are furious. 'Listen to me, fuckface. I don't know who you are or what your fucking problem is. But you better believe you're paying for a new paint job to get this shit covered up.'  'Typical' , the leftist hisses. The word is said with such venom that you begin to wonder if this is one of those reptilians your crazy uncle Alex was always yammering on about.   'White people care more about scratched paint than they do about people of color.' The leftist is crying again.  You've had enough. You tell the leftist that you're calling the cops. The leftist immediately takes off down the street.   'FUCKING RACIST!' They yell, as they disappear from view.","en","relativeinsight","2019-08-01T00:00:00"
"Tankies ruin everything but centrists aren't helpful either.","en","relativeinsight","2019-08-01T00:00:00"
"Briiiiiiliant","en","relativeinsight","2019-08-01T00:00:00"
"facts over feelings bud not the other way around","en","relativeinsight","2019-08-01T00:00:00"
"What is the video or link to the 1910 to 1912 awesome communism? Really having hard time finding something positive from that time. If you find something, cool thanks mates, pass it on to me or to somewhere I could see it. If not I really like the parody. In the end the humor comes from the suffering.","en","relativeinsight","2019-08-01T00:00:00"
"Where did you get the black and white wig? It's beautiful! <3","en","relativeinsight","2019-08-01T00:00:00"
"antifa isn't our PR problem. our PR problem is corporate media itself. even if antifa were about giving out puppies and hugs to nazis, as long as it was anti-capitalist and anti-platformist, it would be opposed by the media. try again.","en","relativeinsight","2019-08-01T00:00:00"
"'Lots of brands' Okay now that's even more offensive than 'liberals get the bullet too.'","en","relativeinsight","2019-08-01T00:00:00"
"'Liberals get the bullet too.'  FFS I have no problem with communism but you can't free a socety by killing 97% of its population.","en","relativeinsight","2019-08-01T00:00:00"
"'Right to exist under attack.' Oh dear... I'm getting confused between fascists and right wingers in Israel.","en","relativeinsight","2019-08-01T00:00:00"
"Hey Contra, a young (13yo) friend of mine has started down a dark path, i.e. Milo Y, and I really don't want him to get too fashy. What do you recommend that I do?","en","relativeinsight","2019-08-01T00:00:00"
"Leftists have optics cucks too haha","en","relativeinsight","2019-08-01T00:00:00"
"'Drinking Victory Jin from a rusty herring tin'Is brilliant.","en","relativeinsight","2019-08-01T00:00:00"
"I don't know if I can give up the gulag memes though...","en","relativeinsight","2019-08-01T00:00:00"
"This is so well done I forgot I wasn't watching a conversation between two different people. I mean the flow alone, it's really impressive.","en","relativeinsight","2019-08-01T00:00:00"
"I think the Achilles heel of the Left may be it's own integrity. The Right is willing to compromise on its values (temporarily) to gain favor. They are willing to lie, mislead, and keep secrets. The Left however is constantly and relentlessly cleaning house. The Left always puts all its cards on the table. Truth be told I don't think it's a bad thing. Our rhetoric is honest, but not always persuasive. I don't think the solution is to lie or even leave out, our honesty is a great strength. We just need practice our asses off in regards to peursuasion and public speaking. If we can get people with charisma and counterargument skills Leftism can stand a chance.","en","relativeinsight","2019-08-01T00:00:00"
"This is the first time I watched one of her videos and I am pretty incredulous right now.","en","relativeinsight","2019-08-01T00:00:00"
"LIBERALS COULD BE LISTENING","en","relativeinsight","2019-08-01T00:00:00"
"0:04 DID YOU JUST ASSUME THEIR GENDERS????????????????????","en","relativeinsight","2019-08-01T00:00:00"
"2:44 This is what the left actually believes","en","relativeinsight","2019-08-01T00:00:00"
"Anti-Kommunistische Aktion","en","relativeinsight","2019-08-01T00:00:00"
"'you go to brunch'  Brunchers get the bullet too","en","relativeinsight","2019-08-01T00:00:00"
">Not talking about revolutionary catalonia  TRIGGERED","en","relativeinsight","2019-08-01T00:00:00"
"'Liberals get the bullet too'  Guillotines and bullets? Plz no, that just confuses it.","en","relativeinsight","2019-08-01T00:00:00"
"'Do you have any friends who aren't millitant leftists?'  I'll have you know my friendship group encompasses all types of shades of political opinion equally:  0 leftists 0 fascists 0 liberals 0 conservatives 0 libertarians  EQUALITY!","en","relativeinsight","2019-08-01T00:00:00"
">Marxist Communism  >Not Baukninian Anarchism  Tabby is not my conrad","en","relativeinsight","2019-08-01T00:00:00"
"'Trotskitist tendencies'  I didn't know Contra was a newspaper deliverer","en","relativeinsight","2019-08-01T00:00:00"
"Is Tabby a new Political Ideology Cat Girl?","en","relativeinsight","2019-08-01T00:00:00"
"To share on facebook or not to share on facebook. That is the question","en","relativeinsight","2019-08-01T00:00:00"
"Hey I'm not sure where to say this but I think at one point far in the past I came to your channel and left some mean comment because I was not alt-right but far too invested in the for lack of a better term 'skeptic community'. regardless I'm sorry I've come to really enjoy your content and I just wanted to say that.","en","relativeinsight","2019-08-01T00:00:00"
"circus came to town?","en","relativeinsight","2019-08-01T00:00:00"
"Can we have this tabby character come back again","en","relativeinsight","2019-08-01T00:00:00"
"This would make a great cartoon on adult swim.","en","relativeinsight","2019-08-01T00:00:00"
"'You go to bruch with these people?!'   oh i just got that lmao","en","relativeinsight","2019-08-01T00:00:00"
"You're a talented and handsome man.","en","relativeinsight","2019-08-01T00:00:00"
"Stalinist USSR was a socialist society and then Krushchev implemented revisionist policies.","en","relativeinsight","2019-08-01T00:00:00"
"Wow... these videos are really well made.","en","relativeinsight","2019-08-01T00:00:00"
"Defensive violence and doxing ...hahahahahah...","en","relativeinsight","2019-08-01T00:00:00"
"You have such a big budget for such a small crowd ...fastest way to throw money down the toilet ...","en","relativeinsight","2019-08-01T00:00:00"
"Is there really a segment of the left like the one you're describing? That's not a rhetorical question, I don't quite get your description. Further, if you're going to criticize certain parts of the left for bad strategy I would suggest that your own strategy is a little flawed. Mainly, because you're criticizing the left, too publicly, in front of a youtube audience who want to cling on to anything negative about the left they can find.","en","relativeinsight","2019-08-01T00:00:00"
"I would do things for a quality link to that Vaporwave Marx Engels Reader cover. Shameful things.","en","relativeinsight","2019-08-01T00:00:00"
"What a script.","en","relativeinsight","2019-08-01T00:00:00"
"'Trans antifa cat girls' is a fun line.","en","relativeinsight","2019-08-01T00:00:00"
"So accurate omg.","en","relativeinsight","2019-08-01T00:00:00"
"These videos are absolutely beautiful...","en","relativeinsight","2019-08-01T00:00:00"
"very gay... good show.","en","relativeinsight","2019-08-01T00:00:00"
"real talk, though: why does Tabby, the leftist, criticize Justine as a 'Trotskyist' when Tabby doesn't even recognize the Soviet Union as a legitimate form of existing socialism, and on top of that, is an anarcho-syndicalist herself ? huh, tabby ?","en","relativeinsight","2019-08-01T00:00:00"
"People only ever want to deal in ideology any more. It's never about the sociology, or the economics, or the philosophical principles. It's get in line, follow the pack, and don't think about it.","en","relativeinsight","2019-08-01T00:00:00"
"Hello! I really enjoy your videos. Do you have any other social media I can follow you on?","en","relativeinsight","2019-08-01T00:00:00"
"I 100% disagree with most of the politics discussed here, but this is hilarious. You're the best Leftist!","en","relativeinsight","2019-08-01T00:00:00"
"sublation? Did you mean Hegelian sublation?  'The biggest problem is SJW's not cool'.....omg, sweety, what you.....wait, oh shit,   is it patronizing to say sweety since you're a girl?   Is that a problematic?   Should I spend hours parsing through what amounts to the rationally unjustified moral feelings of the progressive stack informed by deep seated Nietzschian Christian ethic of the supremacy of the poor in order to discover a loosely held set of interpretations from a coalition of contradictory lenses ....   what would I do without such CONSISTENCY and CLARITY OF VISION and EMPATHY FOR EVERYONE and RATIONAL ARGUMENT WHICH TAKES ON THE BURDEN OF PERSUASION and RECOGNIZES HAVING DIFFERENT RULES FOR MARGINALIZED PEOPLE IS SOFT BIGOTRY EVEN IF YOU THINK ITS JUSTIFIED and MAKES MORAL ARGUMENTS INSTEAD OF ASSUMING DISAGREEMENT EQUALS BIGOTRY","en","relativeinsight","2019-08-01T00:00:00"
"Very good video, and it helped me understand more about how confused the far-left actually is.  For instance, do you realize that 'Centrists', and your average low and middle class Capitalist, think a lot of the same things about Leftist, Socialists and Communists, as you do about us (this is very paradoxical).  Also, I can't see how you can truly believe that long-term Marxism (in a free society) can actually work (ever), on a scale as big as the US (especially without the assimilation of diversity), let alone, the entire world, especially using your 'personal property' clause... materialism is a definite no-no, in most Marxist camps.  The US may have a lot of problems and flaws, but people here are 100% better off than most of the world (including other western cultures), so we are doing something right.  Wouldn't the ideal solution be to 'upgrade' our current system... fine tune it?  Take all the energy and resources use against it, and peacefully, make it better!  There is no true consensus of how Marxism would even work.  People have been trying to understand how it would work for about 170 years, and still can't figure it out.  The 'True Marxism has never been tried' argument is flawed, because there are thousands of ideas of 'True Marxism'... I even have a few of my own, and I know it's BS, but still a fun intellectual exercise.  And that's what it IS, an Intellectual Exercise... and should stay that way.  Because for ANY of it to work, eventually, individuality, personal freedoms, artistic talents and creative expressions, would have to be put on the back burner, behind the collective and total equality of outcome... to curb the chances of jealousy and envy (can't have those pesky feelings in an equal society).  All this would incubate and give birth to a thriving underground and black market, of creative people who can't live in such a stifling world, with just as many vices and power struggles, but no control over them.  And, this could only end with 2 outcomes: 1) sever punishment of these ingrates... further stifling person expressions and freedoms.  2) Counter Revolution... which is the eventual outcome.  Why?  Because people need to be free to have their own ideas (and stuff), and ain't NO commie gonna make them feel guilty about going to 'brunch with THESE people'!!","en","relativeinsight","2019-08-01T00:00:00"
"Tabby's reaction to Laborwave Marxism killed me.","en","relativeinsight","2019-08-01T00:00:00"
"contrapoints has by far the best comment section in all of YouTubedom.","en","relativeinsight","2019-08-01T00:00:00"
"#molesttheleft","en","relativeinsight","2019-08-01T00:00:00"
"What is the leftist equivalent of Ben Shapiro? I guess when Neo-Nazis start organising en mass to disrupt their speeches we'll know. (actual genuine question though-sincerely, an Australian friend).","en","relativeinsight","2019-08-01T00:00:00"
"2:30 King attack queen?dude you can't play chess","en","relativeinsight","2019-08-01T00:00:00"
"I just analysed the chess board and moves at the beginning and I think it gave me 4 aneurysms","en","relativeinsight","2019-08-01T00:00:00"
"2:30 that's an illegal move","en","relativeinsight","2019-08-01T00:00:00"
"This channel is basically the Murdoch Murdoch of the left, and I actually enjoy it!","en","relativeinsight","2019-08-01T00:00:00"
"I just have to say that you are the absolute best.","en","relativeinsight","2019-08-01T00:00:00"
"5:50 Lmao I'm dying! This is too good! I love your characters Contra! <3","en","relativeinsight","2019-08-01T00:00:00"
