"Text","Language","Source","Date"
"you are amazing.","en","relativeinsight","2019-08-01T00:00:00"
"4:15 Wait, Rousch V fucked Notch?   That's kinda hot, tbh...","en","relativeinsight","2019-08-01T00:00:00"
"thought this guy was a woman at first","en","relativeinsight","2019-08-01T00:00:00"
"Lmao, 7:50","en","relativeinsight","2019-08-01T00:00:00"
"Contra, you pack punches. Your shit is so high quality people don't want to mess with you.","en","relativeinsight","2019-08-01T00:00:00"
"Eating pussy  Stoya  ContraPoints  PUA ","en","relativeinsight","2019-08-01T00:00:00"
"You are absolutely too attractive, and I am absolutely too drunk.","en","relativeinsight","2019-08-01T00:00:00"
"Fuck me I'm a straight man and I found the oyster part arousing.","en","relativeinsight","2019-08-01T00:00:00"
">Eating clams  As subtle as a metaphor about cunnilingus.","en","relativeinsight","2019-08-01T00:00:00"
"oh thank god I am not the only one who hates 'dodaledo'.   why does that make my skin crawl?","en","relativeinsight","2019-08-01T00:00:00"
"I'm deeply disappointed by your unflattering, disparaging, and tactless commentary on Mozart's Don Giovanni. In fact, you might even say I'm 'triggered.'","en","relativeinsight","2019-08-01T00:00:00"
"The spirit of love's eyeliner is ON POINT","en","relativeinsight","2019-08-01T00:00:00"
"You wonderful creature, you. <3","en","relativeinsight","2019-08-01T00:00:00"
"OMG, the 'Try the wine' was so funny! :D","en","relativeinsight","2019-08-01T00:00:00"
"So I'm about 3 hours deep into a ContraPoints rabbit hole after just finding out about this channel. I love your takes on things. I also love your humor. Which confuses me because it is vaguely nightmarish and unsettling.","en","relativeinsight","2019-08-01T00:00:00"
"I dig your trashy Lestat vibe in this vid. Subbed.","en","relativeinsight","2019-08-01T00:00:00"
"'A boring white weirdo named Kirkegaard.' Uh, cool. Are you joking about that little bit or is this more rage against the machine?","en","relativeinsight","2019-08-01T00:00:00"
"'Porn is my teacher' - haha yeah he's terrible!","en","relativeinsight","2019-08-01T00:00:00"
"Jesus, when you started eating oysters I almost sprayed sweet and sour pork all over my tablet...!","en","relativeinsight","2019-08-01T00:00:00"
"Apropos of nothing this Roosh V. is not physically attractive, so I do not get the appeal.  I completely understand allowing oneself to be seduced by someone who's actually hott, but this dude, no.","en","relativeinsight","2019-08-01T00:00:00"
"God I want CP to BHANG me.","en","relativeinsight","2019-08-01T00:00:00"
"BWANG!","en","relativeinsight","2019-08-01T00:00:00"
"you left out the fact that Rooshs book is pretty much a manual on emotional abuse. Gas lighting, negging....etc","en","relativeinsight","2019-08-01T00:00:00"
"1:00 Contra, I honestly think you would nail a lip-synch for your life on RuPaul's Drag Race","en","relativeinsight","2019-08-01T00:00:00"
"Oysters nearly killed me.","en","relativeinsight","2019-08-01T00:00:00"
"Hi. Just wanted to say that I understood everything except the backward svastica.","en","relativeinsight","2019-08-01T00:00:00"
"I never knew 'bang' had so many Hs in","en","relativeinsight","2019-08-01T00:00:00"
"Did you understudy Farinelli?  Christ, Chopin would be flagging this video for using one of his waltzes.","en","relativeinsight","2019-08-01T00:00:00"
"Wise words. Also, ironically, good advice for PUAs out there.   If you have healthy attitudes to sex, care about female pleasure, and are honest and rational: girls will fuck you, and come back for more. Turns out women like pleasure and are fairly reasonable in their pursuit of it.","en","relativeinsight","2019-08-01T00:00:00"
"7:42 Did not say 'bang' properly. Unsubscribed.","en","relativeinsight","2019-08-01T00:00:00"
"John Green calls it that. Not sure if it started with him.","en","relativeinsight","2019-08-01T00:00:00"
"I think they're insecure because they live in a society that constantly tells them their worth is tied to how many women they sleep with. They're just tired of getting picked on for being a virgin and want to show the world that they're not subhuman. That's why they get no pleasure out of it, to them it's more out of obligation than pleasure. It's sad because I'm sure he was more happy playing World of Warcraft, but all the bullying got under his skin and turned him into this. Because so many PUAs seem to be ex-gamers, I wonder if it's because they're conditioned to deal with problems by amassing points or victories, but it's probably just because they get bullied so much by the same media that promotes feminism.","en","relativeinsight","2019-08-01T00:00:00"
"Please do a video on mgtows!!","en","relativeinsight","2019-08-01T00:00:00"
"A large percentage of homosexual men are outrageously promiscuous.  'Pickup artists' don't even come close to having had the sheer number of partners that a good 10% of the gay male population has had.  And yet gay promiscuity is not at all under a similar attack here.  So why aren't you criticizing the gay population for similar behavior?  The reason is simple you are a paternalistic tool that cannot imagine that it is remotely possible that women want sex as much as men do and so you don't view the women involved in 'Pickup' culture as participants, you see them as victims.  You are such a hypocrite describing the 'Bang' as being such a bad thing while being fully aware that there are men showing off their wedding rings under bathroom stalls while you are not bothered by the complete romance free nature of that one bit.  The real problem that SJW culture has with Roosh V is that they cannot stand the reality of the actual sexual preferences and behaviors of a huge segment of the female population and it drives them crazy that huge numbers of women do like aggressive, brash men who do not put up with their crap.  The fact that huge numbers of women respond well to behavior that is completely contrary to the SJW narrative that all men should be weak testosterone-free syncophants who treat women as their lords and masters just drives them up the wall.  Too bad the reality and rhetoric don't match up.  The book focuses on what it focuses on to undo the SJW cultural brainwashing that makes men less attractive to women.  I look forward to your video on Gay pickup culture.","en","relativeinsight","2019-08-01T00:00:00"
"Found you through Blaire White. Best thing that's happened to me on Youtube in a long time. Your videos are pure genius with their editing, ambience and your wit.","en","relativeinsight","2019-08-01T00:00:00"
"I am by no means advocating pick-up artistry myself due to at best practical reasons and at worst that manipulation is a shitty and short term way to engage with women, but a friend of mine who does still believe in pick-up artistry said two things for which I had little reply:  1. That the coin toss analogy falls somewhat flat due to the fact that you cannot modify the coin's behavior in a fair coin toss, while with pick-up artistry you can modify your own behavior each time, and  2. The fact that talking to a woman about what she likes regarding sex or other forms of interactions is somewhat fruitless since there is a significant portion of women, from his experience, that do not know what they want in those categories, so you should try things until you find it rather than simply asking.  Just looking for replies, because sometimes I have trouble articulating my points. I did, at the very least, try to reply to the second point by saying that trying to gauge it is valuable since in the end he did figure out that his girlfriend didn't know. Better to do that rather than assuming.","en","relativeinsight","2019-08-01T00:00:00"
"i think... I'm in love with you","en","relativeinsight","2019-08-01T00:00:00"
"why have i found this channel just now","en","relativeinsight","2019-08-01T00:00:00"
"REEEEEEEEEEEEEEEEEEEEEEEEEEEEEEEE","en","relativeinsight","2019-08-01T00:00:00"
"'I'm a moral person, goddamnit'","en","relativeinsight","2019-08-01T00:00:00"
"Precise. I know one of the original dudes involved in pickup who is actually sick and just wanted to find a descent girl. Roosh always turned me off for all the reasons you just summed up. bleh.","en","relativeinsight","2019-08-01T00:00:00"
"What's the name of the song that plays in the title sequence?","en","relativeinsight","2019-08-01T00:00:00"
"The fact that you're straight gives me hope <3","en","relativeinsight","2019-08-01T00:00:00"
"Ohhhh that oyster scene <3","en","relativeinsight","2019-08-01T00:00:00"
"dee impression near the end?","en","relativeinsight","2019-08-01T00:00:00"
"Well, you helped me hate oysters even worse. Thanks man...","en","relativeinsight","2019-08-01T00:00:00"
"I always show this video first whenever I introduce your channel to new people. It's your best video. Its also a great icebreaker because its generally agreeable that PUA are pretty scummy people to unite together to hate.","en","relativeinsight","2019-08-01T00:00:00"
"I love that I found someone who was as much of an 'evil Sjw' and as much of a classical music nerd as I am on YouTube","en","relativeinsight","2019-08-01T00:00:00"
"I happened upon you today and am compelled  tell  you you are nothing short of  a genius.","en","relativeinsight","2019-08-01T00:00:00"
"After reading Roosh's description of sex I weep for any woman he's bedded I never thought I could experience a bad lay without actually having to participate","en","relativeinsight","2019-08-01T00:00:00"
"Glad you actually read the source. Makes the commentary so much deeper. Cernovich seems like this kind of pit of sadness as well.  On the other side, 'The Art of Charm' guys are sometimes described as 'Pick-Up Artists' and I've found their advice very helpful.","en","relativeinsight","2019-08-01T00:00:00"
"_Bang_","en","relativeinsight","2019-08-01T00:00:00"
"'Amadeus' is awesome.","en","relativeinsight","2019-08-01T00:00:00"
"oh this drag is so fierce and fab!","en","relativeinsight","2019-08-01T00:00:00"
"which part of the opera is that from?","en","relativeinsight","2019-08-01T00:00:00"
"Why tf did you use a picture of The Golden One when you said 'sleep with lots of dudes' I'd rather not sleep with a Nazi.","en","relativeinsight","2019-08-01T00:00:00"
"I love your videos so much :D Keep up the great work","en","relativeinsight","2019-08-01T00:00:00"
"I'm working my way through your back catalogue. EVERY single video is fucking good!","en","relativeinsight","2019-08-01T00:00:00"
"Is Roosh gay? The world may know someday!","en","relativeinsight","2019-08-01T00:00:00"
"bbbaayng","en","relativeinsight","2019-08-01T00:00:00"
"AND I'M A KAFKA FAN","en","relativeinsight","2019-08-01T00:00:00"
"Something tells me that it is not a real woman","en","relativeinsight","2019-08-01T00:00:00"
"no no no Margot","en","relativeinsight","2019-08-01T00:00:00"
"I love your channel and I love your content, but can you please stop ruining food for me?!","en","relativeinsight","2019-08-01T00:00:00"
"5:24 Goddamnit ContraPoints, those are oysters, not clams.","en","relativeinsight","2019-08-01T00:00:00"
"I'm dangerously close to that Don Giovanni mentality. Not rapey, cos a human's political autonomy is very important to me, but it's just a sad existence when all you can think about is having sex for the numbers and not the experience.   Any advise you can give?  :-/","en","relativeinsight","2019-08-01T00:00:00"
"10 points for black mirror screencap usage. ;)","en","relativeinsight","2019-08-01T00:00:00"
"Thanks to you I constantly hear BBBAAAAAAAAAAAAANG in my head","en","relativeinsight","2019-08-01T00:00:00"
"Cunnilingus is a waste! Real men Eat Ass!","en","relativeinsight","2019-08-01T00:00:00"
"In some of your clips, you seem to be channeling HowToBasic.","en","relativeinsight","2019-08-01T00:00:00"
"How to get shitfaced in 10 minutes or less: Drink every time Contra slurs the word Baaaanghhhh. I now have liver failure.","en","relativeinsight","2019-08-01T00:00:00"
"Perhaps Roosh will also be dragged into hell by a ghost statue.","en","relativeinsight","2019-08-01T00:00:00"
"THANK you for this video, I just got here from Chez Lindsay's, and I'm so happy I did. I thought: Who is this elfen fellow? Turns out he's an elfen fellow! Oooohhhhh.","en","relativeinsight","2019-08-01T00:00:00"
"You gotta be handsome and rich! That's it! LOL","en","relativeinsight","2019-08-01T00:00:00"
"the thing about Roosh is I don't think he's ever actually had sex more than 2 or 3 times if ever","en","relativeinsight","2019-08-01T00:00:00"
"Not gonna lie, when I saw the cover photo you have on this video I thought you were Winona Ryder trying to do Hamilton","en","relativeinsight","2019-08-01T00:00:00"
"I came here from Hbomb, wondering what the context for the Red Pill clip is.  Instead, I'm treated to something FUCKING GLORIOUS. +1","en","relativeinsight","2019-08-01T00:00:00"
"roosh is probably gay actually","en","relativeinsight","2019-08-01T00:00:00"
"'just don't rape people' this is surprisingly hard for some people.","en","relativeinsight","2019-08-01T00:00:00"
"What are your thoughts on MGTOW? You should make a vid about it.","en","relativeinsight","2019-08-01T00:00:00"
"The 3 sex positions: Girl-On-Top, Dogging, and Normal.","en","relativeinsight","2019-08-01T00:00:00"
"lol that scene with the Oysters, holy shit","en","relativeinsight","2019-08-01T00:00:00"
"Not really sure if ContraPoints is ripping off Hbomberguy or Hnomberguy is ripping off ContraPoints","en","relativeinsight","2019-08-01T00:00:00"
"to be fair, roosh v is just one PUA out there with his own warped little views....someone else like M from the33secrets is more about practicality and how to confidently approach women","en","relativeinsight","2019-08-01T00:00:00"
"BTW I lost it at the oyster scene.","en","relativeinsight","2019-08-01T00:00:00"
"It hit me when someone wrote about one of his books (Bang Denmark?) where they quoted something like ' [Danish women] with fuck you, but that's it.' And I naively thought huh? I thought sex was the whole point! Well it isn't of course. It is about control. That's why he doesn't talk about sex-that's not what he is about.","en","relativeinsight","2019-08-01T00:00:00"
"Oh damn I recognise that screenshot at 6:58! Black Mirror.","en","relativeinsight","2019-08-01T00:00:00"
"When are we going to approach CP about his alcoholism?","en","relativeinsight","2019-08-01T00:00:00"
"a mint and a half in and im already liked and subscribed !!  so glade Noel Plum mentioned that your channel was worth a watch. XD","en","relativeinsight","2019-08-01T00:00:00"
"I'm really liking your videos. And again, I don't agree with a lot of it, but I don't care so much because you're entertaining!","en","relativeinsight","2019-08-01T00:00:00"
"It's all about how other men look at you...  or rather how you imagine they look at you.  These are very fundamentally insecure people.","en","relativeinsight","2019-08-01T00:00:00"
"Ah, a video where I completely agree with you! And the video was amazing and hilarious too, but that's no surprise :P","en","relativeinsight","2019-08-01T00:00:00"
"I havent had sex in 9 years","en","relativeinsight","2019-08-01T00:00:00"
"Found your channel today during my lunch break, I've got work to do... but damnit I can't quit these video!!","en","relativeinsight","2019-08-01T00:00:00"
"your depiction of oral sex was gold :D","en","relativeinsight","2019-08-01T00:00:00"
"I like sex, roosh is a rapist with a borderline personality disorder","en","relativeinsight","2019-08-01T00:00:00"
"Only just discovered your chanel today via Dick Coughlan link on his FB wall.  I'm working my through your vids from old to most recent and have to say, I'm loving every single video I've watched so far, and an looking forward to learning more <3","en","relativeinsight","2019-08-01T00:00:00"
"Every time you said 'b a n g' I giggled.","en","relativeinsight","2019-08-01T00:00:00"
"I recommend improving yourself and being confident with who you are. Most of these PUAs, from a thorough study of the topic, are emotionally unstable and are just seeking to stroke their egos so they have something to fill that void of self-esteem. People only fins PUAs who don't actually have natural, deserved self-esteem repulsive because they sound rapey, even on the surface.   Just make yourself everyone wants to sleep with by being your best self. The best PUAs seem to advocate exactly that and use 'game' just to teach you some simple basics of communication you should have learned when you were growing up and probably didn't which lead to your low self esteem and lead you to game in the first place.","en","relativeinsight","2019-08-01T00:00:00"
"I just love the yout videos so much!!!","en","relativeinsight","2019-08-01T00:00:00"
"I worry for your liver, great videos though. xx","en","relativeinsight","2019-08-01T00:00:00"
"wait are you bisexual cause I'm bisexual and that would be cool","en","relativeinsight","2019-08-01T00:00:00"
"AHHHHHHHHHHHH YOU ARE A FUCKING ABOMINATION, EWWWWWWWWWWW FUCK!","en","relativeinsight","2019-08-01T00:00:00"
"I don't think you realize that a man's promiscuity or ability to get sex is strongly tied to his social worth. The dynamics for men and women are not equivalent, mainly because our society and biology aren't either. Say what you will, but there is evidence that women are more attracted to a man who gets a lot of ass than not. With men's it's usually the opposite in regards to women.","en","relativeinsight","2019-08-01T00:00:00"
"Honestly. After watching all of your videos like three times, I feel inspired. To do this myself. I donno, maybe it'll be terrible. But I'm from Louisiana, and considering how fucking backwards this place is, I've got a lot to say. At the very least.","en","relativeinsight","2019-08-01T00:00:00"
"Wow your stuff is so hilarious and ingenious. Love it.","en","relativeinsight","2019-08-01T00:00:00"
"Came here from Noelplum. I must say some refreshing angles here, presented in a funny way ;-)  What I really don't get is that most men (at least all the ones I know) are not into sleeping with many women, but sleeping with one woman over and over again. And hopefully giving and receiving pleasure in the act. I mean isn't the whole point to pick up or be picked up by just one woman and then stay together and enhance and nourish the sexual fun you have together and also cherish the positive emotions the partner feels? I mean it's not only a good feeling to come yourself, but also to make her (or him or whatever) come. Seeing and giving pleasure is another form of extra pleasure so to say.  So why train pickung up women over and over, wouldn't it make much more sense to make guides on how to keep your relationship alive and happy and long lasting? Also I wouldn't want to manipulate a woman into sleeping with me, even if I am single, she is hot and it works. But then again, I am from Germany and from a background that many would describe as white privilege, so I probably don't count.","en","relativeinsight","2019-08-01T00:00:00"
"I disagree with you on a lot of things but this video was spot on","en","relativeinsight","2019-08-01T00:00:00"
"IIRC Roosh V is of muslim background which might be relevant to the discussion.","en","relativeinsight","2019-08-01T00:00:00"
"Seriously his profile is so gorgeous and he's so clever i love him more than a thousand ice cream cones","en","relativeinsight","2019-08-01T00:00:00"
"The fact that Roosh.V admits that he learned about sex from porn says a lot, especially since porn is made for men and only men, and the actresses always fake orgasm in them XD I can now only guess what he's like in bed.... really bad XD","en","relativeinsight","2019-08-01T00:00:00"
"I'm glad you appreciate good wine...  Have another glass.","en","relativeinsight","2019-08-01T00:00:00"
"This is probably the only video of yours I agree with so far. Mostly because I despise consumerism and pickup artists seem just like it, getting as much crappy stuff and then throw it away without even enjoying it in order to get some other crappy stuff.","en","relativeinsight","2019-08-01T00:00:00"
"NEVER. STOP. MAKING. VIDEOS !  ","en","relativeinsight","2019-08-01T00:00:00"
"My eye scanning combined your handle with the title to form 'Pick-Up Con Artists'. Surely this was an innocent mistake.","en","relativeinsight","2019-08-01T00:00:00"
"You are quite a beautiful and genuinely funny person... I'm tired of making points... so have a compliment.","en","relativeinsight","2019-08-01T00:00:00"
"For fuck's sake please leave Don Giovanni out of this, it doesn't deserve to be used in your agenda.","en","relativeinsight","2019-08-01T00:00:00"
"I bhhaaanged this video twice, i was gentle and considerate. but now it won't call me back or respond to my texts, wtf?! i have no choice but to become an anti-youtube-video youtuber and expose the evil youtube-videoarchy oppressing us proper, alpha videosexual males.","en","relativeinsight","2019-08-01T00:00:00"
"Hmm, one word comes to mind. Erotomania.","en","relativeinsight","2019-08-01T00:00:00"
"I like this video so much so I banged it","en","relativeinsight","2019-08-01T00:00:00"
"ok, OK. O Fucking K. Qre you gay, straight, bi, what?!?!?! WHAT! because my masturbatory fantasies feel more realistic when I know there is a chance and you got me pretty confused (and aroused) but mostly confused (just keeding, aroused too).","en","relativeinsight","2019-08-01T00:00:00"
"you look great but please don't do 80 push ups a day you will accumulate scar tissue underneath your deltoids and encounter pectoral deficiency when you are older invest in a set of dumbbells or even a bar bell and do a chest press instead","en","relativeinsight","2019-08-01T00:00:00"
"PLEASE GET FAMOUS WE NEED PEOPLE LIKE YOU TO BE FAMOUS","en","relativeinsight","2019-08-01T00:00:00"
"I can't 'like' this video out of protest for the honor of wheezy waiter (my first youtube love, and the creator the dubblydoo) how dare you dislike his perfect name!","en","relativeinsight","2019-08-01T00:00:00"
"Why would a man want to have sex with hundreds of women? Because he wants HIV and a whole bunch of illegitimate kids?","en","relativeinsight","2019-08-01T00:00:00"
"Am I the only person who'd read a matriarchal version of The Handmaid's Tale?","en","relativeinsight","2019-08-01T00:00:00"
"Man, I haven't seen your face in like what, 6-7 years now? I'm so glad you're back on youtube. Wish I had found this channel sooner. Cheers, Nick.","en","relativeinsight","2019-08-01T00:00:00"
"biology drives men to want more sex than women","en","relativeinsight","2019-08-01T00:00:00"
"this is my favorite youtube channel now. thank you!","en","relativeinsight","2019-08-01T00:00:00"
"You are hilarious and accurate. All I can say is I am convinced Don G. was a sex addict  and egomaniac","en","relativeinsight","2019-08-01T00:00:00"
"now i know you watch black mirror, good stuff  v good video!","en","relativeinsight","2019-08-01T00:00:00"
"I really love that you speak with your own voice and have unusual and unique opinions.  While I don't always agree with you, I find it really refreshing, almost like Kat Blaque.","en","relativeinsight","2019-08-01T00:00:00"
"is it wrong that I snickered uncontrollably every time you lowered your voice to creepily say 'bang?'","en","relativeinsight","2019-08-01T00:00:00"
"'dooblydoo' was a term coined by 'wheezywaiter' 8ish(i think?) years ago, that was then widely popularized by the vlogbrothers. I don't recall there ever being any sort of sense behind the term. Just something wheezy started doing that stuck.  goodGoodGood video, btw. First I've seen of yours.","en","relativeinsight","2019-08-01T00:00:00"
"Shine on you crazy diamond!","en","relativeinsight","2019-08-01T00:00:00"
"At least you still have the old school, edgy, youtuber entertainment caliber. This new generation is so vanilla that I could scoop up their content from my computer screen, plop it on a waffle cone and enjoy. They're so watered down that I could watch their videos in a chem lab and make homeopathic 'medicine' from their manner of presentation. It's like Justin Beiber cloned himself a billion times and created an industry. Even the Emos are smiley, pleasant, and family friendly, good Gods! Youtube has become one big Disney movie with no end credits.","en","relativeinsight","2019-08-01T00:00:00"
"Holy sh*t, I'm glad you started making youtube videos again. Brightened my day!","en","relativeinsight","2019-08-01T00:00:00"
"You only addressed the most fucked up examples of PUAs (Rosh and Red Pill dude). Kinda reminds me of Sargon talking about feminists and citing Chanty Binx as their main example.  Also, 7:26 SAILOR MOON!!! #win","en","relativeinsight","2019-08-01T00:00:00"
"I'm in a kind of anti-feminist echo chamber on youtube lately and I'm wondering if there are any other pro-feminist channels as good as this one? I'd really like to hear the other side of the argument sometimes.","en","relativeinsight","2019-08-01T00:00:00"
"So, I'm here from your Patreon - as Lindsey Ellis is a patron and Patreon emailed it to me, and I'm loving your show, especially all the ways you say 'bang' in this episode XD","en","relativeinsight","2019-08-01T00:00:00"
"great video, great make up. kinda want to watch/listen to don giovanni now.","en","relativeinsight","2019-08-01T00:00:00"
"What are your thoughts on 'rape culture.'","en","relativeinsight","2019-08-01T00:00:00"
"Baaahhnnging ahahaha.   Maybe Manson's Models for a less delusional text?","en","relativeinsight","2019-08-01T00:00:00"
"New discovery - where have I been all this time? - LOVE the videos & everything...this is fun & fantastic.","en","relativeinsight","2019-08-01T00:00:00"
